{5} setUpClass (tempest.api.volume.admin.test_encrypted_volumes_extend.EncryptedVolumesExtendAttachedTest) ... SKIPPED: Attached encrypted volume extend is disabled.
{0} setUpClass (tempest.api.volume.test_volumes_backup.VolumesBackupsV39Test) ... SKIPPED: Cinder backup feature disabled
{1} setUpClass (tempest.api.volume.admin.test_multi_backend.VolumeMultiBackendTest) ... SKIPPED: Cinder multi-backend feature disabled
{2} setUpClass (tempest.api.volume.admin.test_volume_retype.VolumeRetypeWithMigrationTest) ... SKIPPED: Cinder multi-backend feature disabled
{30} tempest.api.volume.test_volumes_get.VolumesSummaryTest.test_show_volume_summary [1.437496s] ... ok
{38} tempest.api.volume.test_versions.VersionsTest.test_list_versions [1.242765s] ... ok
{31} tempest.api.volume.test_availability_zone.AvailabilityZoneTestJSON.test_get_availability_zone_list [1.281631s] ... ok
{34} tempest.api.volume.test_extensions.ExtensionsTestJSON.test_list_extensions [1.479302s] ... ok
{21} tempest.api.volume.test_volumes_snapshots_negative.VolumesSnapshotNegativeTestJSON.test_create_snapshot_with_nonexistent_volume_id [1.542602s] ... ok
{21} tempest.api.volume.test_volumes_snapshots_negative.VolumesSnapshotNegativeTestJSON.test_create_snapshot_without_passing_volume_id [0.043402s] ... ok
{21} tempest.api.volume.test_volumes_snapshots_negative.VolumesSnapshotNegativeTestJSON.test_list_snapshot_invalid_param_limit [0.296683s] ... ok
{38} tempest.api.volume.test_versions.VersionsTest.test_show_version [0.849509s] ... ok
{21} tempest.api.volume.test_volumes_snapshots_negative.VolumesSnapshotNegativeTestJSON.test_list_snapshots_invalid_param_marker [0.215451s] ... ok
{22} tempest.api.volume.admin.test_volume_types_negative.VolumeTypesNegativeTest.test_create_volume_type_encryption_nonexistent_type_id [0.543786s] ... ok
{21} tempest.api.volume.test_volumes_snapshots_negative.VolumesSnapshotNegativeTestJSON.test_list_snapshots_invalid_param_sort [0.243365s] ... ok
{18} tempest.api.volume.admin.test_volume_quota_classes.VolumeQuotaClassesTest.test_show_default_quota [0.476864s] ... ok
{12} tempest.api.volume.admin.test_volume_services.VolumesServicesTestJSON.test_get_service_by_host_name [0.235977s] ... ok
{32} tempest.api.volume.admin.test_volume_hosts.VolumeHostsAdminTestsJSON.test_list_hosts [0.396364s] ... ok
{12} tempest.api.volume.admin.test_volume_services.VolumesServicesTestJSON.test_get_service_by_service_and_host_name [0.291149s] ... ok
{29} tempest.api.volume.admin.test_volume_types_extra_specs_negative.ExtraSpecsNegativeTest.test_create_invalid_body [0.271090s] ... ok
{33} tempest.api.volume.admin.test_volume_services_negative.VolumeServicesNegativeTest.test_disable_log_reason_with_no_reason [0.184626s] ... ok
{27} tempest.api.volume.admin.test_volume_pools.VolumePoolsAdminTestsJSON.test_get_pools_with_details [0.966723s] ... ok
{12} tempest.api.volume.admin.test_volume_services.VolumesServicesTestJSON.test_get_service_by_service_binary_name [0.345049s] ... ok
{29} tempest.api.volume.admin.test_volume_types_extra_specs_negative.ExtraSpecsNegativeTest.test_create_none_body [0.379324s] ... ok
{20} tempest.api.volume.admin.test_volume_types.VolumeTypesTest.test_volume_type_create_get_delete [2.336480s] ... ok
{33} tempest.api.volume.admin.test_volume_services_negative.VolumeServicesNegativeTest.test_disable_service_with_invalid_binary [1.208526s] ... ok
{29} tempest.api.volume.admin.test_volume_types_extra_specs_negative.ExtraSpecsNegativeTest.test_create_nonexistent_type_id [1.191816s] ... ok
{33} tempest.api.volume.admin.test_volume_services_negative.VolumeServicesNegativeTest.test_enable_service_with_invalid_host [0.430598s] ... ok
{27} tempest.api.volume.admin.test_volume_pools.VolumePoolsAdminTestsJSON.test_get_pools_without_details [1.707512s] ... ok
{22} tempest.api.volume.admin.test_volume_types_negative.VolumeTypesNegativeTest.test_create_volume_with_private_volume_type [2.350474s] ... ok
{29} tempest.api.volume.admin.test_volume_types_extra_specs_negative.ExtraSpecsNegativeTest.test_delete_nonexistent_volume_type_id [0.376014s] ... ok
{33} tempest.api.volume.admin.test_volume_services_negative.VolumeServicesNegativeTest.test_freeze_host_with_invalid_host [0.176198s] ... ok
{32} tempest.api.volume.admin.test_volume_hosts.VolumeHostsAdminTestsJSON.test_show_host [2.131484s] ... ok
{22} tempest.api.volume.admin.test_volume_types_negative.VolumeTypesNegativeTest.test_create_with_empty_name [0.083856s] ... ok
{29} tempest.api.volume.admin.test_volume_types_extra_specs_negative.ExtraSpecsNegativeTest.test_get_nonexistent_extra_spec_name [0.091927s] ... ok
{33} tempest.api.volume.admin.test_volume_services_negative.VolumeServicesNegativeTest.test_thaw_host_with_invalid_host [0.096325s] ... ok
{29} tempest.api.volume.admin.test_volume_types_extra_specs_negative.ExtraSpecsNegativeTest.test_get_nonexistent_volume_type_id [0.063606s] ... ok
{26} tempest.api.volume.admin.test_volume_types_extra_specs.VolumeTypesExtraSpecsTest.test_volume_type_extra_spec_create_get_delete [2.045179s] ... ok
{29} tempest.api.volume.admin.test_volume_types_extra_specs_negative.ExtraSpecsNegativeTest.test_list_nonexistent_volume_type_id [0.017506s] ... ok
{29} tempest.api.volume.admin.test_volume_types_extra_specs_negative.ExtraSpecsNegativeTest.test_update_multiple_extra_spec [0.011441s] ... ok
{29} tempest.api.volume.admin.test_volume_types_extra_specs_negative.ExtraSpecsNegativeTest.test_update_no_body [0.018976s] ... ok
{29} tempest.api.volume.admin.test_volume_types_extra_specs_negative.ExtraSpecsNegativeTest.test_update_none_extra_spec_id [0.123759s] ... ok
{29} tempest.api.volume.admin.test_volume_types_extra_specs_negative.ExtraSpecsNegativeTest.test_update_nonexistent_extra_spec_id [0.029945s] ... ok
{26} tempest.api.volume.admin.test_volume_types_extra_specs.VolumeTypesExtraSpecsTest.test_volume_type_extra_specs_list [0.192084s] ... ok
{29} tempest.api.volume.admin.test_volume_types_extra_specs_negative.ExtraSpecsNegativeTest.test_update_nonexistent_type_id [0.024826s] ... ok
{22} tempest.api.volume.admin.test_volume_types_negative.VolumeTypesNegativeTest.test_create_with_repeated_name [0.332173s] ... ok
{22} tempest.api.volume.admin.test_volume_types_negative.VolumeTypesNegativeTest.test_delete_nonexistent_type_id [0.025300s] ... ok
{22} tempest.api.volume.admin.test_volume_types_negative.VolumeTypesNegativeTest.test_get_nonexistent_type_id [0.031936s] ... ok
{20} tempest.api.volume.admin.test_volume_types.VolumeTypesTest.test_volume_type_encryption_create_get_update_delete [1.340955s] ... ok
{20} tempest.api.volume.admin.test_volume_types.VolumeTypesTest.test_volume_type_list [0.076128s] ... ok
{26} tempest.api.volume.admin.test_volume_types_extra_specs.VolumeTypesExtraSpecsTest.test_volume_type_extra_specs_update [0.593285s] ... ok
{25} tempest.api.volume.admin.test_backends_capabilities.BackendsCapabilitiesAdminTestsJSON.test_compare_volume_stats_values [2.731588s] ... ok
{20} tempest.api.volume.admin.test_volume_types.VolumeTypesTest.test_volume_type_update [0.532444s] ... ok
{19} tempest.api.volume.admin.test_qos.QosSpecsTestJSON.test_associate_disassociate_qos [3.705924s] ... ok
{25} tempest.api.volume.admin.test_backends_capabilities.BackendsCapabilitiesAdminTestsJSON.test_get_capabilities_backend [0.548133s] ... ok
{19} tempest.api.volume.admin.test_qos.QosSpecsTestJSON.test_create_delete_qos_with_back_end_consumer [0.356625s] ... ok
{19} tempest.api.volume.admin.test_qos.QosSpecsTestJSON.test_create_delete_qos_with_both_consumer [0.217873s] ... ok
{15} tempest.api.volume.admin.test_user_messages.UserMessagesTest.test_delete_message [4.756786s] ... ok
{18} tempest.api.volume.admin.test_volume_quota_classes.VolumeQuotaClassesTest.test_update_default_quota [4.546242s] ... ok
{19} tempest.api.volume.admin.test_qos.QosSpecsTestJSON.test_create_delete_qos_with_front_end_consumer [0.332115s] ... ok
{19} tempest.api.volume.admin.test_qos.QosSpecsTestJSON.test_get_qos [0.029508s] ... ok
{19} tempest.api.volume.admin.test_qos.QosSpecsTestJSON.test_list_qos [0.017705s] ... ok
{19} tempest.api.volume.admin.test_qos.QosSpecsTestJSON.test_set_unset_qos_key [0.273940s] ... ok
{4} tempest.api.volume.admin.test_volume_quotas.VolumeQuotasAdminTestJSON.test_delete_quota [4.926135s] ... ok
{4} tempest.api.volume.admin.test_volume_quotas.VolumeQuotasAdminTestJSON.test_list_default_quotas [0.036064s] ... ok
{4} tempest.api.volume.admin.test_volume_quotas.VolumeQuotasAdminTestJSON.test_list_quotas [0.065409s] ... ok
{35} tempest.api.volume.test_volume_metadata.VolumesMetadataTest.test_crud_volume_metadata [0.777520s] ... ok
{16} tempest.api.volume.admin.test_volume_type_access.VolumeTypesAccessTest.test_volume_type_access_add [5.649862s] ... ok
{35} tempest.api.volume.test_volume_metadata.VolumesMetadataTest.test_update_show_volume_metadata_item [1.453639s] ... ok
{16} tempest.api.volume.admin.test_volume_type_access.VolumeTypesAccessTest.test_volume_type_access_list [2.686303s] ... ok
{15} tempest.api.volume.admin.test_user_messages.UserMessagesTest.test_list_show_messages [4.618295s] ... ok
{14} tempest.api.volume.admin.test_volume_retype.VolumeRetypeWithoutMigrationTest.test_available_volume_retype [8.788586s] ... ok
{36} tempest.api.volume.admin.test_volume_quotas_negative.VolumeQuotasNegativeTestJSON.test_quota_volume_gigabytes [0.493988s] ... ok
{36} tempest.api.volume.admin.test_volume_quotas_negative.VolumeQuotasNegativeTestJSON.test_quota_volumes [0.350876s] ... ok
{39} tempest.api.volume.test_volume_absolute_limits.AbsoluteLimitsTests.test_get_volume_absolute_limits [0.079451s] ... ok
{11} tempest.api.volume.test_volumes_clone_negative.VolumesCloneNegativeTest.test_create_from_volume_decreasing_size [17.572791s] ... ok
{24} tempest.api.volume.test_snapshot_metadata.SnapshotMetadataTestJSON.test_crud_snapshot_metadata [0.686875s] ... ok
{24} tempest.api.volume.test_snapshot_metadata.SnapshotMetadataTestJSON.test_update_show_snapshot_metadata_item [0.670200s] ... ok
{13} tempest.api.volume.test_volumes_snapshots.VolumesSnapshotTestJSON.test_snapshot_backup ... SKIPPED: Cinder backup is disabled
{6} tempest.api.volume.admin.test_snapshots_actions.SnapshotsActionsTest.test_reset_snapshot_status [0.682220s] ... ok
{12} tempest.api.volume.admin.test_volume_services.VolumesServicesTestJSON.test_get_service_by_volume_host_name [17.692247s] ... ok
{12} tempest.api.volume.admin.test_volume_services.VolumesServicesTestJSON.test_list_services [0.024199s] ... ok
{28} tempest.api.volume.admin.test_volume_snapshot_quotas_negative.VolumeSnapshotQuotasNegativeTestJSON.test_quota_volume_gigabytes_snapshots [0.634415s] ... ok
{28} tempest.api.volume.admin.test_volume_snapshot_quotas_negative.VolumeSnapshotQuotasNegativeTestJSON.test_quota_volume_snapshots [0.118370s] ... ok
{9} tempest.api.volume.test_volume_transfers.VolumesTransfersTest.test_create_get_list_accept_volume_transfer [20.529157s] ... ok
{4} tempest.api.volume.admin.test_volume_quotas.VolumeQuotasAdminTestJSON.test_quota_usage [15.294572s] ... ok
{23} tempest.api.volume.test_volumes_list.VolumesListTestJSON.test_volume_list [0.052630s] ... ok
{23} tempest.api.volume.test_volumes_list.VolumesListTestJSON.test_volume_list_by_name [0.071412s] ... ok
{23} tempest.api.volume.test_volumes_list.VolumesListTestJSON.test_volume_list_details_by_name [0.080758s] ... ok
{23} tempest.api.volume.test_volumes_list.VolumesListTestJSON.test_volume_list_details_pagination [0.472986s] ... ok
{8} tempest.api.volume.test_volume_transfers.VolumesTransfersV355Test.test_create_get_list_accept_volume_transfer [24.909129s] ... ok
{23} tempest.api.volume.test_volumes_list.VolumesListTestJSON.test_volume_list_details_with_multiple_params [0.318669s] ... ok
{23} tempest.api.volume.test_volumes_list.VolumesListTestJSON.test_volume_list_pagination [0.261586s] ... ok
{23} tempest.api.volume.test_volumes_list.VolumesListTestJSON.test_volume_list_param_display_name_and_status [0.068724s] ... ok
{23} tempest.api.volume.test_volumes_list.VolumesListTestJSON.test_volume_list_with_detail_param_display_name_and_status [0.120411s] ... ok
{23} tempest.api.volume.test_volumes_list.VolumesListTestJSON.test_volume_list_with_detail_param_marker [0.103382s] ... ok
{23} tempest.api.volume.test_volumes_list.VolumesListTestJSON.test_volume_list_with_detail_param_metadata [0.092594s] ... ok
{5} tempest.api.volume.test_volume_transfers.VolumesTransfersV357Test.test_create_get_list_accept_volume_transfer [25.878900s] ... ok
{23} tempest.api.volume.test_volumes_list.VolumesListTestJSON.test_volume_list_with_details [0.153472s] ... ok
{23} tempest.api.volume.test_volumes_list.VolumesListTestJSON.test_volume_list_with_param_metadata [0.082466s] ... ok
{23} tempest.api.volume.test_volumes_list.VolumesListTestJSON.test_volumes_list_by_availability_zone [0.154110s] ... ok
{23} tempest.api.volume.test_volumes_list.VolumesListTestJSON.test_volumes_list_by_bootable [0.158242s] ... ok
{23} tempest.api.volume.test_volumes_list.VolumesListTestJSON.test_volumes_list_by_status [0.137085s] ... ok
{23} tempest.api.volume.test_volumes_list.VolumesListTestJSON.test_volumes_list_details_by_availability_zone [0.047535s] ... ok
{23} tempest.api.volume.test_volumes_list.VolumesListTestJSON.test_volumes_list_details_by_bootable [0.099197s] ... ok
{23} tempest.api.volume.test_volumes_list.VolumesListTestJSON.test_volumes_list_details_by_status [0.083995s] ... ok
{37} tempest.api.volume.test_volumes_snapshots_list.VolumesSnapshotListTestJSON.test_snapshot_list_param_limit [0.043669s] ... ok
{37} tempest.api.volume.test_volumes_snapshots_list.VolumesSnapshotListTestJSON.test_snapshot_list_param_limit_equals_infinite [0.073550s] ... ok
{37} tempest.api.volume.test_volumes_snapshots_list.VolumesSnapshotListTestJSON.test_snapshot_list_param_limit_equals_zero [0.032813s] ... ok
{37} tempest.api.volume.test_volumes_snapshots_list.VolumesSnapshotListTestJSON.test_snapshot_list_param_marker [0.095905s] ... ok
{37} tempest.api.volume.test_volumes_snapshots_list.VolumesSnapshotListTestJSON.test_snapshot_list_param_offset [0.042312s] ... ok
{37} tempest.api.volume.test_volumes_snapshots_list.VolumesSnapshotListTestJSON.test_snapshot_list_param_sort_created_at_asc [0.064303s] ... ok
{37} tempest.api.volume.test_volumes_snapshots_list.VolumesSnapshotListTestJSON.test_snapshot_list_param_sort_created_at_desc [0.057872s] ... ok
{37} tempest.api.volume.test_volumes_snapshots_list.VolumesSnapshotListTestJSON.test_snapshot_list_param_sort_id_asc [0.045703s] ... ok
{37} tempest.api.volume.test_volumes_snapshots_list.VolumesSnapshotListTestJSON.test_snapshot_list_param_sort_id_desc [0.042955s] ... ok
{37} tempest.api.volume.test_volumes_snapshots_list.VolumesSnapshotListTestJSON.test_snapshot_list_param_sort_name_asc [0.038201s] ... ok
{37} tempest.api.volume.test_volumes_snapshots_list.VolumesSnapshotListTestJSON.test_snapshot_list_param_sort_name_desc [0.044650s] ... ok
{37} tempest.api.volume.test_volumes_snapshots_list.VolumesSnapshotListTestJSON.test_snapshots_list_details_with_params [0.173117s] ... ok
{37} tempest.api.volume.test_volumes_snapshots_list.VolumesSnapshotListTestJSON.test_snapshots_list_with_params [0.079058s] ... ok
{17} tempest.api.volume.admin.test_volumes_list.VolumesListAdminTestJSON.test_volume_list_param_tenant [11.368241s] ... ok
{13} tempest.api.volume.test_volumes_snapshots.VolumesSnapshotTestJSON.test_snapshot_create_get_list_update_delete [18.895021s] ... ok
{0} tempest.api.volume.test_volumes_get.VolumesGetTest.test_volume_create_get_update_delete [38.531848s] ... ok
{6} tempest.api.volume.admin.test_snapshots_actions.SnapshotsActionsTest.test_snapshot_force_delete_when_snapshot_is_creating [18.817495s] ... ok
{9} tempest.api.volume.test_volume_transfers.VolumesTransfersTest.test_create_list_delete_volume_transfer [15.228099s] ... ok
{7} tempest.api.volume.test_volumes_negative.VolumesNegativeTest.test_attach_volumes_with_nonexistent_volume_id [31.140339s] ... ok
{2} tempest.api.volume.admin.test_volumes_actions.VolumesActionsTest.test_volume_force_delete_when_volume_is_attaching [17.680515s] ... ok
{4} tempest.api.volume.admin.test_volume_quotas.VolumeQuotasAdminTestJSON.test_quota_usage_after_volume_transfer [18.609937s] ... ok
{4} tempest.api.volume.admin.test_volume_quotas.VolumeQuotasAdminTestJSON.test_show_quota_usage [0.077355s] ... ok
{7} tempest.api.volume.test_volumes_negative.VolumesNegativeTest.test_create_volume_from_deactivated_image [3.879901s] ... ok
{4} tempest.api.volume.admin.test_volume_quotas.VolumeQuotasAdminTestJSON.test_update_all_quota_resources_for_tenant [3.924547s] ... ok
{8} tempest.api.volume.test_volume_transfers.VolumesTransfersV355Test.test_create_list_delete_volume_transfer [19.634928s] ... ok
{7} tempest.api.volume.test_volumes_negative.VolumesNegativeTest.test_create_volume_from_image_with_decreasing_size [4.887243s] ... ok
{7} tempest.api.volume.test_volumes_negative.VolumesNegativeTest.test_create_volume_with_invalid_size [0.016283s] ... ok
{7} tempest.api.volume.test_volumes_negative.VolumesNegativeTest.test_create_volume_with_nonexistent_snapshot_id [0.024005s] ... ok
{7} tempest.api.volume.test_volumes_negative.VolumesNegativeTest.test_create_volume_with_nonexistent_source_volid [0.032525s] ... ok
{7} tempest.api.volume.test_volumes_negative.VolumesNegativeTest.test_create_volume_with_nonexistent_volume_type [0.028522s] ... ok
{7} tempest.api.volume.test_volumes_negative.VolumesNegativeTest.test_create_volume_with_size_negative [0.016312s] ... ok
{7} tempest.api.volume.test_volumes_negative.VolumesNegativeTest.test_create_volume_with_size_zero [0.021031s] ... ok
{7} tempest.api.volume.test_volumes_negative.VolumesNegativeTest.test_create_volume_without_passing_size [0.022894s] ... ok
{7} tempest.api.volume.test_volumes_negative.VolumesNegativeTest.test_delete_invalid_volume_id [0.024299s] ... ok
{7} tempest.api.volume.test_volumes_negative.VolumesNegativeTest.test_delete_volume_without_passing_volume_id [0.024737s] ... ok
{7} tempest.api.volume.test_volumes_negative.VolumesNegativeTest.test_detach_volumes_with_invalid_volume_id [0.053731s] ... ok
{7} tempest.api.volume.test_volumes_negative.VolumesNegativeTest.test_get_invalid_volume_id [0.026373s] ... ok
{7} tempest.api.volume.test_volumes_negative.VolumesNegativeTest.test_get_volume_without_passing_volume_id [0.016320s] ... ok
{7} tempest.api.volume.test_volumes_negative.VolumesNegativeTest.test_list_volumes_detail_with_invalid_status [0.097241s] ... ok
{7} tempest.api.volume.test_volumes_negative.VolumesNegativeTest.test_list_volumes_detail_with_nonexistent_name [0.147442s] ... ok
{7} tempest.api.volume.test_volumes_negative.VolumesNegativeTest.test_list_volumes_with_invalid_status [0.076847s] ... ok
{7} tempest.api.volume.test_volumes_negative.VolumesNegativeTest.test_list_volumes_with_nonexistent_name [0.074117s] ... ok
{7} tempest.api.volume.test_volumes_negative.VolumesNegativeTest.test_reserve_volume_with_negative_volume_status [0.284960s] ... ok
{7} tempest.api.volume.test_volumes_negative.VolumesNegativeTest.test_reserve_volume_with_nonexistent_volume_id [0.027954s] ... ok
{7} tempest.api.volume.test_volumes_negative.VolumesNegativeTest.test_unreserve_volume_with_nonexistent_volume_id [0.024225s] ... ok
{7} tempest.api.volume.test_volumes_negative.VolumesNegativeTest.test_update_volume_with_empty_volume_id [0.010353s] ... ok
{3} tempest.api.volume.test_volume_delete_cascade.VolumesDeleteCascade.test_volume_delete_cascade [49.070445s] ... ok
{7} tempest.api.volume.test_volumes_negative.VolumesNegativeTest.test_update_volume_with_invalid_volume_id [0.026433s] ... ok
{7} tempest.api.volume.test_volumes_negative.VolumesNegativeTest.test_update_volume_with_nonexistent_volume_id [0.025617s] ... ok
{7} tempest.api.volume.test_volumes_negative.VolumesNegativeTest.test_volume_delete_nonexistent_volume_id [0.024234s] ... ok
{7} tempest.api.volume.test_volumes_negative.VolumesNegativeTest.test_volume_get_nonexistent_volume_id [0.024782s] ... ok
{5} tempest.api.volume.test_volume_transfers.VolumesTransfersV357Test.test_create_list_delete_volume_transfer [20.776105s] ... ok
{3} setUpClass (tempest.api.volume.test_volumes_backup.VolumesBackupsTest) ... SKIPPED: Cinder backup feature disabled
{10} tempest.api.volume.test_volumes_actions.VolumesActionsTest.test_get_volume_attachment [31.734576s] ... ok
{10} tempest.api.volume.test_volumes_actions.VolumesActionsTest.test_reserve_unreserve_volume [0.450923s] ... ok
{10} tempest.api.volume.test_volumes_actions.VolumesActionsTest.test_volume_bootable [0.531155s] ... ok
{1} tempest.api.volume.test_volumes_clone.VolumesCloneTest.test_create_from_volume [53.094008s] ... ok
{10} tempest.api.volume.test_volumes_actions.VolumesActionsTest.test_volume_readonly_update [0.597955s] ... ok
{4} setUpClass (tempest.api.volume.admin.test_volume_retype.VolumeRetypeMultiattachTest) ... SKIPPED: Volume multi-attach is not available.
{6} tempest.api.volume.admin.test_snapshots_actions.SnapshotsActionsTest.test_snapshot_force_delete_when_snapshot_is_deleting [17.679526s] ... ok
{2} tempest.api.volume.admin.test_volumes_actions.VolumesActionsTest.test_volume_force_delete_when_volume_is_creating [17.171462s] ... ok
{6} tempest.api.volume.admin.test_snapshots_actions.SnapshotsActionsTest.test_snapshot_force_delete_when_snapshot_is_error [8.608679s] ... ok
{2} tempest.api.volume.admin.test_volumes_actions.VolumesActionsTest.test_volume_force_delete_when_volume_is_error [7.678617s] ... ok
{6} tempest.api.volume.admin.test_snapshots_actions.SnapshotsActionsTest.test_snapshot_force_delete_when_snapshot_is_error_deleting [6.177072s] ... ok
{6} tempest.api.volume.admin.test_snapshots_actions.SnapshotsActionsTest.test_update_snapshot_status [0.346153s] ... ok
{2} tempest.api.volume.admin.test_volumes_actions.VolumesActionsTest.test_volume_force_delete_when_volume_is_maintenance [5.264432s] ... ok
{0} tempest.api.volume.test_volumes_get.VolumesGetTest.test_volume_create_get_update_delete_as_clone [33.885208s] ... ok
{2} tempest.api.volume.admin.test_volumes_actions.VolumesActionsTest.test_volume_reset_status [5.394072s] ... ok
{6} setUpClass (tempest.api.volume.admin.test_volumes_backup.VolumesBackupsAdminTest) ... SKIPPED: Cinder backup feature disabled

======
Totals
======
Ran: 175 tests in 87.9021 sec.
 - Passed: 167
 - Skipped: 8
 - Expected Fail: 0
 - Unexpected Success: 0
 - Failed: 0
Sum of execute time for each test: 668.1802 sec.

==============
Worker Balance
==============
 - Worker 0 (3 tests) => 0:01:20.756066
 - Worker 1 (2 tests) => 0:01:01.313732
 - Worker 2 (6 tests) => 0:01:25.295802
 - Worker 3 (2 tests) => 0:00:51.478385
 - Worker 4 (8 tests) => 0:00:51.564115
 - Worker 5 (3 tests) => 0:00:58.227180
 - Worker 6 (7 tests) => 0:01:00.300416
 - Worker 7 (27 tests) => 0:00:41.084530
 - Worker 8 (2 tests) => 0:00:44.555832
 - Worker 9 (2 tests) => 0:00:35.762995
 - Worker 10 (4 tests) => 0:00:33.330526
 - Worker 11 (1 tests) => 0:00:17.572791
 - Worker 12 (5 tests) => 0:00:18.597239
 - Worker 13 (2 tests) => 0:00:18.896850
 - Worker 14 (1 tests) => 0:00:08.788586
 - Worker 15 (2 tests) => 0:00:09.377085
 - Worker 16 (2 tests) => 0:00:08.338129
 - Worker 17 (1 tests) => 0:00:11.368241
 - Worker 18 (2 tests) => 0:00:05.024792
 - Worker 19 (7 tests) => 0:00:04.940686
 - Worker 20 (4 tests) => 0:00:04.290886
 - Worker 21 (5 tests) => 0:00:02.345317
 - Worker 22 (6 tests) => 0:00:03.372906
 - Worker 23 (18 tests) => 0:00:02.583426
 - Worker 24 (2 tests) => 0:00:01.359626
 - Worker 25 (2 tests) => 0:00:03.281814
 - Worker 26 (3 tests) => 0:00:02.833127
 - Worker 27 (2 tests) => 0:00:02.675778
 - Worker 28 (2 tests) => 0:00:00.762133
 - Worker 29 (12 tests) => 0:00:02.609774
 - Worker 30 (1 tests) => 0:00:01.437496
 - Worker 31 (1 tests) => 0:00:01.281631
 - Worker 32 (2 tests) => 0:00:02.530235
 - Worker 33 (5 tests) => 0:00:02.101519
 - Worker 34 (1 tests) => 0:00:01.479302
 - Worker 35 (2 tests) => 0:00:02.234127
 - Worker 36 (2 tests) => 0:00:00.846819
 - Worker 37 (13 tests) => 0:00:00.846685
 - Worker 38 (2 tests) => 0:00:02.093878
 - Worker 39 (1 tests) => 0:00:00.079451
