{0} setUpClass (tempest.api.volume.admin.test_multi_backend.VolumeMultiBackendTest) ... SKIPPED: Cinder multi-backend feature disabled
{3} setUpClass (tempest.api.volume.admin.test_volume_retype.VolumeRetypeWithMigrationTest) ... SKIPPED: Cinder multi-backend feature disabled
{6} setUpClass (tempest.api.volume.admin.test_encrypted_volumes_extend.EncryptedVolumesExtendAttachedTest) ... SKIPPED: Attached encrypted volume extend is disabled.
{2} setUpClass (tempest.api.volume.admin.test_volume_retype.VolumeRetypeMultiattachTest) ... SKIPPED: Volume multi-attach is not available.
{26} tempest.api.volume.test_versions.VersionsTest.test_list_versions [0.015784s] ... ok
{26} tempest.api.volume.test_versions.VersionsTest.test_show_version [1.490556s] ... ok
{18} tempest.api.volume.test_volumes_snapshots_negative.VolumesSnapshotNegativeTestJSON.test_create_snapshot_with_nonexistent_volume_id [1.447122s] ... ok
{23} tempest.api.volume.test_extensions.ExtensionsTestJSON.test_list_extensions [1.296820s] ... ok
{18} tempest.api.volume.test_volumes_snapshots_negative.VolumesSnapshotNegativeTestJSON.test_create_snapshot_without_passing_volume_id [0.218745s] ... ok
{18} tempest.api.volume.test_volumes_snapshots_negative.VolumesSnapshotNegativeTestJSON.test_list_snapshot_invalid_param_limit [0.007970s] ... ok
{18} tempest.api.volume.test_volumes_snapshots_negative.VolumesSnapshotNegativeTestJSON.test_list_snapshots_invalid_param_marker [0.015296s] ... ok
{25} tempest.api.volume.test_volumes_get.VolumesSummaryTest.test_show_volume_summary [1.267973s] ... ok
{18} tempest.api.volume.test_volumes_snapshots_negative.VolumesSnapshotNegativeTestJSON.test_list_snapshots_invalid_param_sort [0.012939s] ... ok
{27} tempest.api.volume.test_availability_zone.AvailabilityZoneTestJSON.test_get_availability_zone_list [1.274228s] ... ok
{14} tempest.api.volume.admin.test_volume_quota_classes.VolumeQuotaClassesTest.test_show_default_quota [0.667421s] ... ok
{17} tempest.api.volume.admin.test_volume_types_negative.VolumeTypesNegativeTest.test_create_volume_type_encryption_nonexistent_type_id [0.369770s] ... ok
{7} tempest.api.volume.admin.test_volume_services.VolumesServicesTestJSON.test_get_service_by_host_name [0.157124s] ... ok
{7} tempest.api.volume.admin.test_volume_services.VolumesServicesTestJSON.test_get_service_by_service_and_host_name [0.195354s] ... ok
{24} tempest.api.volume.admin.test_volume_hosts.VolumeHostsAdminTestsJSON.test_list_hosts [0.334857s] ... ok
{31} tempest.api.volume.admin.test_volume_services_negative.VolumeServicesNegativeTest.test_disable_log_reason_with_no_reason [0.271668s] ... ok
{7} tempest.api.volume.admin.test_volume_services.VolumesServicesTestJSON.test_get_service_by_service_binary_name [0.363536s] ... ok
{31} tempest.api.volume.admin.test_volume_services_negative.VolumeServicesNegativeTest.test_disable_service_with_invalid_binary [0.296604s] ... ok
{22} tempest.api.volume.admin.test_volume_types_extra_specs_negative.ExtraSpecsNegativeTest.test_create_invalid_body [0.226368s] ... ok
{28} tempest.api.volume.admin.test_volume_pools.VolumePoolsAdminTestsJSON.test_get_pools_with_details [0.783398s] ... FAILED

Captured traceback:
~~~~~~~~~~~~~~~~~~~
    Traceback (most recent call last):

      File "/opt/stack/python-tempestconf/.venv_1/lib/python3.12/site-packages/tempest/api/volume/admin/test_volume_pools.py", line 44, in test_get_pools_with_details
    self._assert_pools(with_detail=True)

      File "/opt/stack/python-tempestconf/.venv_1/lib/python3.12/site-packages/tempest/api/volume/admin/test_volume_pools.py", line 32, in _assert_pools
    self.assertIn(CONF.volume.vendor_name,

      File "/opt/stack/python-tempestconf/.venv_1/lib/python3.12/site-packages/testtools/testcase.py", line 400, in assertIn
    self.assertThat(haystack, Contains(needle), message)

      File "/opt/stack/python-tempestconf/.venv_1/lib/python3.12/site-packages/testtools/testcase.py", line 481, in assertThat
    raise mismatch_error

    testtools.matchers._impl.MismatchError: 'Open Source' not in ['IBM']


Captured pythonlogging:
~~~~~~~~~~~~~~~~~~~~~~~
    2026-02-19 11:26:24,070 901836 INFO     [tempest.lib.common.rest_client] Request (VolumePoolsAdminTestsJSON:test_get_pools_with_details): 200 GET http://9.71.52.160/volume/v3/scheduler-stats/get_pools?detail=True 0.775s
2026-02-19 11:26:24,070 901836 DEBUG    [tempest.lib.common.rest_client] Request - Headers: {'Content-Type': 'application/json', 'Accept': 'application/json', 'X-Auth-Token': '<omitted>'}
        Body: None
    Response - Headers: {'date': 'Thu, 19 Feb 2026 11:26:23 GMT', 'server': 'Apache/2.4.58 (Ubuntu)', 'content-type': 'application/json', 'x-compute-request-id': 'req-10665a6f-37f9-4a72-bdec-0350b07368a5', 'content-length': '907', 'openstack-api-version': 'volume 3.0', 'vary': 'OpenStack-API-Version', 'x-openstack-request-id': 'req-10665a6f-37f9-4a72-bdec-0350b07368a5', 'connection': 'close', 'status': '200', 'content-location': 'http://9.71.52.160/volume/v3/scheduler-stats/get_pools?detail=True'}
        Body: b'{"pools": [{"name": "rhosp-host-4@backend_170#mdiskgrp0", "capabilities": {"pool_name": "mdiskgrp0", "total_capacity_gb": 1782.0, "free_capacity_gb": 1577.0, "provisioned_capacity_gb": 204.0, "compression_support": true, "reserved_percentage": 0, "QoS_support": true, "consistencygroup_support": true, "location_info": "StorwizeSVCDriver:00000204A0806296:mdiskgrp0", "easytier_support": true, "multiattach": true, "thin_provisioning_support": true, "thick_provisioning_support": false, "max_over_subscription_ratio": "20.0", "consistent_group_snapshot_enabled": true, "backend_state": "up", "data_reduction": false, "site_id": "", "site_name": "", "allocated_capacity_gb": 0, "cacheable": true, "volume_backend_name": "partition_pbr", "storage_protocol": "FC", "vendor_name": "IBM", "driver_version": "2.2.6", "timestamp": "2026-02-19T11:26:18.243241", "filter_function": null, "goodness_function": null}}]}'

{16} tempest.api.volume.admin.test_volume_types.VolumeTypesTest.test_volume_type_create_get_delete [1.377699s] ... ok
{31} tempest.api.volume.admin.test_volume_services_negative.VolumeServicesNegativeTest.test_enable_service_with_invalid_host [0.331948s] ... ok
{22} tempest.api.volume.admin.test_volume_types_extra_specs_negative.ExtraSpecsNegativeTest.test_create_none_body [0.340227s] ... ok
{17} tempest.api.volume.admin.test_volume_types_negative.VolumeTypesNegativeTest.test_create_volume_with_private_volume_type [1.516699s] ... ok
{20} tempest.api.volume.admin.test_backends_capabilities.BackendsCapabilitiesAdminTestsJSON.test_compare_volume_stats_values [1.519523s] ... ok
{31} tempest.api.volume.admin.test_volume_services_negative.VolumeServicesNegativeTest.test_freeze_host_with_invalid_host [0.510636s] ... ok
{19} tempest.api.volume.admin.test_volume_types_extra_specs.VolumeTypesExtraSpecsTest.test_volume_type_extra_spec_create_get_delete [1.451086s] ... ok
{22} tempest.api.volume.admin.test_volume_types_extra_specs_negative.ExtraSpecsNegativeTest.test_create_nonexistent_type_id [0.586448s] ... ok
{17} tempest.api.volume.admin.test_volume_types_negative.VolumeTypesNegativeTest.test_create_with_empty_name [0.310717s] ... ok
{28} tempest.api.volume.admin.test_volume_pools.VolumePoolsAdminTestsJSON.test_get_pools_without_details [0.892453s] ... ok
{31} tempest.api.volume.admin.test_volume_services_negative.VolumeServicesNegativeTest.test_thaw_host_with_invalid_host [0.275549s] ... ok
{24} tempest.api.volume.admin.test_volume_hosts.VolumeHostsAdminTestsJSON.test_show_host [1.511769s] ... ok
{22} tempest.api.volume.admin.test_volume_types_extra_specs_negative.ExtraSpecsNegativeTest.test_delete_nonexistent_volume_type_id [0.213302s] ... ok
{20} tempest.api.volume.admin.test_backends_capabilities.BackendsCapabilitiesAdminTestsJSON.test_get_capabilities_backend [0.707845s] ... ok
{22} tempest.api.volume.admin.test_volume_types_extra_specs_negative.ExtraSpecsNegativeTest.test_get_nonexistent_extra_spec_name [0.399118s] ... ok
{22} tempest.api.volume.admin.test_volume_types_extra_specs_negative.ExtraSpecsNegativeTest.test_get_nonexistent_volume_type_id [0.060347s] ... ok
{22} tempest.api.volume.admin.test_volume_types_extra_specs_negative.ExtraSpecsNegativeTest.test_list_nonexistent_volume_type_id [0.038066s] ... ok
{22} tempest.api.volume.admin.test_volume_types_extra_specs_negative.ExtraSpecsNegativeTest.test_update_multiple_extra_spec [0.019435s] ... ok
{22} tempest.api.volume.admin.test_volume_types_extra_specs_negative.ExtraSpecsNegativeTest.test_update_no_body [0.016910s] ... ok
{19} tempest.api.volume.admin.test_volume_types_extra_specs.VolumeTypesExtraSpecsTest.test_volume_type_extra_specs_list [0.827725s] ... ok
{22} tempest.api.volume.admin.test_volume_types_extra_specs_negative.ExtraSpecsNegativeTest.test_update_none_extra_spec_id [0.063405s] ... ok
{22} tempest.api.volume.admin.test_volume_types_extra_specs_negative.ExtraSpecsNegativeTest.test_update_nonexistent_extra_spec_id [0.018879s] ... ok
{22} tempest.api.volume.admin.test_volume_types_extra_specs_negative.ExtraSpecsNegativeTest.test_update_nonexistent_type_id [0.019083s] ... ok
{17} tempest.api.volume.admin.test_volume_types_negative.VolumeTypesNegativeTest.test_create_with_repeated_name [0.903883s] ... ok
{17} tempest.api.volume.admin.test_volume_types_negative.VolumeTypesNegativeTest.test_delete_nonexistent_type_id [0.014463s] ... ok
{17} tempest.api.volume.admin.test_volume_types_negative.VolumeTypesNegativeTest.test_get_nonexistent_type_id [0.017160s] ... ok
{16} tempest.api.volume.admin.test_volume_types.VolumeTypesTest.test_volume_type_encryption_create_get_update_delete [1.855962s] ... ok
{16} tempest.api.volume.admin.test_volume_types.VolumeTypesTest.test_volume_type_list [0.080997s] ... ok
{19} tempest.api.volume.admin.test_volume_types_extra_specs.VolumeTypesExtraSpecsTest.test_volume_type_extra_specs_update [0.626233s] ... ok
{15} tempest.api.volume.admin.test_qos.QosSpecsTestJSON.test_associate_disassociate_qos [3.634288s] ... ok
{14} tempest.api.volume.admin.test_volume_quota_classes.VolumeQuotaClassesTest.test_update_default_quota [3.788938s] ... ok
{15} tempest.api.volume.admin.test_qos.QosSpecsTestJSON.test_create_delete_qos_with_back_end_consumer [0.614562s] ... ok
{15} tempest.api.volume.admin.test_qos.QosSpecsTestJSON.test_create_delete_qos_with_both_consumer [0.333422s] ... ok
{16} tempest.api.volume.admin.test_volume_types.VolumeTypesTest.test_volume_type_update [1.283313s] ... ok
{15} tempest.api.volume.admin.test_qos.QosSpecsTestJSON.test_create_delete_qos_with_front_end_consumer [0.773041s] ... ok
{15} tempest.api.volume.admin.test_qos.QosSpecsTestJSON.test_get_qos [0.016102s] ... ok
{15} tempest.api.volume.admin.test_qos.QosSpecsTestJSON.test_list_qos [0.030243s] ... ok
{4} tempest.api.volume.admin.test_volume_quotas.VolumeQuotasAdminTestJSON.test_delete_quota [4.286683s] ... ok
{4} tempest.api.volume.admin.test_volume_quotas.VolumeQuotasAdminTestJSON.test_list_default_quotas [0.060747s] ... ok
{4} tempest.api.volume.admin.test_volume_quotas.VolumeQuotasAdminTestJSON.test_list_quotas [0.049890s] ... ok
{15} tempest.api.volume.admin.test_qos.QosSpecsTestJSON.test_set_unset_qos_key [0.281429s] ... ok
{9} tempest.api.volume.admin.test_user_messages.UserMessagesTest.test_delete_message [6.771873s] ... ok
{29} tempest.api.volume.admin.test_volume_quotas_negative.VolumeQuotasNegativeTestJSON.test_quota_volume_gigabytes [0.436864s] ... ok
{29} tempest.api.volume.admin.test_volume_quotas_negative.VolumeQuotasNegativeTestJSON.test_quota_volumes [0.400206s] ... ok
{36} tempest.api.volume.test_volume_absolute_limits.AbsoluteLimitsTests.test_get_volume_absolute_limits [0.054962s] ... ok
{12} tempest.api.volume.admin.test_volume_type_access.VolumeTypesAccessTest.test_volume_type_access_add [6.959124s] ... ok
{9} tempest.api.volume.admin.test_user_messages.UserMessagesTest.test_list_show_messages [3.854324s] ... ok
{10} tempest.api.volume.admin.test_volume_retype.VolumeRetypeWithoutMigrationTest.test_available_volume_retype [9.117924s] ... ok
{12} tempest.api.volume.admin.test_volume_type_access.VolumeTypesAccessTest.test_volume_type_access_list [2.032769s] ... ok
{33} tempest.api.volume.test_volume_metadata.VolumesMetadataTest.test_crud_volume_metadata [0.609013s] ... ok
{33} tempest.api.volume.test_volume_metadata.VolumesMetadataTest.test_update_show_volume_metadata_item [0.488418s] ... ok
{7} tempest.api.volume.admin.test_volume_services.VolumesServicesTestJSON.test_get_service_by_volume_host_name [20.498137s] ... ok
{7} tempest.api.volume.admin.test_volume_services.VolumesServicesTestJSON.test_list_services [0.026782s] ... ok
{5} tempest.api.volume.admin.test_snapshots_actions.SnapshotsActionsTest.test_reset_snapshot_status [1.642143s] ... ok
{3} tempest.api.volume.test_volumes_clone_negative.VolumesCloneNegativeTest.test_create_from_volume_decreasing_size [28.093546s] ... ok
{0} tempest.api.volume.test_volume_transfers.VolumesTransfersTest.test_create_get_list_accept_volume_transfer [23.784864s] ... ok
{37} tempest.api.volume.test_volumes_snapshots.VolumesSnapshotTestJSON.test_snapshot_backup ... SKIPPED: Cinder backup is disabled
{32} tempest.api.volume.test_snapshot_metadata.SnapshotMetadataTestJSON.test_crud_snapshot_metadata [0.632731s] ... ok
{32} tempest.api.volume.test_snapshot_metadata.SnapshotMetadataTestJSON.test_update_show_snapshot_metadata_item [0.579008s] ... ok
{34} tempest.api.volume.admin.test_volume_snapshot_quotas_negative.VolumeSnapshotQuotasNegativeTestJSON.test_quota_volume_gigabytes_snapshots [0.755341s] ... ok
{34} tempest.api.volume.admin.test_volume_snapshot_quotas_negative.VolumeSnapshotQuotasNegativeTestJSON.test_quota_volume_snapshots [0.091146s] ... ok
{4} tempest.api.volume.admin.test_volume_quotas.VolumeQuotasAdminTestJSON.test_quota_usage [23.229773s] ... ok
{21} tempest.api.volume.test_volumes_list.VolumesListTestJSON.test_volume_list [0.068401s] ... ok
{21} tempest.api.volume.test_volumes_list.VolumesListTestJSON.test_volume_list_by_name [0.081783s] ... ok
{21} tempest.api.volume.test_volumes_list.VolumesListTestJSON.test_volume_list_details_by_name [0.094219s] ... ok
{21} tempest.api.volume.test_volumes_list.VolumesListTestJSON.test_volume_list_details_pagination [0.332619s] ... ok
{21} tempest.api.volume.test_volumes_list.VolumesListTestJSON.test_volume_list_details_with_multiple_params [0.261909s] ... ok
{6} tempest.api.volume.test_volume_transfers.VolumesTransfersV355Test.test_create_get_list_accept_volume_transfer [29.074247s] ... ok
{8} tempest.api.volume.test_volume_transfers.VolumesTransfersV357Test.test_create_get_list_accept_volume_transfer [28.966229s] ... ok
{21} tempest.api.volume.test_volumes_list.VolumesListTestJSON.test_volume_list_pagination [0.222890s] ... ok
{21} tempest.api.volume.test_volumes_list.VolumesListTestJSON.test_volume_list_param_display_name_and_status [0.079022s] ... ok
{21} tempest.api.volume.test_volumes_list.VolumesListTestJSON.test_volume_list_with_detail_param_display_name_and_status [0.091106s] ... ok
{21} tempest.api.volume.test_volumes_list.VolumesListTestJSON.test_volume_list_with_detail_param_marker [0.087782s] ... ok
{21} tempest.api.volume.test_volumes_list.VolumesListTestJSON.test_volume_list_with_detail_param_metadata [0.105891s] ... ok
{21} tempest.api.volume.test_volumes_list.VolumesListTestJSON.test_volume_list_with_details [0.096601s] ... ok
{21} tempest.api.volume.test_volumes_list.VolumesListTestJSON.test_volume_list_with_param_metadata [0.103388s] ... ok
{21} tempest.api.volume.test_volumes_list.VolumesListTestJSON.test_volumes_list_by_availability_zone [0.152495s] ... ok
{21} tempest.api.volume.test_volumes_list.VolumesListTestJSON.test_volumes_list_by_bootable [0.151381s] ... ok
{21} tempest.api.volume.test_volumes_list.VolumesListTestJSON.test_volumes_list_by_status [0.145257s] ... ok
{21} tempest.api.volume.test_volumes_list.VolumesListTestJSON.test_volumes_list_details_by_availability_zone [0.071971s] ... ok
{21} tempest.api.volume.test_volumes_list.VolumesListTestJSON.test_volumes_list_details_by_bootable [0.092596s] ... ok
{21} tempest.api.volume.test_volumes_list.VolumesListTestJSON.test_volumes_list_details_by_status [0.096160s] ... ok
{5} tempest.api.volume.admin.test_snapshots_actions.SnapshotsActionsTest.test_snapshot_force_delete_when_snapshot_is_creating [19.129182s] ... ok
{35} tempest.api.volume.test_volumes_snapshots_list.VolumesSnapshotListTestJSON.test_snapshot_list_param_limit [0.049454s] ... ok
{35} tempest.api.volume.test_volumes_snapshots_list.VolumesSnapshotListTestJSON.test_snapshot_list_param_limit_equals_infinite [0.091454s] ... ok
{35} tempest.api.volume.test_volumes_snapshots_list.VolumesSnapshotListTestJSON.test_snapshot_list_param_limit_equals_zero [0.033863s] ... ok
{35} tempest.api.volume.test_volumes_snapshots_list.VolumesSnapshotListTestJSON.test_snapshot_list_param_marker [0.094729s] ... ok
{35} tempest.api.volume.test_volumes_snapshots_list.VolumesSnapshotListTestJSON.test_snapshot_list_param_offset [0.048146s] ... ok
{35} tempest.api.volume.test_volumes_snapshots_list.VolumesSnapshotListTestJSON.test_snapshot_list_param_sort_created_at_asc [0.047087s] ... ok
{35} tempest.api.volume.test_volumes_snapshots_list.VolumesSnapshotListTestJSON.test_snapshot_list_param_sort_created_at_desc [0.043226s] ... ok
{35} tempest.api.volume.test_volumes_snapshots_list.VolumesSnapshotListTestJSON.test_snapshot_list_param_sort_id_asc [0.049495s] ... ok
{35} tempest.api.volume.test_volumes_snapshots_list.VolumesSnapshotListTestJSON.test_snapshot_list_param_sort_id_desc [0.050307s] ... ok
{35} tempest.api.volume.test_volumes_snapshots_list.VolumesSnapshotListTestJSON.test_snapshot_list_param_sort_name_asc [0.063714s] ... ok
{35} tempest.api.volume.test_volumes_snapshots_list.VolumesSnapshotListTestJSON.test_snapshot_list_param_sort_name_desc [0.041600s] ... ok
{1} tempest.api.volume.admin.test_volumes_actions.VolumesActionsTest.test_volume_force_delete_when_volume_is_attaching [18.836112s] ... ok
{35} tempest.api.volume.test_volumes_snapshots_list.VolumesSnapshotListTestJSON.test_snapshots_list_details_with_params [0.103619s] ... ok
{35} tempest.api.volume.test_volumes_snapshots_list.VolumesSnapshotListTestJSON.test_snapshots_list_with_params [0.094000s] ... ok
{11} tempest.api.volume.test_volumes_negative.VolumesNegativeTest.test_attach_volumes_with_nonexistent_volume_id [29.512554s] ... ok
{37} tempest.api.volume.test_volumes_snapshots.VolumesSnapshotTestJSON.test_snapshot_create_get_list_update_delete [18.608962s] ... ok
{0} tempest.api.volume.test_volume_transfers.VolumesTransfersTest.test_create_list_delete_volume_transfer [19.347349s] ... ok
{13} tempest.api.volume.admin.test_volumes_list.VolumesListAdminTestJSON.test_volume_list_param_tenant [9.973613s] ... ok
{2} tempest.api.volume.test_volumes_get.VolumesGetTest.test_volume_create_get_update_delete [49.838857s] ... ok
{11} tempest.api.volume.test_volumes_negative.VolumesNegativeTest.test_create_volume_from_deactivated_image [3.304667s] ... ok
{6} tempest.api.volume.test_volume_transfers.VolumesTransfersV355Test.test_create_list_delete_volume_transfer [18.463901s] ... ok
{4} tempest.api.volume.admin.test_volume_quotas.VolumeQuotasAdminTestJSON.test_quota_usage_after_volume_transfer [19.944201s] ... ok
{4} tempest.api.volume.admin.test_volume_quotas.VolumeQuotasAdminTestJSON.test_show_quota_usage [0.120849s] ... ok
{11} tempest.api.volume.test_volumes_negative.VolumesNegativeTest.test_create_volume_from_image_with_decreasing_size [2.514629s] ... ok
{11} tempest.api.volume.test_volumes_negative.VolumesNegativeTest.test_create_volume_with_invalid_size [0.015646s] ... ok
{11} tempest.api.volume.test_volumes_negative.VolumesNegativeTest.test_create_volume_with_nonexistent_snapshot_id [0.023706s] ... ok
{11} tempest.api.volume.test_volumes_negative.VolumesNegativeTest.test_create_volume_with_nonexistent_source_volid [0.043932s] ... ok
{11} tempest.api.volume.test_volumes_negative.VolumesNegativeTest.test_create_volume_with_nonexistent_volume_type [0.027038s] ... ok
{11} tempest.api.volume.test_volumes_negative.VolumesNegativeTest.test_create_volume_with_size_negative [0.023078s] ... ok
{11} tempest.api.volume.test_volumes_negative.VolumesNegativeTest.test_create_volume_with_size_zero [0.019009s] ... ok
{11} tempest.api.volume.test_volumes_negative.VolumesNegativeTest.test_create_volume_without_passing_size [0.014992s] ... ok
{11} tempest.api.volume.test_volumes_negative.VolumesNegativeTest.test_delete_invalid_volume_id [0.032442s] ... ok
{11} tempest.api.volume.test_volumes_negative.VolumesNegativeTest.test_delete_volume_without_passing_volume_id [0.010619s] ... ok
{11} tempest.api.volume.test_volumes_negative.VolumesNegativeTest.test_detach_volumes_with_invalid_volume_id [0.031366s] ... ok
{11} tempest.api.volume.test_volumes_negative.VolumesNegativeTest.test_get_invalid_volume_id [0.023394s] ... ok
{11} tempest.api.volume.test_volumes_negative.VolumesNegativeTest.test_get_volume_without_passing_volume_id [0.012934s] ... ok
{8} tempest.api.volume.test_volume_transfers.VolumesTransfersV357Test.test_create_list_delete_volume_transfer [19.441359s] ... ok
{11} tempest.api.volume.test_volumes_negative.VolumesNegativeTest.test_list_volumes_detail_with_invalid_status [0.113199s] ... ok
{11} tempest.api.volume.test_volumes_negative.VolumesNegativeTest.test_list_volumes_detail_with_nonexistent_name [0.184970s] ... ok
{11} tempest.api.volume.test_volumes_negative.VolumesNegativeTest.test_list_volumes_with_invalid_status [0.074297s] ... ok
{11} tempest.api.volume.test_volumes_negative.VolumesNegativeTest.test_list_volumes_with_nonexistent_name [0.031454s] ... ok
{11} tempest.api.volume.test_volumes_negative.VolumesNegativeTest.test_reserve_volume_with_negative_volume_status [0.702030s] ... ok
{11} tempest.api.volume.test_volumes_negative.VolumesNegativeTest.test_reserve_volume_with_nonexistent_volume_id [0.029776s] ... ok
{4} tempest.api.volume.admin.test_volume_quotas.VolumeQuotasAdminTestJSON.test_update_all_quota_resources_for_tenant [1.634656s] ... ok
{11} tempest.api.volume.test_volumes_negative.VolumesNegativeTest.test_unreserve_volume_with_nonexistent_volume_id [0.036582s] ... ok
{11} tempest.api.volume.test_volumes_negative.VolumesNegativeTest.test_update_volume_with_empty_volume_id [0.011697s] ... ok
{11} tempest.api.volume.test_volumes_negative.VolumesNegativeTest.test_update_volume_with_invalid_volume_id [0.029043s] ... ok
{11} tempest.api.volume.test_volumes_negative.VolumesNegativeTest.test_update_volume_with_nonexistent_volume_id [0.032526s] ... ok
{11} tempest.api.volume.test_volumes_negative.VolumesNegativeTest.test_volume_delete_nonexistent_volume_id [0.028330s] ... ok
{11} tempest.api.volume.test_volumes_negative.VolumesNegativeTest.test_volume_get_nonexistent_volume_id [0.024022s] ... ok
{30} tempest.api.volume.test_volumes_actions.VolumesActionsTest.test_get_volume_attachment [29.653915s] ... ok
{39} tempest.api.volume.test_volume_delete_cascade.VolumesDeleteCascade.test_volume_delete_cascade [56.814991s] ... ok
{30} tempest.api.volume.test_volumes_actions.VolumesActionsTest.test_reserve_unreserve_volume [0.471185s] ... ok
{5} tempest.api.volume.admin.test_snapshots_actions.SnapshotsActionsTest.test_snapshot_force_delete_when_snapshot_is_deleting [12.776073s] ... ok
{30} tempest.api.volume.test_volumes_actions.VolumesActionsTest.test_volume_bootable [0.411376s] ... ok
{30} tempest.api.volume.test_volumes_actions.VolumesActionsTest.test_volume_readonly_update [0.392892s] ... ok
{1} tempest.api.volume.admin.test_volumes_actions.VolumesActionsTest.test_volume_force_delete_when_volume_is_creating [14.421202s] ... ok
{4} setUpClass (tempest.api.volume.test_volumes_backup.VolumesBackupsV39Test) ... SKIPPED: Cinder backup feature disabled
{38} tempest.api.volume.test_volumes_clone.VolumesCloneTest.test_create_from_volume [64.374569s] ... ok
{5} tempest.api.volume.admin.test_snapshots_actions.SnapshotsActionsTest.test_snapshot_force_delete_when_snapshot_is_error [10.376867s] ... ok
{1} tempest.api.volume.admin.test_volumes_actions.VolumesActionsTest.test_volume_force_delete_when_volume_is_error [9.389930s] ... ok
{5} tempest.api.volume.admin.test_snapshots_actions.SnapshotsActionsTest.test_snapshot_force_delete_when_snapshot_is_error_deleting [5.062867s] ... ok
{5} tempest.api.volume.admin.test_snapshots_actions.SnapshotsActionsTest.test_update_snapshot_status [0.431270s] ... ok
{1} tempest.api.volume.admin.test_volumes_actions.VolumesActionsTest.test_volume_force_delete_when_volume_is_maintenance [6.475942s] ... ok
{2} tempest.api.volume.test_volumes_get.VolumesGetTest.test_volume_create_get_update_delete_as_clone [30.476867s] ... ok
{1} tempest.api.volume.admin.test_volumes_actions.VolumesActionsTest.test_volume_reset_status [5.633000s] ... ok
{5} setUpClass (tempest.api.volume.test_volumes_backup.VolumesBackupsTest) ... SKIPPED: Cinder backup feature disabled
{1} setUpClass (tempest.api.volume.admin.test_volumes_backup.VolumesBackupsAdminTest) ... SKIPPED: Cinder backup feature disabled

==============================
Failed 1 tests - output below:
==============================

tempest.api.volume.admin.test_volume_pools.VolumePoolsAdminTestsJSON.test_get_pools_with_details[id-d4bb61f7-762d-4437-b8a4-5785759a0ced]
-----------------------------------------------------------------------------------------------------------------------------------------

Captured traceback:
~~~~~~~~~~~~~~~~~~~
    Traceback (most recent call last):

      File "/opt/stack/python-tempestconf/.venv_1/lib/python3.12/site-packages/tempest/api/volume/admin/test_volume_pools.py", line 44, in test_get_pools_with_details
    self._assert_pools(with_detail=True)

      File "/opt/stack/python-tempestconf/.venv_1/lib/python3.12/site-packages/tempest/api/volume/admin/test_volume_pools.py", line 32, in _assert_pools
    self.assertIn(CONF.volume.vendor_name,

      File "/opt/stack/python-tempestconf/.venv_1/lib/python3.12/site-packages/testtools/testcase.py", line 400, in assertIn
    self.assertThat(haystack, Contains(needle), message)

      File "/opt/stack/python-tempestconf/.venv_1/lib/python3.12/site-packages/testtools/testcase.py", line 481, in assertThat
    raise mismatch_error

    testtools.matchers._impl.MismatchError: 'Open Source' not in ['IBM']


Captured pythonlogging:
~~~~~~~~~~~~~~~~~~~~~~~
    2026-02-19 11:26:24,070 901836 INFO     [tempest.lib.common.rest_client] Request (VolumePoolsAdminTestsJSON:test_get_pools_with_details): 200 GET http://9.71.52.160/volume/v3/scheduler-stats/get_pools?detail=True 0.775s
2026-02-19 11:26:24,070 901836 DEBUG    [tempest.lib.common.rest_client] Request - Headers: {'Content-Type': 'application/json', 'Accept': 'application/json', 'X-Auth-Token': '<omitted>'}
        Body: None
    Response - Headers: {'date': 'Thu, 19 Feb 2026 11:26:23 GMT', 'server': 'Apache/2.4.58 (Ubuntu)', 'content-type': 'application/json', 'x-compute-request-id': 'req-10665a6f-37f9-4a72-bdec-0350b07368a5', 'content-length': '907', 'openstack-api-version': 'volume 3.0', 'vary': 'OpenStack-API-Version', 'x-openstack-request-id': 'req-10665a6f-37f9-4a72-bdec-0350b07368a5', 'connection': 'close', 'status': '200', 'content-location': 'http://9.71.52.160/volume/v3/scheduler-stats/get_pools?detail=True'}
        Body: b'{"pools": [{"name": "rhosp-host-4@backend_170#mdiskgrp0", "capabilities": {"pool_name": "mdiskgrp0", "total_capacity_gb": 1782.0, "free_capacity_gb": 1577.0, "provisioned_capacity_gb": 204.0, "compression_support": true, "reserved_percentage": 0, "QoS_support": true, "consistencygroup_support": true, "location_info": "StorwizeSVCDriver:00000204A0806296:mdiskgrp0", "easytier_support": true, "multiattach": true, "thin_provisioning_support": true, "thick_provisioning_support": false, "max_over_subscription_ratio": "20.0", "consistent_group_snapshot_enabled": true, "backend_state": "up", "data_reduction": false, "site_id": "", "site_name": "", "allocated_capacity_gb": 0, "cacheable": true, "volume_backend_name": "partition_pbr", "storage_protocol": "FC", "vendor_name": "IBM", "driver_version": "2.2.6", "timestamp": "2026-02-19T11:26:18.243241", "filter_function": null, "goodness_function": null}}]}'



======
Totals
======
Ran: 175 tests in 95.5862 sec.
 - Passed: 166
 - Skipped: 8
 - Expected Fail: 0
 - Unexpected Success: 0
 - Failed: 1
Sum of execute time for each test: 713.0294 sec.

==============
Worker Balance
==============
 - Worker 0 (3 tests) => 0:00:50.707464
 - Worker 1 (6 tests) => 0:01:04.773500
 - Worker 2 (3 tests) => 0:01:23.005295
 - Worker 3 (2 tests) => 0:00:30.465384
 - Worker 4 (8 tests) => 0:00:58.482568
 - Worker 5 (7 tests) => 0:00:59.198809
 - Worker 6 (3 tests) => 0:00:55.012830
 - Worker 7 (5 tests) => 0:00:21.245058
 - Worker 8 (2 tests) => 0:00:48.412648
 - Worker 9 (2 tests) => 0:00:10.628091
 - Worker 10 (1 tests) => 0:00:09.117924
 - Worker 11 (27 tests) => 0:00:36.941750
 - Worker 12 (2 tests) => 0:00:08.993820
 - Worker 13 (1 tests) => 0:00:09.973613
 - Worker 14 (2 tests) => 0:00:04.459228
 - Worker 15 (7 tests) => 0:00:05.688766
 - Worker 16 (4 tests) => 0:00:04.601388
 - Worker 17 (6 tests) => 0:00:03.139822
 - Worker 18 (5 tests) => 0:00:01.705964
 - Worker 19 (3 tests) => 0:00:02.908857
 - Worker 20 (2 tests) => 0:00:02.231495
 - Worker 21 (18 tests) => 0:00:02.351132
 - Worker 22 (12 tests) => 0:00:02.012516
 - Worker 23 (1 tests) => 0:00:01.296820
 - Worker 24 (2 tests) => 0:00:01.849260
 - Worker 25 (1 tests) => 0:00:01.267973
 - Worker 26 (2 tests) => 0:00:01.508685
 - Worker 27 (1 tests) => 0:00:01.274228
 - Worker 28 (2 tests) => 0:00:01.679306
 - Worker 29 (2 tests) => 0:00:00.839137
 - Worker 30 (4 tests) => 0:00:30.938319
 - Worker 31 (5 tests) => 0:00:01.691602
 - Worker 32 (2 tests) => 0:00:01.216784
 - Worker 33 (2 tests) => 0:00:01.101903
 - Worker 34 (2 tests) => 0:00:00.849003
 - Worker 35 (13 tests) => 0:00:00.824791
 - Worker 36 (1 tests) => 0:00:00.054962
 - Worker 37 (2 tests) => 0:00:18.611059
 - Worker 38 (1 tests) => 0:01:04.374569
 - Worker 39 (1 tests) => 0:00:56.814991
