{2} setUpClass (tempest.api.volume.admin.test_volume_retype.VolumeRetypeWithMigrationTest) ... SKIPPED: Cinder multi-backend feature disabled
{0} setUpClass (tempest.api.volume.test_volumes_backup.VolumesBackupsTest) ... SKIPPED: Cinder backup feature disabled
{4} setUpClass (tempest.api.volume.admin.test_volumes_backup.VolumesBackupsAdminTest) ... SKIPPED: Cinder backup feature disabled
{1} setUpClass (tempest.api.volume.admin.test_multi_backend.VolumeMultiBackendTest) ... SKIPPED: Cinder multi-backend feature disabled
{6} setUpClass (tempest.api.volume.admin.test_volume_retype.VolumeRetypeMultiattachTest) ... SKIPPED: Volume multi-attach is not available.
{3} setUpClass (tempest.api.volume.admin.test_encrypted_volumes_extend.EncryptedVolumesExtendAttachedTest) ... SKIPPED: Attached encrypted volume extend is disabled.
{35} tempest.api.volume.test_versions.VersionsTest.test_list_versions [0.530766s] ... ok
{32} tempest.api.volume.test_volumes_get.VolumesSummaryTest.test_show_volume_summary [0.754570s] ... ok
{34} tempest.api.volume.test_volumes_snapshots_negative.VolumesSnapshotNegativeTestJSON.test_create_snapshot_with_nonexistent_volume_id [1.568077s] ... ok
{34} tempest.api.volume.test_volumes_snapshots_negative.VolumesSnapshotNegativeTestJSON.test_create_snapshot_without_passing_volume_id [0.053395s] ... ok
{34} tempest.api.volume.test_volumes_snapshots_negative.VolumesSnapshotNegativeTestJSON.test_list_snapshot_invalid_param_limit [0.011492s] ... ok
{34} tempest.api.volume.test_volumes_snapshots_negative.VolumesSnapshotNegativeTestJSON.test_list_snapshots_invalid_param_marker [0.065992s] ... ok
{34} tempest.api.volume.test_volumes_snapshots_negative.VolumesSnapshotNegativeTestJSON.test_list_snapshots_invalid_param_sort [0.015304s] ... ok
{33} tempest.api.volume.test_extensions.ExtensionsTestJSON.test_list_extensions [1.590294s] ... ok
{36} tempest.api.volume.test_availability_zone.AvailabilityZoneTestJSON.test_get_availability_zone_list [1.313107s] ... ok
{35} tempest.api.volume.test_versions.VersionsTest.test_show_version [1.125343s] ... ok
{11} tempest.api.volume.admin.test_volume_services.VolumesServicesTestJSON.test_get_service_by_host_name [0.076661s] ... ok
{11} tempest.api.volume.admin.test_volume_services.VolumesServicesTestJSON.test_get_service_by_service_and_host_name [0.036671s] ... ok
{11} tempest.api.volume.admin.test_volume_services.VolumesServicesTestJSON.test_get_service_by_service_binary_name [0.050668s] ... ok
{20} tempest.api.volume.admin.test_volume_quota_classes.VolumeQuotaClassesTest.test_show_default_quota [0.473939s] ... ok
{26} tempest.api.volume.admin.test_volume_types_extra_specs_negative.ExtraSpecsNegativeTest.test_create_invalid_body [0.082839s] ... ok
{26} tempest.api.volume.admin.test_volume_types_extra_specs_negative.ExtraSpecsNegativeTest.test_create_none_body [0.035411s] ... ok
{25} tempest.api.volume.admin.test_volume_types_negative.VolumeTypesNegativeTest.test_create_volume_type_encryption_nonexistent_type_id [0.599757s] ... ok
{26} tempest.api.volume.admin.test_volume_types_extra_specs_negative.ExtraSpecsNegativeTest.test_create_nonexistent_type_id [0.092477s] ... ok
{26} tempest.api.volume.admin.test_volume_types_extra_specs_negative.ExtraSpecsNegativeTest.test_delete_nonexistent_volume_type_id [0.204582s] ... ok
{30} tempest.api.volume.admin.test_volume_services_negative.VolumeServicesNegativeTest.test_disable_log_reason_with_no_reason [0.033027s] ... ok
{26} tempest.api.volume.admin.test_volume_types_extra_specs_negative.ExtraSpecsNegativeTest.test_get_nonexistent_extra_spec_name [0.038761s] ... ok
{30} tempest.api.volume.admin.test_volume_services_negative.VolumeServicesNegativeTest.test_disable_service_with_invalid_binary [0.033059s] ... ok
{26} tempest.api.volume.admin.test_volume_types_extra_specs_negative.ExtraSpecsNegativeTest.test_get_nonexistent_volume_type_id [0.022676s] ... ok
{30} tempest.api.volume.admin.test_volume_services_negative.VolumeServicesNegativeTest.test_enable_service_with_invalid_host [0.018439s] ... ok
{26} tempest.api.volume.admin.test_volume_types_extra_specs_negative.ExtraSpecsNegativeTest.test_list_nonexistent_volume_type_id [0.017965s] ... ok
{30} tempest.api.volume.admin.test_volume_services_negative.VolumeServicesNegativeTest.test_freeze_host_with_invalid_host [0.019674s] ... ok
{26} tempest.api.volume.admin.test_volume_types_extra_specs_negative.ExtraSpecsNegativeTest.test_update_multiple_extra_spec [0.016817s] ... ok
{30} tempest.api.volume.admin.test_volume_services_negative.VolumeServicesNegativeTest.test_thaw_host_with_invalid_host [0.014500s] ... ok
{26} tempest.api.volume.admin.test_volume_types_extra_specs_negative.ExtraSpecsNegativeTest.test_update_no_body [0.020309s] ... ok
{29} tempest.api.volume.admin.test_volume_pools.VolumePoolsAdminTestsJSON.test_get_pools_with_details [1.056235s] ... ok
{26} tempest.api.volume.admin.test_volume_types_extra_specs_negative.ExtraSpecsNegativeTest.test_update_none_extra_spec_id [0.055985s] ... ok
{26} tempest.api.volume.admin.test_volume_types_extra_specs_negative.ExtraSpecsNegativeTest.test_update_nonexistent_extra_spec_id [0.237754s] ... ok
{26} tempest.api.volume.admin.test_volume_types_extra_specs_negative.ExtraSpecsNegativeTest.test_update_nonexistent_type_id [0.177004s] ... ok
{29} tempest.api.volume.admin.test_volume_pools.VolumePoolsAdminTestsJSON.test_get_pools_without_details [0.516671s] ... ok
{28} tempest.api.volume.admin.test_volume_hosts.VolumeHostsAdminTestsJSON.test_list_hosts [0.381784s] ... ok
{25} tempest.api.volume.admin.test_volume_types_negative.VolumeTypesNegativeTest.test_create_volume_with_private_volume_type [2.226561s] ... ok
{25} tempest.api.volume.admin.test_volume_types_negative.VolumeTypesNegativeTest.test_create_with_empty_name [0.134213s] ... ok
{28} tempest.api.volume.admin.test_volume_hosts.VolumeHostsAdminTestsJSON.test_show_host [1.393378s] ... ok
{18} tempest.api.volume.admin.test_volume_types.VolumeTypesTest.test_volume_type_create_get_delete [1.577713s] ... ok
{24} tempest.api.volume.admin.test_volume_types_extra_specs.VolumeTypesExtraSpecsTest.test_volume_type_extra_spec_create_get_delete [1.139117s] ... ok
{25} tempest.api.volume.admin.test_volume_types_negative.VolumeTypesNegativeTest.test_create_with_repeated_name [0.403855s] ... ok
{25} tempest.api.volume.admin.test_volume_types_negative.VolumeTypesNegativeTest.test_delete_nonexistent_type_id [0.018703s] ... ok
{24} tempest.api.volume.admin.test_volume_types_extra_specs.VolumeTypesExtraSpecsTest.test_volume_type_extra_specs_list [0.245592s] ... ok
{25} tempest.api.volume.admin.test_volume_types_negative.VolumeTypesNegativeTest.test_get_nonexistent_type_id [0.015616s] ... ok
{23} tempest.api.volume.admin.test_backends_capabilities.BackendsCapabilitiesAdminTestsJSON.test_compare_volume_stats_values [2.277418s] ... ok
{23} tempest.api.volume.admin.test_backends_capabilities.BackendsCapabilitiesAdminTestsJSON.test_get_capabilities_backend [0.535847s] ... ok
{24} tempest.api.volume.admin.test_volume_types_extra_specs.VolumeTypesExtraSpecsTest.test_volume_type_extra_specs_update [1.015670s] ... ok
{18} tempest.api.volume.admin.test_volume_types.VolumeTypesTest.test_volume_type_encryption_create_get_update_delete [1.488117s] ... ok
{18} tempest.api.volume.admin.test_volume_types.VolumeTypesTest.test_volume_type_list [0.079227s] ... ok
{17} tempest.api.volume.admin.test_qos.QosSpecsTestJSON.test_associate_disassociate_qos [3.571205s] ... ok
{20} tempest.api.volume.admin.test_volume_quota_classes.VolumeQuotaClassesTest.test_update_default_quota [5.060765s] ... ok
{15} tempest.api.volume.admin.test_user_messages.UserMessagesTest.test_delete_message [3.894259s] ... ok
{17} tempest.api.volume.admin.test_qos.QosSpecsTestJSON.test_create_delete_qos_with_back_end_consumer [0.336637s] ... ok
{17} tempest.api.volume.admin.test_qos.QosSpecsTestJSON.test_create_delete_qos_with_both_consumer [0.253365s] ... ok
{18} tempest.api.volume.admin.test_volume_types.VolumeTypesTest.test_volume_type_update [1.075378s] ... ok
{17} tempest.api.volume.admin.test_qos.QosSpecsTestJSON.test_create_delete_qos_with_front_end_consumer [0.307615s] ... ok
{17} tempest.api.volume.admin.test_qos.QosSpecsTestJSON.test_get_qos [0.024024s] ... ok
{17} tempest.api.volume.admin.test_qos.QosSpecsTestJSON.test_list_qos [0.023165s] ... ok
{17} tempest.api.volume.admin.test_qos.QosSpecsTestJSON.test_set_unset_qos_key [0.322146s] ... ok
{3} tempest.api.volume.admin.test_volume_quotas.VolumeQuotasAdminTestJSON.test_delete_quota [3.656889s] ... ok
{3} tempest.api.volume.admin.test_volume_quotas.VolumeQuotasAdminTestJSON.test_list_default_quotas [0.082724s] ... ok
{3} tempest.api.volume.admin.test_volume_quotas.VolumeQuotasAdminTestJSON.test_list_quotas [0.053332s] ... ok
{27} tempest.api.volume.test_volume_metadata.VolumesMetadataTest.test_crud_volume_metadata [0.705142s] ... ok
{15} tempest.api.volume.admin.test_user_messages.UserMessagesTest.test_list_show_messages [3.101879s] ... ok
{14} tempest.api.volume.admin.test_volume_type_access.VolumeTypesAccessTest.test_volume_type_access_add [6.197519s] ... ok
{27} tempest.api.volume.test_volume_metadata.VolumesMetadataTest.test_update_show_volume_metadata_item [0.469996s] ... ok
{16} tempest.api.volume.admin.test_volume_retype.VolumeRetypeWithoutMigrationTest.test_available_volume_retype [7.391495s] ... ok
{14} tempest.api.volume.admin.test_volume_type_access.VolumeTypesAccessTest.test_volume_type_access_list [0.968125s] ... ok
{39} tempest.api.volume.test_volume_absolute_limits.AbsoluteLimitsTests.test_get_volume_absolute_limits [0.045794s] ... ok
{37} tempest.api.volume.admin.test_volume_quotas_negative.VolumeQuotasNegativeTestJSON.test_quota_volume_gigabytes [1.753792s] ... ok
{37} tempest.api.volume.admin.test_volume_quotas_negative.VolumeQuotasNegativeTestJSON.test_quota_volumes [0.357496s] ... ok
{12} tempest.api.volume.test_volumes_clone_negative.VolumesCloneNegativeTest.test_create_from_volume_decreasing_size [18.968262s] ... ok
{31} tempest.api.volume.test_snapshot_metadata.SnapshotMetadataTestJSON.test_crud_snapshot_metadata [0.694611s] ... ok
{31} tempest.api.volume.test_snapshot_metadata.SnapshotMetadataTestJSON.test_update_show_snapshot_metadata_item [0.551687s] ... ok
{8} tempest.api.volume.admin.test_snapshots_actions.SnapshotsActionsTest.test_reset_snapshot_status [0.936113s] ... ok
{13} tempest.api.volume.test_volumes_snapshots.VolumesSnapshotTestJSON.test_snapshot_backup ... SKIPPED: Cinder backup is disabled
{11} tempest.api.volume.admin.test_volume_services.VolumesServicesTestJSON.test_get_service_by_volume_host_name [20.377106s] ... ok
{11} tempest.api.volume.admin.test_volume_services.VolumesServicesTestJSON.test_list_services [0.025841s] ... ok
{21} tempest.api.volume.admin.test_volume_snapshot_quotas_negative.VolumeSnapshotQuotasNegativeTestJSON.test_quota_volume_gigabytes_snapshots [0.575957s] ... ok
{21} tempest.api.volume.admin.test_volume_snapshot_quotas_negative.VolumeSnapshotQuotasNegativeTestJSON.test_quota_volume_snapshots [0.066353s] ... ok
{7} tempest.api.volume.test_volume_transfers.VolumesTransfersTest.test_create_get_list_accept_volume_transfer [21.352079s] ... ok
{4} tempest.api.volume.test_volume_transfers.VolumesTransfersV355Test.test_create_get_list_accept_volume_transfer [21.698102s] ... ok
{22} tempest.api.volume.test_volumes_list.VolumesListTestJSON.test_volume_list [0.079410s] ... ok
{22} tempest.api.volume.test_volumes_list.VolumesListTestJSON.test_volume_list_by_name [0.073696s] ... ok
{22} tempest.api.volume.test_volumes_list.VolumesListTestJSON.test_volume_list_details_by_name [0.066732s] ... ok
{22} tempest.api.volume.test_volumes_list.VolumesListTestJSON.test_volume_list_details_pagination [0.327732s] ... ok
{22} tempest.api.volume.test_volumes_list.VolumesListTestJSON.test_volume_list_details_with_multiple_params [0.154141s] ... ok
{22} tempest.api.volume.test_volumes_list.VolumesListTestJSON.test_volume_list_pagination [0.251896s] ... ok
{22} tempest.api.volume.test_volumes_list.VolumesListTestJSON.test_volume_list_param_display_name_and_status [0.078171s] ... ok
{22} tempest.api.volume.test_volumes_list.VolumesListTestJSON.test_volume_list_with_detail_param_display_name_and_status [0.119823s] ... ok
{22} tempest.api.volume.test_volumes_list.VolumesListTestJSON.test_volume_list_with_detail_param_marker [0.081454s] ... ok
{6} tempest.api.volume.test_volume_transfers.VolumesTransfersV357Test.test_create_get_list_accept_volume_transfer [22.945687s] ... ok
{22} tempest.api.volume.test_volumes_list.VolumesListTestJSON.test_volume_list_with_detail_param_metadata [0.115645s] ... ok
{22} tempest.api.volume.test_volumes_list.VolumesListTestJSON.test_volume_list_with_details [0.145404s] ... ok
{22} tempest.api.volume.test_volumes_list.VolumesListTestJSON.test_volume_list_with_param_metadata [0.044137s] ... ok
{22} tempest.api.volume.test_volumes_list.VolumesListTestJSON.test_volumes_list_by_availability_zone [0.135818s] ... ok
{22} tempest.api.volume.test_volumes_list.VolumesListTestJSON.test_volumes_list_by_bootable [0.130918s] ... ok
{3} tempest.api.volume.admin.test_volume_quotas.VolumeQuotasAdminTestJSON.test_quota_usage [18.779118s] ... ok
{22} tempest.api.volume.test_volumes_list.VolumesListTestJSON.test_volumes_list_by_status [0.179085s] ... ok
{22} tempest.api.volume.test_volumes_list.VolumesListTestJSON.test_volumes_list_details_by_availability_zone [0.096210s] ... ok
{22} tempest.api.volume.test_volumes_list.VolumesListTestJSON.test_volumes_list_details_by_bootable [0.070214s] ... ok
{22} tempest.api.volume.test_volumes_list.VolumesListTestJSON.test_volumes_list_details_by_status [0.086639s] ... ok
{38} tempest.api.volume.test_volumes_snapshots_list.VolumesSnapshotListTestJSON.test_snapshot_list_param_limit [0.037507s] ... ok
{38} tempest.api.volume.test_volumes_snapshots_list.VolumesSnapshotListTestJSON.test_snapshot_list_param_limit_equals_infinite [0.072676s] ... ok
{38} tempest.api.volume.test_volumes_snapshots_list.VolumesSnapshotListTestJSON.test_snapshot_list_param_limit_equals_zero [0.030324s] ... ok
{38} tempest.api.volume.test_volumes_snapshots_list.VolumesSnapshotListTestJSON.test_snapshot_list_param_marker [0.051348s] ... ok
{38} tempest.api.volume.test_volumes_snapshots_list.VolumesSnapshotListTestJSON.test_snapshot_list_param_offset [0.024949s] ... ok
{38} tempest.api.volume.test_volumes_snapshots_list.VolumesSnapshotListTestJSON.test_snapshot_list_param_sort_created_at_asc [0.035762s] ... ok
{38} tempest.api.volume.test_volumes_snapshots_list.VolumesSnapshotListTestJSON.test_snapshot_list_param_sort_created_at_desc [0.022225s] ... ok
{38} tempest.api.volume.test_volumes_snapshots_list.VolumesSnapshotListTestJSON.test_snapshot_list_param_sort_id_asc [0.028110s] ... ok
{38} tempest.api.volume.test_volumes_snapshots_list.VolumesSnapshotListTestJSON.test_snapshot_list_param_sort_id_desc [0.031382s] ... ok
{38} tempest.api.volume.test_volumes_snapshots_list.VolumesSnapshotListTestJSON.test_snapshot_list_param_sort_name_asc [0.025967s] ... ok
{38} tempest.api.volume.test_volumes_snapshots_list.VolumesSnapshotListTestJSON.test_snapshot_list_param_sort_name_desc [0.043431s] ... ok
{38} tempest.api.volume.test_volumes_snapshots_list.VolumesSnapshotListTestJSON.test_snapshots_list_details_with_params [0.111426s] ... ok
{38} tempest.api.volume.test_volumes_snapshots_list.VolumesSnapshotListTestJSON.test_snapshots_list_with_params [0.117922s] ... ok
{0} tempest.api.volume.test_volumes_get.VolumesGetTest.test_volume_create_get_update_delete [33.722478s] ... ok
{19} tempest.api.volume.admin.test_volumes_list.VolumesListAdminTestJSON.test_volume_list_param_tenant [9.759325s] ... ok
{8} tempest.api.volume.admin.test_snapshots_actions.SnapshotsActionsTest.test_snapshot_force_delete_when_snapshot_is_creating [15.705659s] ... ok
{13} tempest.api.volume.test_volumes_snapshots.VolumesSnapshotTestJSON.test_snapshot_create_get_list_update_delete [15.460737s] ... ok
{5} tempest.api.volume.admin.test_volumes_actions.VolumesActionsTest.test_volume_force_delete_when_volume_is_attaching [15.549541s] ... ok
{4} tempest.api.volume.test_volume_transfers.VolumesTransfersV355Test.test_create_list_delete_volume_transfer [16.930180s] ... ok
{9} tempest.api.volume.test_volumes_negative.VolumesNegativeTest.test_attach_volumes_with_nonexistent_volume_id [32.128896s] ... ok
{7} tempest.api.volume.test_volume_transfers.VolumesTransfersTest.test_create_list_delete_volume_transfer [18.020937s] ... ok
{6} tempest.api.volume.test_volume_transfers.VolumesTransfersV357Test.test_create_list_delete_volume_transfer [16.474283s] ... ok
{2} tempest.api.volume.test_volume_delete_cascade.VolumesDeleteCascade.test_volume_delete_cascade [46.462877s] ... ok
{9} tempest.api.volume.test_volumes_negative.VolumesNegativeTest.test_create_volume_from_deactivated_image [3.214742s] ... ok
{3} tempest.api.volume.admin.test_volume_quotas.VolumeQuotasAdminTestJSON.test_quota_usage_after_volume_transfer [18.900359s] ... ok
{3} tempest.api.volume.admin.test_volume_quotas.VolumeQuotasAdminTestJSON.test_show_quota_usage [0.059200s] ... ok
{8} tempest.api.volume.admin.test_snapshots_actions.SnapshotsActionsTest.test_snapshot_force_delete_when_snapshot_is_deleting [9.714178s] ... ok
{3} tempest.api.volume.admin.test_volume_quotas.VolumeQuotasAdminTestJSON.test_update_all_quota_resources_for_tenant [0.773109s] ... ok
{1} tempest.api.volume.test_volumes_clone.VolumesCloneTest.test_create_from_volume [48.555403s] ... ok
{9} tempest.api.volume.test_volumes_negative.VolumesNegativeTest.test_create_volume_from_image_with_decreasing_size [3.092496s] ... ok
{9} tempest.api.volume.test_volumes_negative.VolumesNegativeTest.test_create_volume_with_invalid_size [0.014752s] ... ok
{9} tempest.api.volume.test_volumes_negative.VolumesNegativeTest.test_create_volume_with_nonexistent_snapshot_id [0.023506s] ... ok
{9} tempest.api.volume.test_volumes_negative.VolumesNegativeTest.test_create_volume_with_nonexistent_source_volid [0.025589s] ... ok
{9} tempest.api.volume.test_volumes_negative.VolumesNegativeTest.test_create_volume_with_nonexistent_volume_type [0.024598s] ... ok
{9} tempest.api.volume.test_volumes_negative.VolumesNegativeTest.test_create_volume_with_size_negative [0.016433s] ... ok
{9} tempest.api.volume.test_volumes_negative.VolumesNegativeTest.test_create_volume_with_size_zero [0.022375s] ... ok
{9} tempest.api.volume.test_volumes_negative.VolumesNegativeTest.test_create_volume_without_passing_size [0.015565s] ... ok
{9} tempest.api.volume.test_volumes_negative.VolumesNegativeTest.test_delete_invalid_volume_id [0.079281s] ... ok
{9} tempest.api.volume.test_volumes_negative.VolumesNegativeTest.test_delete_volume_without_passing_volume_id [0.014538s] ... ok
{9} tempest.api.volume.test_volumes_negative.VolumesNegativeTest.test_detach_volumes_with_invalid_volume_id [0.027995s] ... ok
{9} tempest.api.volume.test_volumes_negative.VolumesNegativeTest.test_get_invalid_volume_id [0.024938s] ... ok
{9} tempest.api.volume.test_volumes_negative.VolumesNegativeTest.test_get_volume_without_passing_volume_id [0.198660s] ... ok
{9} tempest.api.volume.test_volumes_negative.VolumesNegativeTest.test_list_volumes_detail_with_invalid_status [0.372577s] ... ok
{9} tempest.api.volume.test_volumes_negative.VolumesNegativeTest.test_list_volumes_detail_with_nonexistent_name [0.035587s] ... ok
{9} tempest.api.volume.test_volumes_negative.VolumesNegativeTest.test_list_volumes_with_invalid_status [0.020899s] ... ok
{9} tempest.api.volume.test_volumes_negative.VolumesNegativeTest.test_list_volumes_with_nonexistent_name [0.090307s] ... ok
{9} tempest.api.volume.test_volumes_negative.VolumesNegativeTest.test_reserve_volume_with_negative_volume_status [0.443882s] ... ok
{9} tempest.api.volume.test_volumes_negative.VolumesNegativeTest.test_reserve_volume_with_nonexistent_volume_id [0.054798s] ... ok
{9} tempest.api.volume.test_volumes_negative.VolumesNegativeTest.test_unreserve_volume_with_nonexistent_volume_id [0.029562s] ... ok
{9} tempest.api.volume.test_volumes_negative.VolumesNegativeTest.test_update_volume_with_empty_volume_id [0.011092s] ... ok
{9} tempest.api.volume.test_volumes_negative.VolumesNegativeTest.test_update_volume_with_invalid_volume_id [0.061544s] ... ok
{9} tempest.api.volume.test_volumes_negative.VolumesNegativeTest.test_update_volume_with_nonexistent_volume_id [0.061042s] ... ok
{9} tempest.api.volume.test_volumes_negative.VolumesNegativeTest.test_volume_delete_nonexistent_volume_id [0.076664s] ... ok
{9} tempest.api.volume.test_volumes_negative.VolumesNegativeTest.test_volume_get_nonexistent_volume_id [0.024472s] ... ok
{10} tempest.api.volume.test_volumes_actions.VolumesActionsTest.test_get_volume_attachment [30.648703s] ... ok
{10} tempest.api.volume.test_volumes_actions.VolumesActionsTest.test_reserve_unreserve_volume [0.408370s] ... ok
{10} tempest.api.volume.test_volumes_actions.VolumesActionsTest.test_volume_bootable [0.298197s] ... ok
{10} tempest.api.volume.test_volumes_actions.VolumesActionsTest.test_volume_readonly_update [0.314615s] ... ok
{5} tempest.api.volume.admin.test_volumes_actions.VolumesActionsTest.test_volume_force_delete_when_volume_is_creating [13.380843s] ... ok
{8} tempest.api.volume.admin.test_snapshots_actions.SnapshotsActionsTest.test_snapshot_force_delete_when_snapshot_is_error [8.357534s] ... ok
{5} tempest.api.volume.admin.test_volumes_actions.VolumesActionsTest.test_volume_force_delete_when_volume_is_error [8.618433s] ... ok
{8} tempest.api.volume.admin.test_snapshots_actions.SnapshotsActionsTest.test_snapshot_force_delete_when_snapshot_is_error_deleting [7.371966s] ... ok
{8} tempest.api.volume.admin.test_snapshots_actions.SnapshotsActionsTest.test_update_snapshot_status [0.402956s] ... ok
{5} tempest.api.volume.admin.test_volumes_actions.VolumesActionsTest.test_volume_force_delete_when_volume_is_maintenance [5.393877s] ... ok
{0} tempest.api.volume.test_volumes_get.VolumesGetTest.test_volume_create_get_update_delete_as_clone [34.776783s] ... ok
{5} tempest.api.volume.admin.test_volumes_actions.VolumesActionsTest.test_volume_reset_status [5.607088s] ... ok
{5} setUpClass (tempest.api.volume.test_volumes_backup.VolumesBackupsV39Test) ... SKIPPED: Cinder backup feature disabled

======
Totals
======
Ran: 175 tests in 83.8789 sec.
 - Passed: 167
 - Skipped: 8
 - Expected Fail: 0
 - Unexpected Success: 0
 - Failed: 0
Sum of execute time for each test: 615.2620 sec.

==============
Worker Balance
==============
 - Worker 0 (3 tests) => 0:01:09.996352
 - Worker 1 (2 tests) => 0:00:50.104986
 - Worker 2 (2 tests) => 0:00:47.772155
 - Worker 3 (8 tests) => 0:00:49.716241
 - Worker 4 (3 tests) => 0:00:44.945532
 - Worker 5 (6 tests) => 0:00:57.745067
 - Worker 6 (3 tests) => 0:00:45.919318
 - Worker 7 (2 tests) => 0:00:39.378475
 - Worker 8 (6 tests) => 0:00:42.497182
 - Worker 9 (27 tests) => 0:00:40.236000
 - Worker 10 (4 tests) => 0:00:31.685133
 - Worker 11 (5 tests) => 0:00:20.572579
 - Worker 12 (1 tests) => 0:00:18.968262
 - Worker 13 (2 tests) => 0:00:15.467034
 - Worker 14 (2 tests) => 0:00:07.167667
 - Worker 15 (2 tests) => 0:00:06.998823
 - Worker 16 (1 tests) => 0:00:07.391495
 - Worker 17 (7 tests) => 0:00:04.844634
 - Worker 18 (4 tests) => 0:00:04.224418
 - Worker 19 (1 tests) => 0:00:09.759325
 - Worker 20 (2 tests) => 0:00:05.537366
 - Worker 21 (2 tests) => 0:00:00.644939
 - Worker 22 (18 tests) => 0:00:02.251342
 - Worker 23 (2 tests) => 0:00:02.815080
 - Worker 24 (3 tests) => 0:00:02.404064
 - Worker 25 (6 tests) => 0:00:03.404049
 - Worker 26 (12 tests) => 0:00:01.013014
 - Worker 27 (2 tests) => 0:00:01.177935
 - Worker 28 (2 tests) => 0:00:01.776908
 - Worker 29 (2 tests) => 0:00:01.575923
 - Worker 30 (5 tests) => 0:00:00.124110
 - Worker 31 (2 tests) => 0:00:01.254406
 - Worker 32 (1 tests) => 0:00:00.754570
 - Worker 33 (1 tests) => 0:00:01.590294
 - Worker 34 (5 tests) => 0:00:01.718753
 - Worker 35 (2 tests) => 0:00:01.657898
 - Worker 36 (1 tests) => 0:00:01.313107
 - Worker 37 (2 tests) => 0:00:02.114345
 - Worker 38 (13 tests) => 0:00:00.642935
 - Worker 39 (1 tests) => 0:00:00.045794
