{0} setUpClass (tempest.api.volume.test_volumes_backup.VolumesBackupsV39Test) ... SKIPPED: Cinder backup feature disabled
{6} setUpClass (tempest.api.volume.admin.test_volumes_backup.VolumesBackupsAdminTest) ... SKIPPED: Cinder backup feature disabled
{5} setUpClass (tempest.api.volume.admin.test_volume_retype.VolumeRetypeWithMigrationTest) ... SKIPPED: Cinder multi-backend feature disabled
{2} setUpClass (tempest.api.volume.admin.test_encrypted_volumes_extend.EncryptedVolumesExtendAttachedTest) ... SKIPPED: Attached encrypted volume extend is disabled.
{4} setUpClass (tempest.api.volume.admin.test_volume_retype.VolumeRetypeMultiattachTest) ... SKIPPED: Volume multi-attach is not available.
{1} setUpClass (tempest.api.volume.admin.test_multi_backend.VolumeMultiBackendTest) ... SKIPPED: Cinder multi-backend feature disabled
{27} tempest.api.volume.test_versions.VersionsTest.test_list_versions [0.632888s] ... ok
{34} tempest.api.volume.test_extensions.ExtensionsTestJSON.test_list_extensions [1.073243s] ... ok
{28} tempest.api.volume.test_availability_zone.AvailabilityZoneTestJSON.test_get_availability_zone_list [1.731108s] ... ok
{30} tempest.api.volume.test_volumes_get.VolumesSummaryTest.test_show_volume_summary [1.819350s] ... ok
{33} tempest.api.volume.test_volumes_snapshots_negative.VolumesSnapshotNegativeTestJSON.test_create_snapshot_with_nonexistent_volume_id [1.879908s] ... ok
{33} tempest.api.volume.test_volumes_snapshots_negative.VolumesSnapshotNegativeTestJSON.test_create_snapshot_without_passing_volume_id [0.160054s] ... ok
{33} tempest.api.volume.test_volumes_snapshots_negative.VolumesSnapshotNegativeTestJSON.test_list_snapshot_invalid_param_limit [0.010525s] ... ok
{33} tempest.api.volume.test_volumes_snapshots_negative.VolumesSnapshotNegativeTestJSON.test_list_snapshots_invalid_param_marker [0.096362s] ... ok
{33} tempest.api.volume.test_volumes_snapshots_negative.VolumesSnapshotNegativeTestJSON.test_list_snapshots_invalid_param_sort [0.028199s] ... ok
{27} tempest.api.volume.test_versions.VersionsTest.test_show_version [1.254685s] ... ok
{12} tempest.api.volume.admin.test_volume_services.VolumesServicesTestJSON.test_get_service_by_host_name [0.039510s] ... ok
{12} tempest.api.volume.admin.test_volume_services.VolumesServicesTestJSON.test_get_service_by_service_and_host_name [0.027482s] ... ok
{12} tempest.api.volume.admin.test_volume_services.VolumesServicesTestJSON.test_get_service_by_service_binary_name [0.060931s] ... ok
{36} tempest.api.volume.admin.test_volume_services_negative.VolumeServicesNegativeTest.test_disable_log_reason_with_no_reason [0.009389s] ... ok
{36} tempest.api.volume.admin.test_volume_services_negative.VolumeServicesNegativeTest.test_disable_service_with_invalid_binary [0.028253s] ... ok
{36} tempest.api.volume.admin.test_volume_services_negative.VolumeServicesNegativeTest.test_enable_service_with_invalid_host [0.024413s] ... ok
{36} tempest.api.volume.admin.test_volume_services_negative.VolumeServicesNegativeTest.test_freeze_host_with_invalid_host [0.025006s] ... ok
{36} tempest.api.volume.admin.test_volume_services_negative.VolumeServicesNegativeTest.test_thaw_host_with_invalid_host [0.019670s] ... ok
{19} tempest.api.volume.admin.test_volume_quota_classes.VolumeQuotaClassesTest.test_show_default_quota [0.448033s] ... ok
{31} tempest.api.volume.admin.test_volume_hosts.VolumeHostsAdminTestsJSON.test_list_hosts [0.316556s] ... ok
{22} tempest.api.volume.admin.test_volume_types_negative.VolumeTypesNegativeTest.test_create_volume_type_encryption_nonexistent_type_id [0.380628s] ... ok
{29} tempest.api.volume.admin.test_volume_pools.VolumePoolsAdminTestsJSON.test_get_pools_with_details [0.857281s] ... FAILED

Captured traceback:
~~~~~~~~~~~~~~~~~~~
    Traceback (most recent call last):

      File "/opt/stack/python-tempestconf/.venv_1/lib/python3.12/site-packages/tempest/api/volume/admin/test_volume_pools.py", line 44, in test_get_pools_with_details
    self._assert_pools(with_detail=True)

      File "/opt/stack/python-tempestconf/.venv_1/lib/python3.12/site-packages/tempest/api/volume/admin/test_volume_pools.py", line 32, in _assert_pools
    self.assertIn(CONF.volume.vendor_name,

      File "/opt/stack/python-tempestconf/.venv_1/lib/python3.12/site-packages/testtools/testcase.py", line 400, in assertIn
    self.assertThat(haystack, Contains(needle), message)

      File "/opt/stack/python-tempestconf/.venv_1/lib/python3.12/site-packages/testtools/testcase.py", line 481, in assertThat
    raise mismatch_error

    testtools.matchers._impl.MismatchError: 'Open Source' not in ['IBM']


Captured pythonlogging:
~~~~~~~~~~~~~~~~~~~~~~~
    2026-02-20 16:33:51,455 2498962 INFO     [tempest.lib.common.rest_client] Request (VolumePoolsAdminTestsJSON:test_get_pools_with_details): 200 GET http://9.71.52.160/volume/v3/scheduler-stats/get_pools?detail=True 0.847s
2026-02-20 16:33:51,456 2498962 DEBUG    [tempest.lib.common.rest_client] Request - Headers: {'Content-Type': 'application/json', 'Accept': 'application/json', 'X-Auth-Token': '<omitted>'}
        Body: None
    Response - Headers: {'date': 'Fri, 20 Feb 2026 16:33:50 GMT', 'server': 'Apache/2.4.58 (Ubuntu)', 'content-type': 'application/json', 'x-compute-request-id': 'req-70106d55-fdc6-463e-a376-0ff532b13b51', 'content-length': '907', 'openstack-api-version': 'volume 3.0', 'vary': 'OpenStack-API-Version', 'x-openstack-request-id': 'req-70106d55-fdc6-463e-a376-0ff532b13b51', 'connection': 'close', 'status': '200', 'content-location': 'http://9.71.52.160/volume/v3/scheduler-stats/get_pools?detail=True'}
        Body: b'{"pools": [{"name": "rhosp-host-4@backend_170#mdiskgrp0", "capabilities": {"pool_name": "mdiskgrp0", "total_capacity_gb": 1782.0, "free_capacity_gb": 1577.0, "provisioned_capacity_gb": 204.0, "compression_support": true, "reserved_percentage": 0, "QoS_support": true, "consistencygroup_support": true, "location_info": "StorwizeSVCDriver:00000204A0806296:mdiskgrp0", "easytier_support": true, "multiattach": true, "thin_provisioning_support": true, "thick_provisioning_support": false, "max_over_subscription_ratio": "20.0", "consistent_group_snapshot_enabled": true, "backend_state": "up", "data_reduction": false, "site_id": "", "site_name": "", "allocated_capacity_gb": 0, "cacheable": true, "volume_backend_name": "partition_pbr", "storage_protocol": "FC", "vendor_name": "IBM", "driver_version": "2.2.6", "timestamp": "2026-02-20T16:33:46.518700", "filter_function": null, "goodness_function": null}}]}'

{26} tempest.api.volume.admin.test_volume_types_extra_specs_negative.ExtraSpecsNegativeTest.test_create_invalid_body [0.365831s] ... ok
{26} tempest.api.volume.admin.test_volume_types_extra_specs_negative.ExtraSpecsNegativeTest.test_create_none_body [0.579298s] ... ok
{22} tempest.api.volume.admin.test_volume_types_negative.VolumeTypesNegativeTest.test_create_volume_with_private_volume_type [1.516530s] ... ok
{29} tempest.api.volume.admin.test_volume_pools.VolumePoolsAdminTestsJSON.test_get_pools_without_details [1.021272s] ... ok
{31} tempest.api.volume.admin.test_volume_hosts.VolumeHostsAdminTestsJSON.test_show_host [1.610358s] ... ok
{26} tempest.api.volume.admin.test_volume_types_extra_specs_negative.ExtraSpecsNegativeTest.test_create_nonexistent_type_id [0.241901s] ... ok
{21} tempest.api.volume.admin.test_volume_types.VolumeTypesTest.test_volume_type_create_get_delete [1.670886s] ... ok
{22} tempest.api.volume.admin.test_volume_types_negative.VolumeTypesNegativeTest.test_create_with_empty_name [0.143442s] ... ok
{26} tempest.api.volume.admin.test_volume_types_extra_specs_negative.ExtraSpecsNegativeTest.test_delete_nonexistent_volume_type_id [0.060679s] ... ok
{23} tempest.api.volume.admin.test_volume_types_extra_specs.VolumeTypesExtraSpecsTest.test_volume_type_extra_spec_create_get_delete [1.092003s] ... ok
{26} tempest.api.volume.admin.test_volume_types_extra_specs_negative.ExtraSpecsNegativeTest.test_get_nonexistent_extra_spec_name [0.180243s] ... ok
{26} tempest.api.volume.admin.test_volume_types_extra_specs_negative.ExtraSpecsNegativeTest.test_get_nonexistent_volume_type_id [0.056460s] ... ok
{26} tempest.api.volume.admin.test_volume_types_extra_specs_negative.ExtraSpecsNegativeTest.test_list_nonexistent_volume_type_id [0.014119s] ... ok
{26} tempest.api.volume.admin.test_volume_types_extra_specs_negative.ExtraSpecsNegativeTest.test_update_multiple_extra_spec [0.012494s] ... ok
{26} tempest.api.volume.admin.test_volume_types_extra_specs_negative.ExtraSpecsNegativeTest.test_update_no_body [0.011491s] ... ok
{26} tempest.api.volume.admin.test_volume_types_extra_specs_negative.ExtraSpecsNegativeTest.test_update_none_extra_spec_id [0.065868s] ... ok
{23} tempest.api.volume.admin.test_volume_types_extra_specs.VolumeTypesExtraSpecsTest.test_volume_type_extra_specs_list [0.175694s] ... ok
{25} tempest.api.volume.admin.test_backends_capabilities.BackendsCapabilitiesAdminTestsJSON.test_compare_volume_stats_values [1.586962s] ... ok
{26} tempest.api.volume.admin.test_volume_types_extra_specs_negative.ExtraSpecsNegativeTest.test_update_nonexistent_extra_spec_id [0.031305s] ... ok
{26} tempest.api.volume.admin.test_volume_types_extra_specs_negative.ExtraSpecsNegativeTest.test_update_nonexistent_type_id [0.025699s] ... ok
{25} tempest.api.volume.admin.test_backends_capabilities.BackendsCapabilitiesAdminTestsJSON.test_get_capabilities_backend [0.523781s] ... ok
{22} tempest.api.volume.admin.test_volume_types_negative.VolumeTypesNegativeTest.test_create_with_repeated_name [1.135733s] ... ok
{22} tempest.api.volume.admin.test_volume_types_negative.VolumeTypesNegativeTest.test_delete_nonexistent_type_id [0.017721s] ... ok
{22} tempest.api.volume.admin.test_volume_types_negative.VolumeTypesNegativeTest.test_get_nonexistent_type_id [0.022129s] ... ok
{23} tempest.api.volume.admin.test_volume_types_extra_specs.VolumeTypesExtraSpecsTest.test_volume_type_extra_specs_update [1.043559s] ... ok
{21} tempest.api.volume.admin.test_volume_types.VolumeTypesTest.test_volume_type_encryption_create_get_update_delete [1.593198s] ... ok
{21} tempest.api.volume.admin.test_volume_types.VolumeTypesTest.test_volume_type_list [0.123297s] ... ok
{19} tempest.api.volume.admin.test_volume_quota_classes.VolumeQuotaClassesTest.test_update_default_quota [3.985212s] ... ok
{18} tempest.api.volume.admin.test_qos.QosSpecsTestJSON.test_associate_disassociate_qos [2.985497s] ... ok
{21} tempest.api.volume.admin.test_volume_types.VolumeTypesTest.test_volume_type_update [0.610852s] ... ok
{18} tempest.api.volume.admin.test_qos.QosSpecsTestJSON.test_create_delete_qos_with_back_end_consumer [0.345762s] ... ok
{18} tempest.api.volume.admin.test_qos.QosSpecsTestJSON.test_create_delete_qos_with_both_consumer [0.444441s] ... ok
{18} tempest.api.volume.admin.test_qos.QosSpecsTestJSON.test_create_delete_qos_with_front_end_consumer [0.366105s] ... ok
{18} tempest.api.volume.admin.test_qos.QosSpecsTestJSON.test_get_qos [0.022517s] ... ok
{2} tempest.api.volume.admin.test_volume_quotas.VolumeQuotasAdminTestJSON.test_delete_quota [3.840627s] ... ok
{18} tempest.api.volume.admin.test_qos.QosSpecsTestJSON.test_list_qos [0.073643s] ... ok
{2} tempest.api.volume.admin.test_volume_quotas.VolumeQuotasAdminTestJSON.test_list_default_quotas [0.060331s] ... ok
{2} tempest.api.volume.admin.test_volume_quotas.VolumeQuotasAdminTestJSON.test_list_quotas [0.036443s] ... ok
{18} tempest.api.volume.admin.test_qos.QosSpecsTestJSON.test_set_unset_qos_key [0.365954s] ... ok
{15} tempest.api.volume.admin.test_user_messages.UserMessagesTest.test_delete_message [6.190692s] ... ok
{16} tempest.api.volume.admin.test_volume_type_access.VolumeTypesAccessTest.test_volume_type_access_add [6.672899s] ... ok
{16} tempest.api.volume.admin.test_volume_type_access.VolumeTypesAccessTest.test_volume_type_access_list [1.112918s] ... ok
{20} tempest.api.volume.admin.test_volume_quotas_negative.VolumeQuotasNegativeTestJSON.test_quota_volume_gigabytes [0.724360s] ... ok
{20} tempest.api.volume.admin.test_volume_quotas_negative.VolumeQuotasNegativeTestJSON.test_quota_volumes [2.804774s] ... ok
{15} tempest.api.volume.admin.test_user_messages.UserMessagesTest.test_list_show_messages [6.300276s] ... ok
{17} tempest.api.volume.admin.test_volume_retype.VolumeRetypeWithoutMigrationTest.test_available_volume_retype [13.620790s] ... ok
{39} tempest.api.volume.test_volume_absolute_limits.AbsoluteLimitsTests.test_get_volume_absolute_limits [0.046422s] ... ok
{35} tempest.api.volume.test_volume_metadata.VolumesMetadataTest.test_crud_volume_metadata [0.912392s] ... ok
{35} tempest.api.volume.test_volume_metadata.VolumesMetadataTest.test_update_show_volume_metadata_item [0.489110s] ... ok
{13} tempest.api.volume.test_volumes_snapshots.VolumesSnapshotTestJSON.test_snapshot_backup ... SKIPPED: Cinder backup is disabled
{12} tempest.api.volume.admin.test_volume_services.VolumesServicesTestJSON.test_get_service_by_volume_host_name [20.961866s] ... ok
{12} tempest.api.volume.admin.test_volume_services.VolumesServicesTestJSON.test_list_services [0.029896s] ... ok
{5} tempest.api.volume.test_volume_transfers.VolumesTransfersV355Test.test_create_get_list_accept_volume_transfer [23.174104s] ... ok
{11} tempest.api.volume.test_volumes_clone_negative.VolumesCloneNegativeTest.test_create_from_volume_decreasing_size [29.913803s] ... ok
{38} tempest.api.volume.admin.test_volume_snapshot_quotas_negative.VolumeSnapshotQuotasNegativeTestJSON.test_quota_volume_gigabytes_snapshots [0.756476s] ... ok
{3} tempest.api.volume.admin.test_snapshots_actions.SnapshotsActionsTest.test_reset_snapshot_status [0.652232s] ... ok
{38} tempest.api.volume.admin.test_volume_snapshot_quotas_negative.VolumeSnapshotQuotasNegativeTestJSON.test_quota_volume_snapshots [0.076490s] ... ok
{32} tempest.api.volume.test_snapshot_metadata.SnapshotMetadataTestJSON.test_crud_snapshot_metadata [0.554611s] ... ok
{32} tempest.api.volume.test_snapshot_metadata.SnapshotMetadataTestJSON.test_update_show_snapshot_metadata_item [0.461459s] ... ok
{2} tempest.api.volume.admin.test_volume_quotas.VolumeQuotasAdminTestJSON.test_quota_usage [21.971975s] ... ok
{6} tempest.api.volume.test_volume_transfers.VolumesTransfersV357Test.test_create_get_list_accept_volume_transfer [27.502490s] ... ok
{4} tempest.api.volume.test_volume_transfers.VolumesTransfersTest.test_create_get_list_accept_volume_transfer [30.192336s] ... ok
{24} tempest.api.volume.test_volumes_list.VolumesListTestJSON.test_volume_list [0.092803s] ... ok
{24} tempest.api.volume.test_volumes_list.VolumesListTestJSON.test_volume_list_by_name [0.069476s] ... ok
{24} tempest.api.volume.test_volumes_list.VolumesListTestJSON.test_volume_list_details_by_name [0.102783s] ... ok
{24} tempest.api.volume.test_volumes_list.VolumesListTestJSON.test_volume_list_details_pagination [0.568758s] ... ok
{24} tempest.api.volume.test_volumes_list.VolumesListTestJSON.test_volume_list_details_with_multiple_params [0.183509s] ... ok
{24} tempest.api.volume.test_volumes_list.VolumesListTestJSON.test_volume_list_pagination [1.115349s] ... ok
{24} tempest.api.volume.test_volumes_list.VolumesListTestJSON.test_volume_list_param_display_name_and_status [0.076836s] ... ok
{24} tempest.api.volume.test_volumes_list.VolumesListTestJSON.test_volume_list_with_detail_param_display_name_and_status [0.163144s] ... ok
{24} tempest.api.volume.test_volumes_list.VolumesListTestJSON.test_volume_list_with_detail_param_marker [0.225270s] ... ok
{24} tempest.api.volume.test_volumes_list.VolumesListTestJSON.test_volume_list_with_detail_param_metadata [0.105067s] ... ok
{24} tempest.api.volume.test_volumes_list.VolumesListTestJSON.test_volume_list_with_details [0.102577s] ... ok
{24} tempest.api.volume.test_volumes_list.VolumesListTestJSON.test_volume_list_with_param_metadata [0.084759s] ... ok
{24} tempest.api.volume.test_volumes_list.VolumesListTestJSON.test_volumes_list_by_availability_zone [0.164382s] ... ok
{24} tempest.api.volume.test_volumes_list.VolumesListTestJSON.test_volumes_list_by_bootable [0.145498s] ... ok
{24} tempest.api.volume.test_volumes_list.VolumesListTestJSON.test_volumes_list_by_status [0.171887s] ... ok
{24} tempest.api.volume.test_volumes_list.VolumesListTestJSON.test_volumes_list_details_by_availability_zone [0.096757s] ... ok
{24} tempest.api.volume.test_volumes_list.VolumesListTestJSON.test_volumes_list_details_by_bootable [0.161181s] ... ok
{24} tempest.api.volume.test_volumes_list.VolumesListTestJSON.test_volumes_list_details_by_status [0.119174s] ... ok
{14} tempest.api.volume.admin.test_volumes_list.VolumesListAdminTestJSON.test_volume_list_param_tenant [12.920716s] ... ok
{9} tempest.api.volume.test_volumes_negative.VolumesNegativeTest.test_attach_volumes_with_nonexistent_volume_id [34.086722s] ... ok
{13} tempest.api.volume.test_volumes_snapshots.VolumesSnapshotTestJSON.test_snapshot_create_get_list_update_delete [24.684811s] ... ok
{9} tempest.api.volume.test_volumes_negative.VolumesNegativeTest.test_create_volume_from_deactivated_image [5.437520s] ... ok
{37} tempest.api.volume.test_volumes_snapshots_list.VolumesSnapshotListTestJSON.test_snapshot_list_param_limit [0.042053s] ... ok
{37} tempest.api.volume.test_volumes_snapshots_list.VolumesSnapshotListTestJSON.test_snapshot_list_param_limit_equals_infinite [0.087991s] ... ok
{37} tempest.api.volume.test_volumes_snapshots_list.VolumesSnapshotListTestJSON.test_snapshot_list_param_limit_equals_zero [0.021456s] ... ok
{37} tempest.api.volume.test_volumes_snapshots_list.VolumesSnapshotListTestJSON.test_snapshot_list_param_marker [0.067971s] ... ok
{37} tempest.api.volume.test_volumes_snapshots_list.VolumesSnapshotListTestJSON.test_snapshot_list_param_offset [0.041512s] ... ok
{37} tempest.api.volume.test_volumes_snapshots_list.VolumesSnapshotListTestJSON.test_snapshot_list_param_sort_created_at_asc [0.042643s] ... ok
{37} tempest.api.volume.test_volumes_snapshots_list.VolumesSnapshotListTestJSON.test_snapshot_list_param_sort_created_at_desc [0.041250s] ... ok
{37} tempest.api.volume.test_volumes_snapshots_list.VolumesSnapshotListTestJSON.test_snapshot_list_param_sort_id_asc [0.041222s] ... ok
{37} tempest.api.volume.test_volumes_snapshots_list.VolumesSnapshotListTestJSON.test_snapshot_list_param_sort_id_desc [0.028339s] ... ok
{37} tempest.api.volume.test_volumes_snapshots_list.VolumesSnapshotListTestJSON.test_snapshot_list_param_sort_name_asc [0.031424s] ... ok
{37} tempest.api.volume.test_volumes_snapshots_list.VolumesSnapshotListTestJSON.test_snapshot_list_param_sort_name_desc [0.047860s] ... ok
{37} tempest.api.volume.test_volumes_snapshots_list.VolumesSnapshotListTestJSON.test_snapshots_list_details_with_params [0.152552s] ... ok
{37} tempest.api.volume.test_volumes_snapshots_list.VolumesSnapshotListTestJSON.test_snapshots_list_with_params [0.143569s] ... ok
{9} tempest.api.volume.test_volumes_negative.VolumesNegativeTest.test_create_volume_from_image_with_decreasing_size [3.198162s] ... ok
{9} tempest.api.volume.test_volumes_negative.VolumesNegativeTest.test_create_volume_with_invalid_size [0.017055s] ... ok
{9} tempest.api.volume.test_volumes_negative.VolumesNegativeTest.test_create_volume_with_nonexistent_snapshot_id [0.092821s] ... ok
{9} tempest.api.volume.test_volumes_negative.VolumesNegativeTest.test_create_volume_with_nonexistent_source_volid [0.043052s] ... ok
{9} tempest.api.volume.test_volumes_negative.VolumesNegativeTest.test_create_volume_with_nonexistent_volume_type [0.024261s] ... ok
{9} tempest.api.volume.test_volumes_negative.VolumesNegativeTest.test_create_volume_with_size_negative [0.016086s] ... ok
{9} tempest.api.volume.test_volumes_negative.VolumesNegativeTest.test_create_volume_with_size_zero [0.018726s] ... ok
{9} tempest.api.volume.test_volumes_negative.VolumesNegativeTest.test_create_volume_without_passing_size [0.014191s] ... ok
{5} tempest.api.volume.test_volume_transfers.VolumesTransfersV355Test.test_create_list_delete_volume_transfer [25.920822s] ... ok
{9} tempest.api.volume.test_volumes_negative.VolumesNegativeTest.test_delete_invalid_volume_id [0.027709s] ... ok
{9} tempest.api.volume.test_volumes_negative.VolumesNegativeTest.test_delete_volume_without_passing_volume_id [0.008725s] ... ok
{9} tempest.api.volume.test_volumes_negative.VolumesNegativeTest.test_detach_volumes_with_invalid_volume_id [0.020434s] ... ok
{9} tempest.api.volume.test_volumes_negative.VolumesNegativeTest.test_get_invalid_volume_id [0.023037s] ... ok
{9} tempest.api.volume.test_volumes_negative.VolumesNegativeTest.test_get_volume_without_passing_volume_id [0.011829s] ... ok
{9} tempest.api.volume.test_volumes_negative.VolumesNegativeTest.test_list_volumes_detail_with_invalid_status [0.066879s] ... ok
{8} tempest.api.volume.test_volumes_get.VolumesGetTest.test_volume_create_get_update_delete [52.414046s] ... ok
{9} tempest.api.volume.test_volumes_negative.VolumesNegativeTest.test_list_volumes_detail_with_nonexistent_name [0.086698s] ... ok
{9} tempest.api.volume.test_volumes_negative.VolumesNegativeTest.test_list_volumes_with_invalid_status [0.054858s] ... ok
{9} tempest.api.volume.test_volumes_negative.VolumesNegativeTest.test_list_volumes_with_nonexistent_name [0.028099s] ... ok
{9} tempest.api.volume.test_volumes_negative.VolumesNegativeTest.test_reserve_volume_with_negative_volume_status [0.266061s] ... ok
{9} tempest.api.volume.test_volumes_negative.VolumesNegativeTest.test_reserve_volume_with_nonexistent_volume_id [0.025652s] ... ok
{9} tempest.api.volume.test_volumes_negative.VolumesNegativeTest.test_unreserve_volume_with_nonexistent_volume_id [0.030508s] ... ok
{9} tempest.api.volume.test_volumes_negative.VolumesNegativeTest.test_update_volume_with_empty_volume_id [0.010083s] ... ok
{9} tempest.api.volume.test_volumes_negative.VolumesNegativeTest.test_update_volume_with_invalid_volume_id [0.025312s] ... ok
{9} tempest.api.volume.test_volumes_negative.VolumesNegativeTest.test_update_volume_with_nonexistent_volume_id [0.066225s] ... ok
{9} tempest.api.volume.test_volumes_negative.VolumesNegativeTest.test_volume_delete_nonexistent_volume_id [0.024955s] ... ok
{9} tempest.api.volume.test_volumes_negative.VolumesNegativeTest.test_volume_get_nonexistent_volume_id [0.022723s] ... ok
{3} tempest.api.volume.admin.test_snapshots_actions.SnapshotsActionsTest.test_snapshot_force_delete_when_snapshot_is_creating [24.990280s] ... ok
{7} tempest.api.volume.admin.test_volumes_actions.VolumesActionsTest.test_volume_force_delete_when_volume_is_attaching [28.895018s] ... ok
{2} tempest.api.volume.admin.test_volume_quotas.VolumeQuotasAdminTestJSON.test_quota_usage_after_volume_transfer [26.630949s] ... ok
{2} tempest.api.volume.admin.test_volume_quotas.VolumeQuotasAdminTestJSON.test_show_quota_usage [0.087631s] ... ok
{10} tempest.api.volume.test_volumes_actions.VolumesActionsTest.test_get_volume_attachment [33.197214s] ... ok
{2} tempest.api.volume.admin.test_volume_quotas.VolumeQuotasAdminTestJSON.test_update_all_quota_resources_for_tenant [0.823157s] ... ok
{6} tempest.api.volume.test_volume_transfers.VolumesTransfersV357Test.test_create_list_delete_volume_transfer [26.986781s] ... ok
{10} tempest.api.volume.test_volumes_actions.VolumesActionsTest.test_reserve_unreserve_volume [0.395395s] ... ok
{4} tempest.api.volume.test_volume_transfers.VolumesTransfersTest.test_create_list_delete_volume_transfer [24.485256s] ... ok
{10} tempest.api.volume.test_volumes_actions.VolumesActionsTest.test_volume_bootable [0.499541s] ... ok
{10} tempest.api.volume.test_volumes_actions.VolumesActionsTest.test_volume_readonly_update [0.419500s] ... ok
{1} tempest.api.volume.test_volume_delete_cascade.VolumesDeleteCascade.test_volume_delete_cascade [63.710010s] ... ok
{3} tempest.api.volume.admin.test_snapshots_actions.SnapshotsActionsTest.test_snapshot_force_delete_when_snapshot_is_deleting [11.575960s] ... ok
{0} tempest.api.volume.test_volumes_clone.VolumesCloneTest.test_create_from_volume [73.197901s] ... ok
{7} tempest.api.volume.admin.test_volumes_actions.VolumesActionsTest.test_volume_force_delete_when_volume_is_creating [18.445375s] ... ok
{3} tempest.api.volume.admin.test_snapshots_actions.SnapshotsActionsTest.test_snapshot_force_delete_when_snapshot_is_error [11.270377s] ... ok
{7} tempest.api.volume.admin.test_volumes_actions.VolumesActionsTest.test_volume_force_delete_when_volume_is_error [6.587730s] ... ok
{3} tempest.api.volume.admin.test_snapshots_actions.SnapshotsActionsTest.test_snapshot_force_delete_when_snapshot_is_error_deleting [5.927470s] ... ok
{3} tempest.api.volume.admin.test_snapshots_actions.SnapshotsActionsTest.test_update_snapshot_status [0.442908s] ... ok
{7} tempest.api.volume.admin.test_volumes_actions.VolumesActionsTest.test_volume_force_delete_when_volume_is_maintenance [8.044636s] ... ok
{8} tempest.api.volume.test_volumes_get.VolumesGetTest.test_volume_create_get_update_delete_as_clone [37.353659s] ... ok
{7} tempest.api.volume.admin.test_volumes_actions.VolumesActionsTest.test_volume_reset_status [5.548020s] ... ok
{3} setUpClass (tempest.api.volume.test_volumes_backup.VolumesBackupsTest) ... SKIPPED: Cinder backup feature disabled

==============================
Failed 1 tests - output below:
==============================

tempest.api.volume.admin.test_volume_pools.VolumePoolsAdminTestsJSON.test_get_pools_with_details[id-d4bb61f7-762d-4437-b8a4-5785759a0ced]
-----------------------------------------------------------------------------------------------------------------------------------------

Captured traceback:
~~~~~~~~~~~~~~~~~~~
    Traceback (most recent call last):

      File "/opt/stack/python-tempestconf/.venv_1/lib/python3.12/site-packages/tempest/api/volume/admin/test_volume_pools.py", line 44, in test_get_pools_with_details
    self._assert_pools(with_detail=True)

      File "/opt/stack/python-tempestconf/.venv_1/lib/python3.12/site-packages/tempest/api/volume/admin/test_volume_pools.py", line 32, in _assert_pools
    self.assertIn(CONF.volume.vendor_name,

      File "/opt/stack/python-tempestconf/.venv_1/lib/python3.12/site-packages/testtools/testcase.py", line 400, in assertIn
    self.assertThat(haystack, Contains(needle), message)

      File "/opt/stack/python-tempestconf/.venv_1/lib/python3.12/site-packages/testtools/testcase.py", line 481, in assertThat
    raise mismatch_error

    testtools.matchers._impl.MismatchError: 'Open Source' not in ['IBM']


Captured pythonlogging:
~~~~~~~~~~~~~~~~~~~~~~~
    2026-02-20 16:33:51,455 2498962 INFO     [tempest.lib.common.rest_client] Request (VolumePoolsAdminTestsJSON:test_get_pools_with_details): 200 GET http://9.71.52.160/volume/v3/scheduler-stats/get_pools?detail=True 0.847s
2026-02-20 16:33:51,456 2498962 DEBUG    [tempest.lib.common.rest_client] Request - Headers: {'Content-Type': 'application/json', 'Accept': 'application/json', 'X-Auth-Token': '<omitted>'}
        Body: None
    Response - Headers: {'date': 'Fri, 20 Feb 2026 16:33:50 GMT', 'server': 'Apache/2.4.58 (Ubuntu)', 'content-type': 'application/json', 'x-compute-request-id': 'req-70106d55-fdc6-463e-a376-0ff532b13b51', 'content-length': '907', 'openstack-api-version': 'volume 3.0', 'vary': 'OpenStack-API-Version', 'x-openstack-request-id': 'req-70106d55-fdc6-463e-a376-0ff532b13b51', 'connection': 'close', 'status': '200', 'content-location': 'http://9.71.52.160/volume/v3/scheduler-stats/get_pools?detail=True'}
        Body: b'{"pools": [{"name": "rhosp-host-4@backend_170#mdiskgrp0", "capabilities": {"pool_name": "mdiskgrp0", "total_capacity_gb": 1782.0, "free_capacity_gb": 1577.0, "provisioned_capacity_gb": 204.0, "compression_support": true, "reserved_percentage": 0, "QoS_support": true, "consistencygroup_support": true, "location_info": "StorwizeSVCDriver:00000204A0806296:mdiskgrp0", "easytier_support": true, "multiattach": true, "thin_provisioning_support": true, "thick_provisioning_support": false, "max_over_subscription_ratio": "20.0", "consistent_group_snapshot_enabled": true, "backend_state": "up", "data_reduction": false, "site_id": "", "site_name": "", "allocated_capacity_gb": 0, "cacheable": true, "volume_backend_name": "partition_pbr", "storage_protocol": "FC", "vendor_name": "IBM", "driver_version": "2.2.6", "timestamp": "2026-02-20T16:33:46.518700", "filter_function": null, "goodness_function": null}}]}'



======
Totals
======
Ran: 175 tests in 97.6419 sec.
 - Passed: 166
 - Skipped: 8
 - Expected Fail: 0
 - Unexpected Success: 0
 - Failed: 1
Sum of execute time for each test: 807.8480 sec.

==============
Worker Balance
==============
 - Worker 0 (2 tests) => 0:01:14.732116
 - Worker 1 (2 tests) => 0:01:06.295411
 - Worker 2 (8 tests) => 0:01:00.758084
 - Worker 3 (7 tests) => 0:01:06.176577
 - Worker 4 (3 tests) => 0:01:01.465027
 - Worker 5 (3 tests) => 0:00:55.470548
 - Worker 6 (3 tests) => 0:01:01.097553
 - Worker 7 (5 tests) => 0:01:07.528954
 - Worker 8 (2 tests) => 0:01:29.777238
 - Worker 9 (27 tests) => 0:00:43.780710
 - Worker 10 (4 tests) => 0:00:34.522347
 - Worker 11 (1 tests) => 0:00:29.913803
 - Worker 12 (5 tests) => 0:00:21.128852
 - Worker 13 (2 tests) => 0:00:24.688001
 - Worker 14 (1 tests) => 0:00:12.920716
 - Worker 15 (2 tests) => 0:00:12.494894
 - Worker 16 (2 tests) => 0:00:07.790680
 - Worker 17 (1 tests) => 0:00:13.620790
 - Worker 18 (7 tests) => 0:00:04.611030
 - Worker 19 (2 tests) => 0:00:04.434965
 - Worker 20 (2 tests) => 0:00:03.533475
 - Worker 21 (4 tests) => 0:00:04.003257
 - Worker 22 (6 tests) => 0:00:03.222340
 - Worker 23 (3 tests) => 0:00:02.315154
 - Worker 24 (18 tests) => 0:00:03.766853
 - Worker 25 (2 tests) => 0:00:02.113611
 - Worker 26 (12 tests) => 0:00:01.656477
 - Worker 27 (2 tests) => 0:00:01.889495
 - Worker 28 (1 tests) => 0:00:01.731108
 - Worker 29 (2 tests) => 0:00:01.882835
 - Worker 30 (1 tests) => 0:00:01.819350
 - Worker 31 (2 tests) => 0:00:01.929103
 - Worker 32 (2 tests) => 0:00:01.021551
 - Worker 33 (5 tests) => 0:00:02.179225
 - Worker 34 (1 tests) => 0:00:01.073243
 - Worker 35 (2 tests) => 0:00:01.406469
 - Worker 36 (5 tests) => 0:00:00.110364
 - Worker 37 (13 tests) => 0:00:00.805193
 - Worker 38 (2 tests) => 0:00:00.838626
 - Worker 39 (1 tests) => 0:00:00.046422
