{1} setUpClass (tempest.api.volume.admin.test_encrypted_volumes_extend.EncryptedVolumesExtendAttachedTest) ... SKIPPED: Attached encrypted volume extend is disabled.
{2} setUpClass (tempest.api.volume.admin.test_multi_backend.VolumeMultiBackendTest) ... SKIPPED: Cinder multi-backend feature disabled
{0} setUpClass (tempest.api.volume.test_volumes_backup.VolumesBackupsTest) ... SKIPPED: Cinder backup feature disabled
{4} setUpClass (tempest.api.volume.admin.test_volume_retype.VolumeRetypeWithMigrationTest) ... SKIPPED: Cinder multi-backend feature disabled
{6} setUpClass (tempest.api.volume.admin.test_volume_retype.VolumeRetypeMultiattachTest) ... SKIPPED: Volume multi-attach is not available.
{32} tempest.api.volume.test_versions.VersionsTest.test_list_versions [0.039921s] ... ok
{36} tempest.api.volume.test_volumes_get.VolumesSummaryTest.test_show_volume_summary [2.009392s] ... ok
{28} tempest.api.volume.test_availability_zone.AvailabilityZoneTestJSON.test_get_availability_zone_list [1.868692s] ... ok
{34} tempest.api.volume.test_extensions.ExtensionsTestJSON.test_list_extensions [1.801668s] ... ok
{21} tempest.api.volume.test_volumes_snapshots_negative.VolumesSnapshotNegativeTestJSON.test_create_snapshot_with_nonexistent_volume_id [1.041564s] ... ok
{21} tempest.api.volume.test_volumes_snapshots_negative.VolumesSnapshotNegativeTestJSON.test_create_snapshot_without_passing_volume_id [0.047678s] ... ok
{21} tempest.api.volume.test_volumes_snapshots_negative.VolumesSnapshotNegativeTestJSON.test_list_snapshot_invalid_param_limit [0.010258s] ... ok
{21} tempest.api.volume.test_volumes_snapshots_negative.VolumesSnapshotNegativeTestJSON.test_list_snapshots_invalid_param_marker [0.061457s] ... ok
{21} tempest.api.volume.test_volumes_snapshots_negative.VolumesSnapshotNegativeTestJSON.test_list_snapshots_invalid_param_sort [0.014734s] ... ok
{32} tempest.api.volume.test_versions.VersionsTest.test_show_version [1.742279s] ... ok
{25} tempest.api.volume.admin.test_volume_types_negative.VolumeTypesNegativeTest.test_create_volume_type_encryption_nonexistent_type_id [0.508235s] ... ok
{12} tempest.api.volume.admin.test_volume_services.VolumesServicesTestJSON.test_get_service_by_host_name [0.025700s] ... ok
{12} tempest.api.volume.admin.test_volume_services.VolumesServicesTestJSON.test_get_service_by_service_and_host_name [0.017210s] ... ok
{12} tempest.api.volume.admin.test_volume_services.VolumesServicesTestJSON.test_get_service_by_service_binary_name [0.018586s] ... ok
{18} tempest.api.volume.admin.test_volume_types.VolumeTypesTest.test_volume_type_create_get_delete [1.001873s] ... ok
{29} tempest.api.volume.admin.test_volume_hosts.VolumeHostsAdminTestsJSON.test_list_hosts [0.477243s] ... ok
{20} tempest.api.volume.admin.test_volume_quota_classes.VolumeQuotaClassesTest.test_show_default_quota [0.362163s] ... ok
{25} tempest.api.volume.admin.test_volume_types_negative.VolumeTypesNegativeTest.test_create_volume_with_private_volume_type [1.055654s] ... ok
{38} tempest.api.volume.admin.test_volume_services_negative.VolumeServicesNegativeTest.test_disable_log_reason_with_no_reason [0.209830s] ... ok
{25} tempest.api.volume.admin.test_volume_types_negative.VolumeTypesNegativeTest.test_create_with_empty_name [0.316993s] ... ok
{38} tempest.api.volume.admin.test_volume_services_negative.VolumeServicesNegativeTest.test_disable_service_with_invalid_binary [0.318929s] ... ok
{26} tempest.api.volume.admin.test_volume_pools.VolumePoolsAdminTestsJSON.test_get_pools_with_details [0.923651s] ... FAILED

Captured traceback:
~~~~~~~~~~~~~~~~~~~
    Traceback (most recent call last):

      File "/opt/stack/python-tempestconf/.venv_1/lib/python3.12/site-packages/tempest/api/volume/admin/test_volume_pools.py", line 44, in test_get_pools_with_details
    self._assert_pools(with_detail=True)

      File "/opt/stack/python-tempestconf/.venv_1/lib/python3.12/site-packages/tempest/api/volume/admin/test_volume_pools.py", line 32, in _assert_pools
    self.assertIn(CONF.volume.vendor_name,

      File "/opt/stack/python-tempestconf/.venv_1/lib/python3.12/site-packages/testtools/testcase.py", line 400, in assertIn
    self.assertThat(haystack, Contains(needle), message)

      File "/opt/stack/python-tempestconf/.venv_1/lib/python3.12/site-packages/testtools/testcase.py", line 481, in assertThat
    raise mismatch_error

    testtools.matchers._impl.MismatchError: 'Open Source' not in ['IBM']


Captured pythonlogging:
~~~~~~~~~~~~~~~~~~~~~~~
    2026-02-20 13:09:11,610 2450193 INFO     [tempest.lib.common.rest_client] Request (VolumePoolsAdminTestsJSON:test_get_pools_with_details): 200 GET http://9.71.52.160/volume/v3/scheduler-stats/get_pools?detail=True 0.917s
2026-02-20 13:09:11,611 2450193 DEBUG    [tempest.lib.common.rest_client] Request - Headers: {'Content-Type': 'application/json', 'Accept': 'application/json', 'X-Auth-Token': '<omitted>'}
        Body: None
    Response - Headers: {'date': 'Fri, 20 Feb 2026 13:09:10 GMT', 'server': 'Apache/2.4.58 (Ubuntu)', 'content-type': 'application/json', 'x-compute-request-id': 'req-4bf9c21b-01f9-4f41-adec-7e56edc12c41', 'content-length': '940', 'openstack-api-version': 'volume 3.0', 'vary': 'OpenStack-API-Version', 'x-openstack-request-id': 'req-4bf9c21b-01f9-4f41-adec-7e56edc12c41', 'connection': 'close', 'status': '200', 'content-location': 'http://9.71.52.160/volume/v3/scheduler-stats/get_pools?detail=True'}
        Body: b'{"pools": [{"name": "rhosp-host-4@backend_170#mdiskgrp0", "capabilities": {"pool_name": "mdiskgrp0", "total_capacity_gb": 1782.0, "free_capacity_gb": 1577.0, "provisioned_capacity_gb": 204.0, "compression_support": true, "reserved_percentage": 0, "QoS_support": true, "consistencygroup_support": true, "location_info": "StorwizeSVCDriver:00000204A0806296:mdiskgrp0", "easytier_support": true, "multiattach": true, "thin_provisioning_support": true, "thick_provisioning_support": false, "max_over_subscription_ratio": "20.0", "consistent_group_snapshot_enabled": true, "backend_state": "up", "data_reduction": false, "site_id": "", "site_name": "", "clone_type": "thinclone clone", "allocated_capacity_gb": 0, "cacheable": true, "volume_backend_name": "partition_pbr", "storage_protocol": "FC", "vendor_name": "IBM", "driver_version": "2.2.6", "timestamp": "2026-02-20T13:09:05.136982", "filter_function": null, "goodness_function": null}}]}'

{27} tempest.api.volume.admin.test_volume_types_extra_specs_negative.ExtraSpecsNegativeTest.test_create_invalid_body [0.349466s] ... ok
{38} tempest.api.volume.admin.test_volume_services_negative.VolumeServicesNegativeTest.test_enable_service_with_invalid_host [0.546645s] ... ok
{19} tempest.api.volume.admin.test_qos.QosSpecsTestJSON.test_associate_disassociate_qos [3.145432s] ... ok
{27} tempest.api.volume.admin.test_volume_types_extra_specs_negative.ExtraSpecsNegativeTest.test_create_none_body [0.438375s] ... ok
{38} tempest.api.volume.admin.test_volume_services_negative.VolumeServicesNegativeTest.test_freeze_host_with_invalid_host [0.274691s] ... ok
{23} tempest.api.volume.admin.test_volume_types_extra_specs.VolumeTypesExtraSpecsTest.test_volume_type_extra_spec_create_get_delete [1.713413s] ... ok
{29} tempest.api.volume.admin.test_volume_hosts.VolumeHostsAdminTestsJSON.test_show_host [1.587665s] ... ok
{38} tempest.api.volume.admin.test_volume_services_negative.VolumeServicesNegativeTest.test_thaw_host_with_invalid_host [0.282713s] ... ok
{27} tempest.api.volume.admin.test_volume_types_extra_specs_negative.ExtraSpecsNegativeTest.test_create_nonexistent_type_id [0.361563s] ... ok
{26} tempest.api.volume.admin.test_volume_pools.VolumePoolsAdminTestsJSON.test_get_pools_without_details [0.935908s] ... ok
{27} tempest.api.volume.admin.test_volume_types_extra_specs_negative.ExtraSpecsNegativeTest.test_delete_nonexistent_volume_type_id [0.155221s] ... ok
{25} tempest.api.volume.admin.test_volume_types_negative.VolumeTypesNegativeTest.test_create_with_repeated_name [1.284856s] ... ok
{25} tempest.api.volume.admin.test_volume_types_negative.VolumeTypesNegativeTest.test_delete_nonexistent_type_id [0.015472s] ... ok
{23} tempest.api.volume.admin.test_volume_types_extra_specs.VolumeTypesExtraSpecsTest.test_volume_type_extra_specs_list [0.385546s] ... ok
{27} tempest.api.volume.admin.test_volume_types_extra_specs_negative.ExtraSpecsNegativeTest.test_get_nonexistent_extra_spec_name [0.021253s] ... ok
{25} tempest.api.volume.admin.test_volume_types_negative.VolumeTypesNegativeTest.test_get_nonexistent_type_id [0.014425s] ... ok
{27} tempest.api.volume.admin.test_volume_types_extra_specs_negative.ExtraSpecsNegativeTest.test_get_nonexistent_volume_type_id [0.027216s] ... ok
{27} tempest.api.volume.admin.test_volume_types_extra_specs_negative.ExtraSpecsNegativeTest.test_list_nonexistent_volume_type_id [0.027830s] ... ok
{19} tempest.api.volume.admin.test_qos.QosSpecsTestJSON.test_create_delete_qos_with_back_end_consumer [0.629453s] ... ok
{24} tempest.api.volume.admin.test_backends_capabilities.BackendsCapabilitiesAdminTestsJSON.test_compare_volume_stats_values [1.633929s] ... ok
{27} tempest.api.volume.admin.test_volume_types_extra_specs_negative.ExtraSpecsNegativeTest.test_update_multiple_extra_spec [0.008525s] ... ok
{27} tempest.api.volume.admin.test_volume_types_extra_specs_negative.ExtraSpecsNegativeTest.test_update_no_body [0.009201s] ... ok
{27} tempest.api.volume.admin.test_volume_types_extra_specs_negative.ExtraSpecsNegativeTest.test_update_none_extra_spec_id [0.076170s] ... ok
{27} tempest.api.volume.admin.test_volume_types_extra_specs_negative.ExtraSpecsNegativeTest.test_update_nonexistent_extra_spec_id [0.060295s] ... ok
{27} tempest.api.volume.admin.test_volume_types_extra_specs_negative.ExtraSpecsNegativeTest.test_update_nonexistent_type_id [0.025134s] ... ok
{18} tempest.api.volume.admin.test_volume_types.VolumeTypesTest.test_volume_type_encryption_create_get_update_delete [2.612624s] ... ok
{19} tempest.api.volume.admin.test_qos.QosSpecsTestJSON.test_create_delete_qos_with_both_consumer [0.329195s] ... ok
{18} tempest.api.volume.admin.test_volume_types.VolumeTypesTest.test_volume_type_list [0.041643s] ... ok
{24} tempest.api.volume.admin.test_backends_capabilities.BackendsCapabilitiesAdminTestsJSON.test_get_capabilities_backend [0.516932s] ... ok
{23} tempest.api.volume.admin.test_volume_types_extra_specs.VolumeTypesExtraSpecsTest.test_volume_type_extra_specs_update [0.588960s] ... ok
{19} tempest.api.volume.admin.test_qos.QosSpecsTestJSON.test_create_delete_qos_with_front_end_consumer [0.400877s] ... ok
{19} tempest.api.volume.admin.test_qos.QosSpecsTestJSON.test_get_qos [0.014274s] ... ok
{19} tempest.api.volume.admin.test_qos.QosSpecsTestJSON.test_list_qos [0.026630s] ... ok
{18} tempest.api.volume.admin.test_volume_types.VolumeTypesTest.test_volume_type_update [0.552706s] ... ok
{19} tempest.api.volume.admin.test_qos.QosSpecsTestJSON.test_set_unset_qos_key [0.360681s] ... ok
{20} tempest.api.volume.admin.test_volume_quota_classes.VolumeQuotaClassesTest.test_update_default_quota [3.727446s] ... ok
{14} tempest.api.volume.admin.test_user_messages.UserMessagesTest.test_delete_message [7.329791s] ... ok
{5} tempest.api.volume.admin.test_volume_quotas.VolumeQuotasAdminTestJSON.test_delete_quota [7.214174s] ... ok
{5} tempest.api.volume.admin.test_volume_quotas.VolumeQuotasAdminTestJSON.test_list_default_quotas [0.059875s] ... ok
{5} tempest.api.volume.admin.test_volume_quotas.VolumeQuotasAdminTestJSON.test_list_quotas [0.057894s] ... ok
{17} tempest.api.volume.admin.test_volume_type_access.VolumeTypesAccessTest.test_volume_type_access_add [8.464275s] ... ok
{17} tempest.api.volume.admin.test_volume_type_access.VolumeTypesAccessTest.test_volume_type_access_list [0.718410s] ... ok
{14} tempest.api.volume.admin.test_user_messages.UserMessagesTest.test_list_show_messages [3.462906s] ... ok
{16} tempest.api.volume.admin.test_volume_retype.VolumeRetypeWithoutMigrationTest.test_available_volume_retype [10.134527s] ... ok
{39} tempest.api.volume.test_volume_absolute_limits.AbsoluteLimitsTests.test_get_volume_absolute_limits [0.064558s] ... ok
{33} tempest.api.volume.admin.test_volume_quotas_negative.VolumeQuotasNegativeTestJSON.test_quota_volume_gigabytes [0.392167s] ... ok
{31} tempest.api.volume.test_volume_metadata.VolumesMetadataTest.test_crud_volume_metadata [0.609047s] ... ok
{33} tempest.api.volume.admin.test_volume_quotas_negative.VolumeQuotasNegativeTestJSON.test_quota_volumes [0.516080s] ... ok
{31} tempest.api.volume.test_volume_metadata.VolumesMetadataTest.test_update_show_volume_metadata_item [0.583082s] ... ok
{13} tempest.api.volume.test_volumes_snapshots.VolumesSnapshotTestJSON.test_snapshot_backup ... SKIPPED: Cinder backup is disabled
{11} tempest.api.volume.test_volumes_clone_negative.VolumesCloneNegativeTest.test_create_from_volume_decreasing_size [21.474272s] ... ok
{12} tempest.api.volume.admin.test_volume_services.VolumesServicesTestJSON.test_get_service_by_volume_host_name [21.401908s] ... ok
{12} tempest.api.volume.admin.test_volume_services.VolumesServicesTestJSON.test_list_services [0.049240s] ... ok
{6} tempest.api.volume.test_volume_transfers.VolumesTransfersV355Test.test_create_get_list_accept_volume_transfer [21.981160s] ... ok
{9} tempest.api.volume.test_volume_transfers.VolumesTransfersV357Test.test_create_get_list_accept_volume_transfer [23.472830s] ... ok
{3} tempest.api.volume.admin.test_snapshots_actions.SnapshotsActionsTest.test_reset_snapshot_status [0.921021s] ... ok
{35} tempest.api.volume.admin.test_volume_snapshot_quotas_negative.VolumeSnapshotQuotasNegativeTestJSON.test_quota_volume_gigabytes_snapshots [0.994741s] ... ok
{35} tempest.api.volume.admin.test_volume_snapshot_quotas_negative.VolumeSnapshotQuotasNegativeTestJSON.test_quota_volume_snapshots [0.118419s] ... ok
{22} tempest.api.volume.test_volumes_list.VolumesListTestJSON.test_volume_list [0.038293s] ... ok
{30} tempest.api.volume.test_snapshot_metadata.SnapshotMetadataTestJSON.test_crud_snapshot_metadata [0.735315s] ... ok
{22} tempest.api.volume.test_volumes_list.VolumesListTestJSON.test_volume_list_by_name [0.074661s] ... ok
{22} tempest.api.volume.test_volumes_list.VolumesListTestJSON.test_volume_list_details_by_name [0.082576s] ... ok
{30} tempest.api.volume.test_snapshot_metadata.SnapshotMetadataTestJSON.test_update_show_snapshot_metadata_item [0.395695s] ... ok
{22} tempest.api.volume.test_volumes_list.VolumesListTestJSON.test_volume_list_details_pagination [0.347486s] ... ok
{22} tempest.api.volume.test_volumes_list.VolumesListTestJSON.test_volume_list_details_with_multiple_params [0.188712s] ... ok
{22} tempest.api.volume.test_volumes_list.VolumesListTestJSON.test_volume_list_pagination [0.320596s] ... ok
{22} tempest.api.volume.test_volumes_list.VolumesListTestJSON.test_volume_list_param_display_name_and_status [0.072858s] ... ok
{22} tempest.api.volume.test_volumes_list.VolumesListTestJSON.test_volume_list_with_detail_param_display_name_and_status [0.120263s] ... ok
{22} tempest.api.volume.test_volumes_list.VolumesListTestJSON.test_volume_list_with_detail_param_marker [0.106531s] ... ok
{22} tempest.api.volume.test_volumes_list.VolumesListTestJSON.test_volume_list_with_detail_param_metadata [0.094477s] ... ok
{22} tempest.api.volume.test_volumes_list.VolumesListTestJSON.test_volume_list_with_details [0.122944s] ... ok
{22} tempest.api.volume.test_volumes_list.VolumesListTestJSON.test_volume_list_with_param_metadata [0.098503s] ... ok
{22} tempest.api.volume.test_volumes_list.VolumesListTestJSON.test_volumes_list_by_availability_zone [0.168920s] ... ok
{22} tempest.api.volume.test_volumes_list.VolumesListTestJSON.test_volumes_list_by_bootable [0.149986s] ... ok
{5} tempest.api.volume.admin.test_volume_quotas.VolumeQuotasAdminTestJSON.test_quota_usage [21.493434s] ... ok
{22} tempest.api.volume.test_volumes_list.VolumesListTestJSON.test_volumes_list_by_status [0.127220s] ... ok
{22} tempest.api.volume.test_volumes_list.VolumesListTestJSON.test_volumes_list_details_by_availability_zone [0.085180s] ... ok
{22} tempest.api.volume.test_volumes_list.VolumesListTestJSON.test_volumes_list_details_by_bootable [0.101768s] ... ok
{22} tempest.api.volume.test_volumes_list.VolumesListTestJSON.test_volumes_list_details_by_status [0.089625s] ... ok
{8} tempest.api.volume.test_volume_transfers.VolumesTransfersTest.test_create_get_list_accept_volume_transfer [30.225826s] ... ok
{13} tempest.api.volume.test_volumes_snapshots.VolumesSnapshotTestJSON.test_snapshot_create_get_list_update_delete [21.477016s] ... ok
{7} tempest.api.volume.test_volumes_negative.VolumesNegativeTest.test_attach_volumes_with_nonexistent_volume_id [29.659353s] ... ok
{0} tempest.api.volume.test_volumes_get.VolumesGetTest.test_volume_create_get_update_delete [46.200951s] ... ok
{7} tempest.api.volume.test_volumes_negative.VolumesNegativeTest.test_create_volume_from_deactivated_image [3.436501s] ... ok
{6} tempest.api.volume.test_volume_transfers.VolumesTransfersV355Test.test_create_list_delete_volume_transfer [20.805715s] ... ok
{3} tempest.api.volume.admin.test_snapshots_actions.SnapshotsActionsTest.test_snapshot_force_delete_when_snapshot_is_creating [20.093090s] ... ok
{15} tempest.api.volume.admin.test_volumes_list.VolumesListAdminTestJSON.test_volume_list_param_tenant [12.096220s] ... ok
{7} tempest.api.volume.test_volumes_negative.VolumesNegativeTest.test_create_volume_from_image_with_decreasing_size [3.374421s] ... ok
{7} tempest.api.volume.test_volumes_negative.VolumesNegativeTest.test_create_volume_with_invalid_size [0.016332s] ... ok
{7} tempest.api.volume.test_volumes_negative.VolumesNegativeTest.test_create_volume_with_nonexistent_snapshot_id [0.023881s] ... ok
{7} tempest.api.volume.test_volumes_negative.VolumesNegativeTest.test_create_volume_with_nonexistent_source_volid [0.059593s] ... ok
{7} tempest.api.volume.test_volumes_negative.VolumesNegativeTest.test_create_volume_with_nonexistent_volume_type [0.027925s] ... ok
{7} tempest.api.volume.test_volumes_negative.VolumesNegativeTest.test_create_volume_with_size_negative [0.030294s] ... ok
{7} tempest.api.volume.test_volumes_negative.VolumesNegativeTest.test_create_volume_with_size_zero [0.016344s] ... ok
{7} tempest.api.volume.test_volumes_negative.VolumesNegativeTest.test_create_volume_without_passing_size [0.016198s] ... ok
{7} tempest.api.volume.test_volumes_negative.VolumesNegativeTest.test_delete_invalid_volume_id [0.044297s] ... ok
{7} tempest.api.volume.test_volumes_negative.VolumesNegativeTest.test_delete_volume_without_passing_volume_id [0.010873s] ... ok
{7} tempest.api.volume.test_volumes_negative.VolumesNegativeTest.test_detach_volumes_with_invalid_volume_id [0.019402s] ... ok
{7} tempest.api.volume.test_volumes_negative.VolumesNegativeTest.test_get_invalid_volume_id [0.015567s] ... ok
{7} tempest.api.volume.test_volumes_negative.VolumesNegativeTest.test_get_volume_without_passing_volume_id [0.007827s] ... ok
{7} tempest.api.volume.test_volumes_negative.VolumesNegativeTest.test_list_volumes_detail_with_invalid_status [0.068642s] ... ok
{7} tempest.api.volume.test_volumes_negative.VolumesNegativeTest.test_list_volumes_detail_with_nonexistent_name [0.043666s] ... ok
{7} tempest.api.volume.test_volumes_negative.VolumesNegativeTest.test_list_volumes_with_invalid_status [0.065225s] ... ok
{7} tempest.api.volume.test_volumes_negative.VolumesNegativeTest.test_list_volumes_with_nonexistent_name [0.051627s] ... ok
{7} tempest.api.volume.test_volumes_negative.VolumesNegativeTest.test_reserve_volume_with_negative_volume_status [0.448035s] ... ok
{7} tempest.api.volume.test_volumes_negative.VolumesNegativeTest.test_reserve_volume_with_nonexistent_volume_id [0.024424s] ... ok
{7} tempest.api.volume.test_volumes_negative.VolumesNegativeTest.test_unreserve_volume_with_nonexistent_volume_id [0.060743s] ... ok
{7} tempest.api.volume.test_volumes_negative.VolumesNegativeTest.test_update_volume_with_empty_volume_id [0.008040s] ... ok
{7} tempest.api.volume.test_volumes_negative.VolumesNegativeTest.test_update_volume_with_invalid_volume_id [0.024322s] ... ok
{7} tempest.api.volume.test_volumes_negative.VolumesNegativeTest.test_update_volume_with_nonexistent_volume_id [0.024422s] ... ok
{7} tempest.api.volume.test_volumes_negative.VolumesNegativeTest.test_volume_delete_nonexistent_volume_id [0.029078s] ... ok
{7} tempest.api.volume.test_volumes_negative.VolumesNegativeTest.test_volume_get_nonexistent_volume_id [0.021846s] ... ok
{9} tempest.api.volume.test_volume_transfers.VolumesTransfersV357Test.test_create_list_delete_volume_transfer [24.348589s] ... ok
{4} tempest.api.volume.admin.test_volumes_actions.VolumesActionsTest.test_volume_force_delete_when_volume_is_attaching [23.554493s] ... ok
{37} tempest.api.volume.test_volumes_snapshots_list.VolumesSnapshotListTestJSON.test_snapshot_list_param_limit [0.049983s] ... ok
{37} tempest.api.volume.test_volumes_snapshots_list.VolumesSnapshotListTestJSON.test_snapshot_list_param_limit_equals_infinite [0.094658s] ... ok
{37} tempest.api.volume.test_volumes_snapshots_list.VolumesSnapshotListTestJSON.test_snapshot_list_param_limit_equals_zero [0.043379s] ... ok
{37} tempest.api.volume.test_volumes_snapshots_list.VolumesSnapshotListTestJSON.test_snapshot_list_param_marker [0.082262s] ... ok
{37} tempest.api.volume.test_volumes_snapshots_list.VolumesSnapshotListTestJSON.test_snapshot_list_param_offset [0.045891s] ... ok
{37} tempest.api.volume.test_volumes_snapshots_list.VolumesSnapshotListTestJSON.test_snapshot_list_param_sort_created_at_asc [0.044250s] ... ok
{37} tempest.api.volume.test_volumes_snapshots_list.VolumesSnapshotListTestJSON.test_snapshot_list_param_sort_created_at_desc [0.032601s] ... ok
{37} tempest.api.volume.test_volumes_snapshots_list.VolumesSnapshotListTestJSON.test_snapshot_list_param_sort_id_asc [0.044057s] ... ok
{37} tempest.api.volume.test_volumes_snapshots_list.VolumesSnapshotListTestJSON.test_snapshot_list_param_sort_id_desc [0.045452s] ... ok
{37} tempest.api.volume.test_volumes_snapshots_list.VolumesSnapshotListTestJSON.test_snapshot_list_param_sort_name_asc [0.039199s] ... ok
{37} tempest.api.volume.test_volumes_snapshots_list.VolumesSnapshotListTestJSON.test_snapshot_list_param_sort_name_desc [0.048817s] ... ok
{37} tempest.api.volume.test_volumes_snapshots_list.VolumesSnapshotListTestJSON.test_snapshots_list_details_with_params [0.143486s] ... ok
{37} tempest.api.volume.test_volumes_snapshots_list.VolumesSnapshotListTestJSON.test_snapshots_list_with_params [0.132787s] ... ok
{8} tempest.api.volume.test_volume_transfers.VolumesTransfersTest.test_create_list_delete_volume_transfer [20.892251s] ... ok
{5} tempest.api.volume.admin.test_volume_quotas.VolumeQuotasAdminTestJSON.test_quota_usage_after_volume_transfer [23.104270s] ... ok
{5} tempest.api.volume.admin.test_volume_quotas.VolumeQuotasAdminTestJSON.test_show_quota_usage [0.064553s] ... ok
{10} tempest.api.volume.test_volumes_actions.VolumesActionsTest.test_get_volume_attachment [33.025198s] ... ok
{10} tempest.api.volume.test_volumes_actions.VolumesActionsTest.test_reserve_unreserve_volume [0.409670s] ... ok
{5} tempest.api.volume.admin.test_volume_quotas.VolumeQuotasAdminTestJSON.test_update_all_quota_resources_for_tenant [1.584852s] ... ok
{10} tempest.api.volume.test_volumes_actions.VolumesActionsTest.test_volume_bootable [0.468865s] ... ok
{10} tempest.api.volume.test_volumes_actions.VolumesActionsTest.test_volume_readonly_update [0.425193s] ... ok
{2} tempest.api.volume.test_volume_delete_cascade.VolumesDeleteCascade.test_volume_delete_cascade [64.949559s] ... ok
{3} tempest.api.volume.admin.test_snapshots_actions.SnapshotsActionsTest.test_snapshot_force_delete_when_snapshot_is_deleting [15.933736s] ... ok
{5} setUpClass (tempest.api.volume.test_volumes_backup.VolumesBackupsV39Test) ... SKIPPED: Cinder backup feature disabled
{4} tempest.api.volume.admin.test_volumes_actions.VolumesActionsTest.test_volume_force_delete_when_volume_is_creating [13.038852s] ... ok
{1} tempest.api.volume.test_volumes_clone.VolumesCloneTest.test_create_from_volume [67.620094s] ... ok
{3} tempest.api.volume.admin.test_snapshots_actions.SnapshotsActionsTest.test_snapshot_force_delete_when_snapshot_is_error [5.415132s] ... ok
{4} tempest.api.volume.admin.test_volumes_actions.VolumesActionsTest.test_volume_force_delete_when_volume_is_error [6.551520s] ... ok
{3} tempest.api.volume.admin.test_snapshots_actions.SnapshotsActionsTest.test_snapshot_force_delete_when_snapshot_is_error_deleting [7.354037s] ... ok
{3} tempest.api.volume.admin.test_snapshots_actions.SnapshotsActionsTest.test_update_snapshot_status [0.368820s] ... ok
{4} tempest.api.volume.admin.test_volumes_actions.VolumesActionsTest.test_volume_force_delete_when_volume_is_maintenance [6.442629s] ... ok
{0} tempest.api.volume.test_volumes_get.VolumesGetTest.test_volume_create_get_update_delete_as_clone [35.340930s] ... ok
{4} tempest.api.volume.admin.test_volumes_actions.VolumesActionsTest.test_volume_reset_status [4.461613s] ... ok
{3} setUpClass (tempest.api.volume.admin.test_volumes_backup.VolumesBackupsAdminTest) ... SKIPPED: Cinder backup feature disabled

==============================
Failed 1 tests - output below:
==============================

tempest.api.volume.admin.test_volume_pools.VolumePoolsAdminTestsJSON.test_get_pools_with_details[id-d4bb61f7-762d-4437-b8a4-5785759a0ced]
-----------------------------------------------------------------------------------------------------------------------------------------

Captured traceback:
~~~~~~~~~~~~~~~~~~~
    Traceback (most recent call last):

      File "/opt/stack/python-tempestconf/.venv_1/lib/python3.12/site-packages/tempest/api/volume/admin/test_volume_pools.py", line 44, in test_get_pools_with_details
    self._assert_pools(with_detail=True)

      File "/opt/stack/python-tempestconf/.venv_1/lib/python3.12/site-packages/tempest/api/volume/admin/test_volume_pools.py", line 32, in _assert_pools
    self.assertIn(CONF.volume.vendor_name,

      File "/opt/stack/python-tempestconf/.venv_1/lib/python3.12/site-packages/testtools/testcase.py", line 400, in assertIn
    self.assertThat(haystack, Contains(needle), message)

      File "/opt/stack/python-tempestconf/.venv_1/lib/python3.12/site-packages/testtools/testcase.py", line 481, in assertThat
    raise mismatch_error

    testtools.matchers._impl.MismatchError: 'Open Source' not in ['IBM']


Captured pythonlogging:
~~~~~~~~~~~~~~~~~~~~~~~
    2026-02-20 13:09:11,610 2450193 INFO     [tempest.lib.common.rest_client] Request (VolumePoolsAdminTestsJSON:test_get_pools_with_details): 200 GET http://9.71.52.160/volume/v3/scheduler-stats/get_pools?detail=True 0.917s
2026-02-20 13:09:11,611 2450193 DEBUG    [tempest.lib.common.rest_client] Request - Headers: {'Content-Type': 'application/json', 'Accept': 'application/json', 'X-Auth-Token': '<omitted>'}
        Body: None
    Response - Headers: {'date': 'Fri, 20 Feb 2026 13:09:10 GMT', 'server': 'Apache/2.4.58 (Ubuntu)', 'content-type': 'application/json', 'x-compute-request-id': 'req-4bf9c21b-01f9-4f41-adec-7e56edc12c41', 'content-length': '940', 'openstack-api-version': 'volume 3.0', 'vary': 'OpenStack-API-Version', 'x-openstack-request-id': 'req-4bf9c21b-01f9-4f41-adec-7e56edc12c41', 'connection': 'close', 'status': '200', 'content-location': 'http://9.71.52.160/volume/v3/scheduler-stats/get_pools?detail=True'}
        Body: b'{"pools": [{"name": "rhosp-host-4@backend_170#mdiskgrp0", "capabilities": {"pool_name": "mdiskgrp0", "total_capacity_gb": 1782.0, "free_capacity_gb": 1577.0, "provisioned_capacity_gb": 204.0, "compression_support": true, "reserved_percentage": 0, "QoS_support": true, "consistencygroup_support": true, "location_info": "StorwizeSVCDriver:00000204A0806296:mdiskgrp0", "easytier_support": true, "multiattach": true, "thin_provisioning_support": true, "thick_provisioning_support": false, "max_over_subscription_ratio": "20.0", "consistent_group_snapshot_enabled": true, "backend_state": "up", "data_reduction": false, "site_id": "", "site_name": "", "clone_type": "thinclone clone", "allocated_capacity_gb": 0, "cacheable": true, "volume_backend_name": "partition_pbr", "storage_protocol": "FC", "vendor_name": "IBM", "driver_version": "2.2.6", "timestamp": "2026-02-20T13:09:05.136982", "filter_function": null, "goodness_function": null}}]}'



======
Totals
======
Ran: 175 tests in 87.7450 sec.
 - Passed: 166
 - Skipped: 8
 - Expected Fail: 0
 - Unexpected Success: 0
 - Failed: 1
Sum of execute time for each test: 736.8211 sec.

==============
Worker Balance
==============
 - Worker 0 (3 tests) => 0:01:24.000526
 - Worker 1 (2 tests) => 0:01:08.980085
 - Worker 2 (2 tests) => 0:01:06.500989
 - Worker 3 (7 tests) => 0:00:57.748929
 - Worker 4 (6 tests) => 0:01:25.174584
 - Worker 5 (8 tests) => 0:01:00.553055
 - Worker 6 (3 tests) => 0:00:49.326814
 - Worker 7 (27 tests) => 0:00:37.655862
 - Worker 8 (2 tests) => 0:00:51.127246
 - Worker 9 (2 tests) => 0:00:47.827181
 - Worker 10 (4 tests) => 0:00:34.339732
 - Worker 11 (1 tests) => 0:00:21.474272
 - Worker 12 (5 tests) => 0:00:21.519459
 - Worker 13 (2 tests) => 0:00:21.480114
 - Worker 14 (2 tests) => 0:00:10.796994
 - Worker 15 (1 tests) => 0:00:12.096220
 - Worker 16 (1 tests) => 0:00:10.134527
 - Worker 17 (2 tests) => 0:00:09.184738
 - Worker 18 (4 tests) => 0:00:04.212685
 - Worker 19 (7 tests) => 0:00:04.912471
 - Worker 20 (2 tests) => 0:00:04.091760
 - Worker 21 (5 tests) => 0:00:01.179945
 - Worker 22 (18 tests) => 0:00:02.405988
 - Worker 23 (3 tests) => 0:00:02.690077
 - Worker 24 (2 tests) => 0:00:02.152332
 - Worker 25 (6 tests) => 0:00:03.200627
 - Worker 26 (2 tests) => 0:00:01.862516
 - Worker 27 (12 tests) => 0:00:01.569158
 - Worker 28 (1 tests) => 0:00:01.868692
 - Worker 29 (2 tests) => 0:00:02.066311
 - Worker 30 (2 tests) => 0:00:01.136490
 - Worker 31 (2 tests) => 0:00:01.197069
 - Worker 32 (2 tests) => 0:00:01.784228
 - Worker 33 (2 tests) => 0:00:00.911003
 - Worker 34 (1 tests) => 0:00:01.801668
 - Worker 35 (2 tests) => 0:00:01.116264
 - Worker 36 (1 tests) => 0:00:02.009392
 - Worker 37 (13 tests) => 0:00:00.859906
 - Worker 38 (5 tests) => 0:00:01.636802
 - Worker 39 (1 tests) => 0:00:00.064558
