{1} setUpClass (tempest.api.volume.admin.test_encrypted_volumes_extend.EncryptedVolumesExtendAttachedTest) ... SKIPPED: Attached encrypted volume extend is disabled.
{0} setUpClass (tempest.api.volume.admin.test_volume_retype.VolumeRetypeWithMigrationTest) ... SKIPPED: Cinder multi-backend feature disabled
{2} setUpClass (tempest.api.volume.test_volumes_backup.VolumesBackupsTest) ... SKIPPED: Cinder backup feature disabled
{4} setUpClass (tempest.api.volume.admin.test_multi_backend.VolumeMultiBackendTest) ... SKIPPED: Cinder multi-backend feature disabled
{5} setUpClass (tempest.api.volume.admin.test_volume_retype.VolumeRetypeMultiattachTest) ... SKIPPED: Volume multi-attach is not available.
{6} setUpClass (tempest.api.volume.admin.test_volumes_backup.VolumesBackupsAdminTest) ... SKIPPED: Cinder backup feature disabled
{29} tempest.api.volume.test_versions.VersionsTest.test_list_versions [0.010594s] ... ok
{27} tempest.api.volume.test_extensions.ExtensionsTestJSON.test_list_extensions [1.155862s] ... ok
{31} tempest.api.volume.test_availability_zone.AvailabilityZoneTestJSON.test_get_availability_zone_list [0.914368s] ... ok
{29} tempest.api.volume.test_versions.VersionsTest.test_show_version [1.129568s] ... ok
{30} tempest.api.volume.test_volumes_get.VolumesSummaryTest.test_show_volume_summary [1.203413s] ... ok
{16} tempest.api.volume.test_volumes_snapshots_negative.VolumesSnapshotNegativeTestJSON.test_create_snapshot_with_nonexistent_volume_id [1.039962s] ... ok
{16} tempest.api.volume.test_volumes_snapshots_negative.VolumesSnapshotNegativeTestJSON.test_create_snapshot_without_passing_volume_id [0.060513s] ... ok
{16} tempest.api.volume.test_volumes_snapshots_negative.VolumesSnapshotNegativeTestJSON.test_list_snapshot_invalid_param_limit [0.010047s] ... ok
{16} tempest.api.volume.test_volumes_snapshots_negative.VolumesSnapshotNegativeTestJSON.test_list_snapshots_invalid_param_marker [0.024811s] ... ok
{16} tempest.api.volume.test_volumes_snapshots_negative.VolumesSnapshotNegativeTestJSON.test_list_snapshots_invalid_param_sort [0.016843s] ... ok
{13} tempest.api.volume.admin.test_volume_quota_classes.VolumeQuotaClassesTest.test_show_default_quota [0.592597s] ... ok
{25} tempest.api.volume.admin.test_volume_types_extra_specs_negative.ExtraSpecsNegativeTest.test_create_invalid_body [0.143533s] ... ok
{25} tempest.api.volume.admin.test_volume_types_extra_specs_negative.ExtraSpecsNegativeTest.test_create_none_body [0.075491s] ... ok
{15} tempest.api.volume.admin.test_volume_types.VolumeTypesTest.test_volume_type_create_get_delete [0.978028s] ... ok
{25} tempest.api.volume.admin.test_volume_types_extra_specs_negative.ExtraSpecsNegativeTest.test_create_nonexistent_type_id [0.095446s] ... ok
{21} tempest.api.volume.admin.test_volume_hosts.VolumeHostsAdminTestsJSON.test_list_hosts [0.306341s] ... ok
{9} tempest.api.volume.admin.test_volume_services.VolumesServicesTestJSON.test_get_service_by_host_name [0.086183s] ... ok
{26} tempest.api.volume.admin.test_volume_services_negative.VolumeServicesNegativeTest.test_disable_log_reason_with_no_reason [0.081472s] ... ok
{25} tempest.api.volume.admin.test_volume_types_extra_specs_negative.ExtraSpecsNegativeTest.test_delete_nonexistent_volume_type_id [0.108171s] ... ok
{9} tempest.api.volume.admin.test_volume_services.VolumesServicesTestJSON.test_get_service_by_service_and_host_name [0.343349s] ... ok
{17} tempest.api.volume.admin.test_volume_types_negative.VolumeTypesNegativeTest.test_create_volume_type_encryption_nonexistent_type_id [0.362665s] ... ok
{26} tempest.api.volume.admin.test_volume_services_negative.VolumeServicesNegativeTest.test_disable_service_with_invalid_binary [0.352965s] ... ok
{25} tempest.api.volume.admin.test_volume_types_extra_specs_negative.ExtraSpecsNegativeTest.test_get_nonexistent_extra_spec_name [0.309798s] ... ok
{24} tempest.api.volume.admin.test_volume_pools.VolumePoolsAdminTestsJSON.test_get_pools_with_details [0.821402s] ... ok
{9} tempest.api.volume.admin.test_volume_services.VolumesServicesTestJSON.test_get_service_by_service_binary_name [0.355326s] ... ok
{25} tempest.api.volume.admin.test_volume_types_extra_specs_negative.ExtraSpecsNegativeTest.test_get_nonexistent_volume_type_id [0.451784s] ... ok
{26} tempest.api.volume.admin.test_volume_services_negative.VolumeServicesNegativeTest.test_enable_service_with_invalid_host [0.481970s] ... ok
{25} tempest.api.volume.admin.test_volume_types_extra_specs_negative.ExtraSpecsNegativeTest.test_list_nonexistent_volume_type_id [0.297325s] ... ok
{26} tempest.api.volume.admin.test_volume_services_negative.VolumeServicesNegativeTest.test_freeze_host_with_invalid_host [0.414507s] ... ok
{24} tempest.api.volume.admin.test_volume_pools.VolumePoolsAdminTestsJSON.test_get_pools_without_details [0.903046s] ... ok
{25} tempest.api.volume.admin.test_volume_types_extra_specs_negative.ExtraSpecsNegativeTest.test_update_multiple_extra_spec [0.263915s] ... ok
{26} tempest.api.volume.admin.test_volume_services_negative.VolumeServicesNegativeTest.test_thaw_host_with_invalid_host [0.169920s] ... ok
{21} tempest.api.volume.admin.test_volume_hosts.VolumeHostsAdminTestsJSON.test_show_host [1.469350s] ... ok
{25} tempest.api.volume.admin.test_volume_types_extra_specs_negative.ExtraSpecsNegativeTest.test_update_no_body [0.060911s] ... ok
{20} tempest.api.volume.admin.test_volume_types_extra_specs.VolumeTypesExtraSpecsTest.test_volume_type_extra_spec_create_get_delete [1.483084s] ... ok
{25} tempest.api.volume.admin.test_volume_types_extra_specs_negative.ExtraSpecsNegativeTest.test_update_none_extra_spec_id [0.112342s] ... ok
{25} tempest.api.volume.admin.test_volume_types_extra_specs_negative.ExtraSpecsNegativeTest.test_update_nonexistent_extra_spec_id [0.057485s] ... ok
{17} tempest.api.volume.admin.test_volume_types_negative.VolumeTypesNegativeTest.test_create_volume_with_private_volume_type [1.311999s] ... ok
{17} tempest.api.volume.admin.test_volume_types_negative.VolumeTypesNegativeTest.test_create_with_empty_name [0.012470s] ... ok
{25} tempest.api.volume.admin.test_volume_types_extra_specs_negative.ExtraSpecsNegativeTest.test_update_nonexistent_type_id [0.069051s] ... ok
{20} tempest.api.volume.admin.test_volume_types_extra_specs.VolumeTypesExtraSpecsTest.test_volume_type_extra_specs_list [0.254619s] ... ok
{15} tempest.api.volume.admin.test_volume_types.VolumeTypesTest.test_volume_type_encryption_create_get_update_delete [2.171288s] ... ok
{15} tempest.api.volume.admin.test_volume_types.VolumeTypesTest.test_volume_type_list [0.086617s] ... ok
{17} tempest.api.volume.admin.test_volume_types_negative.VolumeTypesNegativeTest.test_create_with_repeated_name [0.505584s] ... ok
{17} tempest.api.volume.admin.test_volume_types_negative.VolumeTypesNegativeTest.test_delete_nonexistent_type_id [0.010288s] ... ok
{17} tempest.api.volume.admin.test_volume_types_negative.VolumeTypesNegativeTest.test_get_nonexistent_type_id [0.071363s] ... ok
{13} tempest.api.volume.admin.test_volume_quota_classes.VolumeQuotaClassesTest.test_update_default_quota [3.213978s] ... ok
{20} tempest.api.volume.admin.test_volume_types_extra_specs.VolumeTypesExtraSpecsTest.test_volume_type_extra_specs_update [0.556240s] ... ok
{14} tempest.api.volume.admin.test_qos.QosSpecsTestJSON.test_associate_disassociate_qos [3.006447s] ... ok
{22} tempest.api.volume.admin.test_backends_capabilities.BackendsCapabilitiesAdminTestsJSON.test_compare_volume_stats_values [1.940381s] ... ok
{22} tempest.api.volume.admin.test_backends_capabilities.BackendsCapabilitiesAdminTestsJSON.test_get_capabilities_backend [0.539875s] ... ok
{14} tempest.api.volume.admin.test_qos.QosSpecsTestJSON.test_create_delete_qos_with_back_end_consumer [0.785363s] ... ok
{14} tempest.api.volume.admin.test_qos.QosSpecsTestJSON.test_create_delete_qos_with_both_consumer [1.446937s] ... ok
{4} tempest.api.volume.admin.test_volume_quotas.VolumeQuotasAdminTestJSON.test_delete_quota [5.455808s] ... ok
{4} tempest.api.volume.admin.test_volume_quotas.VolumeQuotasAdminTestJSON.test_list_default_quotas [0.052759s] ... ok
{4} tempest.api.volume.admin.test_volume_quotas.VolumeQuotasAdminTestJSON.test_list_quotas [0.089789s] ... ok
{10} tempest.api.volume.admin.test_user_messages.UserMessagesTest.test_delete_message [7.531900s] ... ok
{15} tempest.api.volume.admin.test_volume_types.VolumeTypesTest.test_volume_type_update [5.581492s] ... ok
{14} tempest.api.volume.admin.test_qos.QosSpecsTestJSON.test_create_delete_qos_with_front_end_consumer [3.104314s] ... ok
{14} tempest.api.volume.admin.test_qos.QosSpecsTestJSON.test_get_qos [0.018558s] ... ok
{14} tempest.api.volume.admin.test_qos.QosSpecsTestJSON.test_list_qos [0.019851s] ... ok
{14} tempest.api.volume.admin.test_qos.QosSpecsTestJSON.test_set_unset_qos_key [0.736907s] ... ok
{11} tempest.api.volume.admin.test_volume_retype.VolumeRetypeWithoutMigrationTest.test_available_volume_retype [10.964042s] ... ok
{12} tempest.api.volume.admin.test_volume_type_access.VolumeTypesAccessTest.test_volume_type_access_add [12.133725s] ... ok
{10} tempest.api.volume.admin.test_user_messages.UserMessagesTest.test_list_show_messages [5.305361s] ... ok
{12} tempest.api.volume.admin.test_volume_type_access.VolumeTypesAccessTest.test_volume_type_access_list [1.853555s] ... ok
{19} tempest.api.volume.test_volume_metadata.VolumesMetadataTest.test_crud_volume_metadata [1.318125s] ... ok
{19} tempest.api.volume.test_volume_metadata.VolumesMetadataTest.test_update_show_volume_metadata_item [0.587886s] ... ok
{33} tempest.api.volume.admin.test_volume_quotas_negative.VolumeQuotasNegativeTestJSON.test_quota_volume_gigabytes [0.446955s] ... ok
{33} tempest.api.volume.admin.test_volume_quotas_negative.VolumeQuotasNegativeTestJSON.test_quota_volumes [0.384607s] ... ok
{35} tempest.api.volume.test_volume_absolute_limits.AbsoluteLimitsTests.test_get_volume_absolute_limits [0.343133s] ... ok
{7} tempest.api.volume.test_volumes_clone_negative.VolumesCloneNegativeTest.test_create_from_volume_decreasing_size [25.427174s] ... ok
{32} tempest.api.volume.test_snapshot_metadata.SnapshotMetadataTestJSON.test_crud_snapshot_metadata [0.786374s] ... ok
{32} tempest.api.volume.test_snapshot_metadata.SnapshotMetadataTestJSON.test_update_show_snapshot_metadata_item [0.543587s] ... ok
{36} tempest.api.volume.test_volumes_snapshots.VolumesSnapshotTestJSON.test_snapshot_backup ... SKIPPED: Cinder backup is disabled
{3} tempest.api.volume.admin.test_snapshots_actions.SnapshotsActionsTest.test_reset_snapshot_status [0.626185s] ... ok
{9} tempest.api.volume.admin.test_volume_services.VolumesServicesTestJSON.test_get_service_by_volume_host_name [30.381772s] ... ok
{9} tempest.api.volume.admin.test_volume_services.VolumesServicesTestJSON.test_list_services [0.027317s] ... ok
{34} tempest.api.volume.admin.test_volume_snapshot_quotas_negative.VolumeSnapshotQuotasNegativeTestJSON.test_quota_volume_gigabytes_snapshots [2.898464s] ... ok
{34} tempest.api.volume.admin.test_volume_snapshot_quotas_negative.VolumeSnapshotQuotasNegativeTestJSON.test_quota_volume_snapshots [0.064733s] ... ok
{5} tempest.api.volume.test_volume_transfers.VolumesTransfersTest.test_create_get_list_accept_volume_transfer [31.873014s] ... ok
{6} tempest.api.volume.test_volume_transfers.VolumesTransfersV357Test.test_create_get_list_accept_volume_transfer [32.942886s] ... ok
{4} tempest.api.volume.admin.test_volume_quotas.VolumeQuotasAdminTestJSON.test_quota_usage [27.675934s] ... ok
{18} tempest.api.volume.test_volumes_list.VolumesListTestJSON.test_volume_list [0.042513s] ... ok
{18} tempest.api.volume.test_volumes_list.VolumesListTestJSON.test_volume_list_by_name [0.074015s] ... ok
{18} tempest.api.volume.test_volumes_list.VolumesListTestJSON.test_volume_list_details_by_name [0.098772s] ... ok
{18} tempest.api.volume.test_volumes_list.VolumesListTestJSON.test_volume_list_details_pagination [0.464836s] ... ok
{8} tempest.api.volume.test_volume_transfers.VolumesTransfersV355Test.test_create_get_list_accept_volume_transfer [34.720555s] ... ok
{18} tempest.api.volume.test_volumes_list.VolumesListTestJSON.test_volume_list_details_with_multiple_params [0.238471s] ... ok
{18} tempest.api.volume.test_volumes_list.VolumesListTestJSON.test_volume_list_pagination [0.348716s] ... ok
{18} tempest.api.volume.test_volumes_list.VolumesListTestJSON.test_volume_list_param_display_name_and_status [0.066210s] ... ok
{18} tempest.api.volume.test_volumes_list.VolumesListTestJSON.test_volume_list_with_detail_param_display_name_and_status [0.100625s] ... ok
{18} tempest.api.volume.test_volumes_list.VolumesListTestJSON.test_volume_list_with_detail_param_marker [0.116050s] ... ok
{18} tempest.api.volume.test_volumes_list.VolumesListTestJSON.test_volume_list_with_detail_param_metadata [0.098000s] ... ok
{18} tempest.api.volume.test_volumes_list.VolumesListTestJSON.test_volume_list_with_details [0.093906s] ... ok
{18} tempest.api.volume.test_volumes_list.VolumesListTestJSON.test_volume_list_with_param_metadata [0.099023s] ... ok
{18} tempest.api.volume.test_volumes_list.VolumesListTestJSON.test_volumes_list_by_availability_zone [0.152281s] ... ok
{18} tempest.api.volume.test_volumes_list.VolumesListTestJSON.test_volumes_list_by_bootable [0.165631s] ... ok
{18} tempest.api.volume.test_volumes_list.VolumesListTestJSON.test_volumes_list_by_status [0.136599s] ... ok
{18} tempest.api.volume.test_volumes_list.VolumesListTestJSON.test_volumes_list_details_by_availability_zone [0.084880s] ... ok
{18} tempest.api.volume.test_volumes_list.VolumesListTestJSON.test_volumes_list_details_by_bootable [0.034262s] ... ok
{18} tempest.api.volume.test_volumes_list.VolumesListTestJSON.test_volumes_list_details_by_status [0.091330s] ... ok
{0} tempest.api.volume.test_volumes_negative.VolumesNegativeTest.test_attach_volumes_with_nonexistent_volume_id [35.322766s] ... ok
{2} tempest.api.volume.test_volumes_get.VolumesGetTest.test_volume_create_get_update_delete [47.717814s] ... ok
{23} tempest.api.volume.test_volumes_snapshots_list.VolumesSnapshotListTestJSON.test_snapshot_list_param_limit [0.033251s] ... ok
{23} tempest.api.volume.test_volumes_snapshots_list.VolumesSnapshotListTestJSON.test_snapshot_list_param_limit_equals_infinite [0.049388s] ... ok
{23} tempest.api.volume.test_volumes_snapshots_list.VolumesSnapshotListTestJSON.test_snapshot_list_param_limit_equals_zero [0.033043s] ... ok
{23} tempest.api.volume.test_volumes_snapshots_list.VolumesSnapshotListTestJSON.test_snapshot_list_param_marker [0.077789s] ... ok
{23} tempest.api.volume.test_volumes_snapshots_list.VolumesSnapshotListTestJSON.test_snapshot_list_param_offset [0.028122s] ... ok
{23} tempest.api.volume.test_volumes_snapshots_list.VolumesSnapshotListTestJSON.test_snapshot_list_param_sort_created_at_asc [0.045963s] ... ok
{23} tempest.api.volume.test_volumes_snapshots_list.VolumesSnapshotListTestJSON.test_snapshot_list_param_sort_created_at_desc [0.021685s] ... ok
{23} tempest.api.volume.test_volumes_snapshots_list.VolumesSnapshotListTestJSON.test_snapshot_list_param_sort_id_asc [0.027109s] ... ok
{23} tempest.api.volume.test_volumes_snapshots_list.VolumesSnapshotListTestJSON.test_snapshot_list_param_sort_id_desc [0.040383s] ... ok
{23} tempest.api.volume.test_volumes_snapshots_list.VolumesSnapshotListTestJSON.test_snapshot_list_param_sort_name_asc [0.036523s] ... ok
{23} tempest.api.volume.test_volumes_snapshots_list.VolumesSnapshotListTestJSON.test_snapshot_list_param_sort_name_desc [0.029228s] ... ok
{37} tempest.api.volume.admin.test_volumes_list.VolumesListAdminTestJSON.test_volume_list_param_tenant [8.628226s] ... ok
{23} tempest.api.volume.test_volumes_snapshots_list.VolumesSnapshotListTestJSON.test_snapshots_list_details_with_params [0.161756s] ... ok
{23} tempest.api.volume.test_volumes_snapshots_list.VolumesSnapshotListTestJSON.test_snapshots_list_with_params [0.130772s] ... ok
{0} tempest.api.volume.test_volumes_negative.VolumesNegativeTest.test_create_volume_from_deactivated_image [3.136787s] ... ok
{36} tempest.api.volume.test_volumes_snapshots.VolumesSnapshotTestJSON.test_snapshot_create_get_list_update_delete [20.864242s] ... ok
{3} tempest.api.volume.admin.test_snapshots_actions.SnapshotsActionsTest.test_snapshot_force_delete_when_snapshot_is_creating [22.898899s] ... ok
{0} tempest.api.volume.test_volumes_negative.VolumesNegativeTest.test_create_volume_from_image_with_decreasing_size [5.952839s] ... ok
{0} tempest.api.volume.test_volumes_negative.VolumesNegativeTest.test_create_volume_with_invalid_size [0.016673s] ... ok
{0} tempest.api.volume.test_volumes_negative.VolumesNegativeTest.test_create_volume_with_nonexistent_snapshot_id [0.035012s] ... ok
{0} tempest.api.volume.test_volumes_negative.VolumesNegativeTest.test_create_volume_with_nonexistent_source_volid [0.027496s] ... ok
{0} tempest.api.volume.test_volumes_negative.VolumesNegativeTest.test_create_volume_with_nonexistent_volume_type [0.021223s] ... ok
{0} tempest.api.volume.test_volumes_negative.VolumesNegativeTest.test_create_volume_with_size_negative [0.017342s] ... ok
{0} tempest.api.volume.test_volumes_negative.VolumesNegativeTest.test_create_volume_with_size_zero [0.021560s] ... ok
{0} tempest.api.volume.test_volumes_negative.VolumesNegativeTest.test_create_volume_without_passing_size [0.018941s] ... ok
{0} tempest.api.volume.test_volumes_negative.VolumesNegativeTest.test_delete_invalid_volume_id [0.056039s] ... ok
{0} tempest.api.volume.test_volumes_negative.VolumesNegativeTest.test_delete_volume_without_passing_volume_id [0.010454s] ... ok
{1} tempest.api.volume.admin.test_volumes_actions.VolumesActionsTest.test_volume_force_delete_when_volume_is_attaching [25.173592s] ... ok
{0} tempest.api.volume.test_volumes_negative.VolumesNegativeTest.test_detach_volumes_with_invalid_volume_id [0.026008s] ... ok
{0} tempest.api.volume.test_volumes_negative.VolumesNegativeTest.test_get_invalid_volume_id [0.018856s] ... ok
{0} tempest.api.volume.test_volumes_negative.VolumesNegativeTest.test_get_volume_without_passing_volume_id [0.016433s] ... ok
{0} tempest.api.volume.test_volumes_negative.VolumesNegativeTest.test_list_volumes_detail_with_invalid_status [0.060348s] ... ok
{5} tempest.api.volume.test_volume_transfers.VolumesTransfersTest.test_create_list_delete_volume_transfer [20.861260s] ... ok
{0} tempest.api.volume.test_volumes_negative.VolumesNegativeTest.test_list_volumes_detail_with_nonexistent_name [0.089552s] ... ok
{0} tempest.api.volume.test_volumes_negative.VolumesNegativeTest.test_list_volumes_with_invalid_status [0.070634s] ... ok
{0} tempest.api.volume.test_volumes_negative.VolumesNegativeTest.test_list_volumes_with_nonexistent_name [0.074173s] ... ok
{0} tempest.api.volume.test_volumes_negative.VolumesNegativeTest.test_reserve_volume_with_negative_volume_status [1.109597s] ... ok
{0} tempest.api.volume.test_volumes_negative.VolumesNegativeTest.test_reserve_volume_with_nonexistent_volume_id [0.026565s] ... ok
{0} tempest.api.volume.test_volumes_negative.VolumesNegativeTest.test_unreserve_volume_with_nonexistent_volume_id [0.028334s] ... ok
{0} tempest.api.volume.test_volumes_negative.VolumesNegativeTest.test_update_volume_with_empty_volume_id [0.010734s] ... ok
{0} tempest.api.volume.test_volumes_negative.VolumesNegativeTest.test_update_volume_with_invalid_volume_id [0.035952s] ... ok
{0} tempest.api.volume.test_volumes_negative.VolumesNegativeTest.test_update_volume_with_nonexistent_volume_id [0.028534s] ... ok
{0} tempest.api.volume.test_volumes_negative.VolumesNegativeTest.test_volume_delete_nonexistent_volume_id [0.026179s] ... ok
{0} tempest.api.volume.test_volumes_negative.VolumesNegativeTest.test_volume_get_nonexistent_volume_id [0.023918s] ... ok
{6} tempest.api.volume.test_volume_transfers.VolumesTransfersV357Test.test_create_list_delete_volume_transfer [21.334181s] ... ok
{8} tempest.api.volume.test_volume_transfers.VolumesTransfersV355Test.test_create_list_delete_volume_transfer [24.207518s] ... ok
{4} tempest.api.volume.admin.test_volume_quotas.VolumeQuotasAdminTestJSON.test_quota_usage_after_volume_transfer [26.425480s] ... ok
{4} tempest.api.volume.admin.test_volume_quotas.VolumeQuotasAdminTestJSON.test_show_quota_usage [0.067204s] ... ok
{4} tempest.api.volume.admin.test_volume_quotas.VolumeQuotasAdminTestJSON.test_update_all_quota_resources_for_tenant [0.784458s] ... ok
{28} tempest.api.volume.test_volumes_actions.VolumesActionsTest.test_get_volume_attachment [35.248735s] ... ok
{28} tempest.api.volume.test_volumes_actions.VolumesActionsTest.test_reserve_unreserve_volume [0.332832s] ... ok
{38} tempest.api.volume.test_volume_delete_cascade.VolumesDeleteCascade.test_volume_delete_cascade [65.946921s] ... ok
{28} tempest.api.volume.test_volumes_actions.VolumesActionsTest.test_volume_bootable [0.337660s] ... ok
{39} tempest.api.volume.test_volumes_clone.VolumesCloneTest.test_create_from_volume [66.032133s] ... ok
{28} tempest.api.volume.test_volumes_actions.VolumesActionsTest.test_volume_readonly_update [0.335159s] ... ok
{3} tempest.api.volume.admin.test_snapshots_actions.SnapshotsActionsTest.test_snapshot_force_delete_when_snapshot_is_deleting [14.823805s] ... ok
{1} tempest.api.volume.admin.test_volumes_actions.VolumesActionsTest.test_volume_force_delete_when_volume_is_creating [13.395178s] ... ok
{3} tempest.api.volume.admin.test_snapshots_actions.SnapshotsActionsTest.test_snapshot_force_delete_when_snapshot_is_error [6.126669s] ... ok
{1} tempest.api.volume.admin.test_volumes_actions.VolumesActionsTest.test_volume_force_delete_when_volume_is_error [6.916725s] ... ok
{3} tempest.api.volume.admin.test_snapshots_actions.SnapshotsActionsTest.test_snapshot_force_delete_when_snapshot_is_error_deleting [4.986009s] ... ok
{3} tempest.api.volume.admin.test_snapshots_actions.SnapshotsActionsTest.test_update_snapshot_status [0.423379s] ... ok
{1} tempest.api.volume.admin.test_volumes_actions.VolumesActionsTest.test_volume_force_delete_when_volume_is_maintenance [5.387854s] ... ok
{2} tempest.api.volume.test_volumes_get.VolumesGetTest.test_volume_create_get_update_delete_as_clone [34.993229s] ... ok
{1} tempest.api.volume.admin.test_volumes_actions.VolumesActionsTest.test_volume_reset_status [5.671901s] ... ok
{3} setUpClass (tempest.api.volume.test_volumes_backup.VolumesBackupsV39Test) ... SKIPPED: Cinder backup feature disabled

======
Totals
======
Ran: 175 tests in 91.5663 sec.
 - Passed: 167
 - Skipped: 8
 - Expected Fail: 0
 - Unexpected Success: 0
 - Failed: 0
Sum of execute time for each test: 806.0493 sec.

==============
Worker Balance
==============
 - Worker 0 (28 tests) => 0:00:59.977801
 - Worker 1 (6 tests) => 0:01:29.709912
 - Worker 2 (3 tests) => 0:01:24.460005
 - Worker 3 (7 tests) => 0:00:59.165925
 - Worker 4 (8 tests) => 0:01:06.708470
 - Worker 5 (3 tests) => 0:00:58.439263
 - Worker 6 (3 tests) => 0:01:00.111653
 - Worker 7 (1 tests) => 0:00:25.427174
 - Worker 8 (2 tests) => 0:00:58.935728
 - Worker 9 (5 tests) => 0:00:31.204131
 - Worker 10 (2 tests) => 0:00:12.840714
 - Worker 11 (1 tests) => 0:00:10.964042
 - Worker 12 (2 tests) => 0:00:13.990324
 - Worker 13 (2 tests) => 0:00:03.809399
 - Worker 14 (7 tests) => 0:00:09.125280
 - Worker 15 (4 tests) => 0:00:08.821323
 - Worker 16 (5 tests) => 0:00:01.156690
 - Worker 17 (6 tests) => 0:00:02.280859
 - Worker 18 (18 tests) => 0:00:02.522682
 - Worker 19 (2 tests) => 0:00:01.910175
 - Worker 20 (3 tests) => 0:00:02.296264
 - Worker 21 (2 tests) => 0:00:01.777929
 - Worker 22 (2 tests) => 0:00:02.482015
 - Worker 23 (13 tests) => 0:00:00.724898
 - Worker 24 (2 tests) => 0:00:01.726232
 - Worker 25 (12 tests) => 0:00:02.055465
 - Worker 26 (5 tests) => 0:00:01.504637
 - Worker 27 (1 tests) => 0:00:01.155862
 - Worker 28 (4 tests) => 0:00:36.266218
 - Worker 29 (2 tests) => 0:00:01.142066
 - Worker 30 (1 tests) => 0:00:01.203413
 - Worker 31 (1 tests) => 0:00:00.914368
 - Worker 32 (2 tests) => 0:00:01.334720
 - Worker 33 (2 tests) => 0:00:00.834242
 - Worker 34 (2 tests) => 0:00:02.966329
 - Worker 35 (1 tests) => 0:00:00.343133
 - Worker 36 (2 tests) => 0:00:20.869014
 - Worker 37 (1 tests) => 0:00:08.628226
 - Worker 38 (1 tests) => 0:01:05.946921
 - Worker 39 (1 tests) => 0:01:06.032133
