{6} setUpClass (tempest.api.volume.admin.test_volume_retype.VolumeRetypeWithMigrationTest) ... SKIPPED: Cinder multi-backend feature disabled
{1} setUpClass (tempest.api.volume.admin.test_multi_backend.VolumeMultiBackendTest) ... SKIPPED: Cinder multi-backend feature disabled
{0} setUpClass (tempest.api.volume.admin.test_encrypted_volumes_extend.EncryptedVolumesExtendAttachedTest) ... SKIPPED: Attached encrypted volume extend is disabled.
{3} setUpClass (tempest.api.volume.test_volumes_backup.VolumesBackupsV39Test) ... SKIPPED: Cinder backup feature disabled
{24} tempest.api.volume.test_versions.VersionsTest.test_list_versions [0.009543s] ... ok
{21} tempest.api.volume.test_volumes_snapshots_negative.VolumesSnapshotNegativeTestJSON.test_create_snapshot_with_nonexistent_volume_id [1.341872s] ... ok
{24} tempest.api.volume.test_versions.VersionsTest.test_show_version [1.326648s] ... ok
{21} tempest.api.volume.test_volumes_snapshots_negative.VolumesSnapshotNegativeTestJSON.test_create_snapshot_without_passing_volume_id [0.390779s] ... ok
{27} tempest.api.volume.test_availability_zone.AvailabilityZoneTestJSON.test_get_availability_zone_list [1.221553s] ... ok
{21} tempest.api.volume.test_volumes_snapshots_negative.VolumesSnapshotNegativeTestJSON.test_list_snapshot_invalid_param_limit [0.054749s] ... ok
{33} tempest.api.volume.test_volumes_get.VolumesSummaryTest.test_show_volume_summary [1.030208s] ... ok
{21} tempest.api.volume.test_volumes_snapshots_negative.VolumesSnapshotNegativeTestJSON.test_list_snapshots_invalid_param_marker [0.023858s] ... ok
{22} tempest.api.volume.test_extensions.ExtensionsTestJSON.test_list_extensions [1.019584s] ... ok
{21} tempest.api.volume.test_volumes_snapshots_negative.VolumesSnapshotNegativeTestJSON.test_list_snapshots_invalid_param_sort [0.015115s] ... ok
{13} tempest.api.volume.admin.test_volume_quota_classes.VolumeQuotaClassesTest.test_show_default_quota [0.431344s] ... ok
{8} tempest.api.volume.admin.test_volume_services.VolumesServicesTestJSON.test_get_service_by_host_name [0.022957s] ... ok
{8} tempest.api.volume.admin.test_volume_services.VolumesServicesTestJSON.test_get_service_by_service_and_host_name [0.032266s] ... ok
{8} tempest.api.volume.admin.test_volume_services.VolumesServicesTestJSON.test_get_service_by_service_binary_name [0.083781s] ... ok
{16} tempest.api.volume.admin.test_volume_types_negative.VolumeTypesNegativeTest.test_create_volume_type_encryption_nonexistent_type_id [0.380252s] ... ok
{25} tempest.api.volume.admin.test_volume_hosts.VolumeHostsAdminTestsJSON.test_list_hosts [0.282858s] ... ok
{29} tempest.api.volume.admin.test_volume_services_negative.VolumeServicesNegativeTest.test_disable_log_reason_with_no_reason [0.180619s] ... ok
{29} tempest.api.volume.admin.test_volume_services_negative.VolumeServicesNegativeTest.test_disable_service_with_invalid_binary [0.241641s] ... ok
{26} tempest.api.volume.admin.test_volume_types_extra_specs_negative.ExtraSpecsNegativeTest.test_create_invalid_body [0.227939s] ... ok
{28} tempest.api.volume.admin.test_volume_pools.VolumePoolsAdminTestsJSON.test_get_pools_with_details [0.762968s] ... ok
{29} tempest.api.volume.admin.test_volume_services_negative.VolumeServicesNegativeTest.test_enable_service_with_invalid_host [0.556706s] ... ok
{26} tempest.api.volume.admin.test_volume_types_extra_specs_negative.ExtraSpecsNegativeTest.test_create_none_body [0.660516s] ... ok
{15} tempest.api.volume.admin.test_volume_types.VolumeTypesTest.test_volume_type_create_get_delete [1.671377s] ... ok
{18} tempest.api.volume.admin.test_volume_types_extra_specs.VolumeTypesExtraSpecsTest.test_volume_type_extra_spec_create_get_delete [1.521188s] ... ok
{16} tempest.api.volume.admin.test_volume_types_negative.VolumeTypesNegativeTest.test_create_volume_with_private_volume_type [1.451591s] ... ok
{29} tempest.api.volume.admin.test_volume_services_negative.VolumeServicesNegativeTest.test_freeze_host_with_invalid_host [0.442619s] ... ok
{26} tempest.api.volume.admin.test_volume_types_extra_specs_negative.ExtraSpecsNegativeTest.test_create_nonexistent_type_id [0.352811s] ... ok
{16} tempest.api.volume.admin.test_volume_types_negative.VolumeTypesNegativeTest.test_create_with_empty_name [0.251615s] ... ok
{29} tempest.api.volume.admin.test_volume_services_negative.VolumeServicesNegativeTest.test_thaw_host_with_invalid_host [0.146358s] ... ok
{28} tempest.api.volume.admin.test_volume_pools.VolumePoolsAdminTestsJSON.test_get_pools_without_details [1.139034s] ... ok
{25} tempest.api.volume.admin.test_volume_hosts.VolumeHostsAdminTestsJSON.test_show_host [1.502461s] ... ok
{26} tempest.api.volume.admin.test_volume_types_extra_specs_negative.ExtraSpecsNegativeTest.test_delete_nonexistent_volume_type_id [0.188989s] ... ok
{26} tempest.api.volume.admin.test_volume_types_extra_specs_negative.ExtraSpecsNegativeTest.test_get_nonexistent_extra_spec_name [0.081956s] ... ok
{26} tempest.api.volume.admin.test_volume_types_extra_specs_negative.ExtraSpecsNegativeTest.test_get_nonexistent_volume_type_id [0.022347s] ... ok
{18} tempest.api.volume.admin.test_volume_types_extra_specs.VolumeTypesExtraSpecsTest.test_volume_type_extra_specs_list [0.472535s] ... ok
{26} tempest.api.volume.admin.test_volume_types_extra_specs_negative.ExtraSpecsNegativeTest.test_list_nonexistent_volume_type_id [0.017424s] ... ok
{26} tempest.api.volume.admin.test_volume_types_extra_specs_negative.ExtraSpecsNegativeTest.test_update_multiple_extra_spec [0.014373s] ... ok
{26} tempest.api.volume.admin.test_volume_types_extra_specs_negative.ExtraSpecsNegativeTest.test_update_no_body [0.009714s] ... ok
{26} tempest.api.volume.admin.test_volume_types_extra_specs_negative.ExtraSpecsNegativeTest.test_update_none_extra_spec_id [0.088264s] ... ok
{26} tempest.api.volume.admin.test_volume_types_extra_specs_negative.ExtraSpecsNegativeTest.test_update_nonexistent_extra_spec_id [0.074658s] ... ok
{26} tempest.api.volume.admin.test_volume_types_extra_specs_negative.ExtraSpecsNegativeTest.test_update_nonexistent_type_id [0.021448s] ... ok
{16} tempest.api.volume.admin.test_volume_types_negative.VolumeTypesNegativeTest.test_create_with_repeated_name [0.596111s] ... ok
{16} tempest.api.volume.admin.test_volume_types_negative.VolumeTypesNegativeTest.test_delete_nonexistent_type_id [0.014765s] ... ok
{16} tempest.api.volume.admin.test_volume_types_negative.VolumeTypesNegativeTest.test_get_nonexistent_type_id [0.019120s] ... ok
{18} tempest.api.volume.admin.test_volume_types_extra_specs.VolumeTypesExtraSpecsTest.test_volume_type_extra_specs_update [0.521331s] ... ok
{15} tempest.api.volume.admin.test_volume_types.VolumeTypesTest.test_volume_type_encryption_create_get_update_delete [4.077384s] ... ok
{14} tempest.api.volume.admin.test_qos.QosSpecsTestJSON.test_associate_disassociate_qos [5.894968s] ... ok
{15} tempest.api.volume.admin.test_volume_types.VolumeTypesTest.test_volume_type_list [0.090061s] ... ok
{14} tempest.api.volume.admin.test_qos.QosSpecsTestJSON.test_create_delete_qos_with_back_end_consumer [0.342394s] ... ok
{13} tempest.api.volume.admin.test_volume_quota_classes.VolumeQuotaClassesTest.test_update_default_quota [6.299373s] ... ok
{14} tempest.api.volume.admin.test_qos.QosSpecsTestJSON.test_create_delete_qos_with_both_consumer [0.339726s] ... ok
{10} tempest.api.volume.admin.test_user_messages.UserMessagesTest.test_delete_message [7.049530s] ... ok
{14} tempest.api.volume.admin.test_qos.QosSpecsTestJSON.test_create_delete_qos_with_front_end_consumer [0.260038s] ... ok
{14} tempest.api.volume.admin.test_qos.QosSpecsTestJSON.test_get_qos [0.017366s] ... ok
{15} tempest.api.volume.admin.test_volume_types.VolumeTypesTest.test_volume_type_update [0.954302s] ... ok
{14} tempest.api.volume.admin.test_qos.QosSpecsTestJSON.test_list_qos [0.030983s] ... ok
{14} tempest.api.volume.admin.test_qos.QosSpecsTestJSON.test_set_unset_qos_key [0.256650s] ... ok
{4} tempest.api.volume.admin.test_volume_quotas.VolumeQuotasAdminTestJSON.test_delete_quota [6.176893s] ... ok
{4} tempest.api.volume.admin.test_volume_quotas.VolumeQuotasAdminTestJSON.test_list_default_quotas [0.108253s] ... ok
{4} tempest.api.volume.admin.test_volume_quotas.VolumeQuotasAdminTestJSON.test_list_quotas [0.054377s] ... ok
{11} tempest.api.volume.admin.test_volume_type_access.VolumeTypesAccessTest.test_volume_type_access_add [8.567119s] ... ok
{10} tempest.api.volume.admin.test_user_messages.UserMessagesTest.test_list_show_messages [2.926509s] ... ok
{9} tempest.api.volume.admin.test_volume_retype.VolumeRetypeWithoutMigrationTest.test_available_volume_retype [9.247504s] ... ok
{11} tempest.api.volume.admin.test_volume_type_access.VolumeTypesAccessTest.test_volume_type_access_list [0.818326s] ... ok
{23} tempest.api.volume.admin.test_backends_capabilities.BackendsCapabilitiesAdminTestsJSON.test_compare_volume_stats_values [26.751193s] ... ok
{23} tempest.api.volume.admin.test_backends_capabilities.BackendsCapabilitiesAdminTestsJSON.test_get_capabilities_backend [0.532751s] ... ok
{36} tempest.api.volume.test_volumes_snapshots.VolumesSnapshotTestJSON.test_snapshot_backup ... SKIPPED: Cinder backup is disabled
{17} tempest.api.volume.test_volume_metadata.VolumesMetadataTest.test_crud_volume_metadata [0.572862s] ... ok
{17} tempest.api.volume.test_volume_metadata.VolumesMetadataTest.test_update_show_volume_metadata_item [0.399285s] ... ok
{35} tempest.api.volume.test_volume_absolute_limits.AbsoluteLimitsTests.test_get_volume_absolute_limits [0.087976s] ... ok
{30} tempest.api.volume.admin.test_volume_quotas_negative.VolumeQuotasNegativeTestJSON.test_quota_volume_gigabytes [0.427857s] ... ok
{30} tempest.api.volume.admin.test_volume_quotas_negative.VolumeQuotasNegativeTestJSON.test_quota_volumes [0.318419s] ... ok
{19} tempest.api.volume.test_snapshot_metadata.SnapshotMetadataTestJSON.test_crud_snapshot_metadata [0.628668s] ... ok
{3} tempest.api.volume.test_volumes_clone_negative.VolumesCloneNegativeTest.test_create_from_volume_decreasing_size [49.518378s] ... ok
{19} tempest.api.volume.test_snapshot_metadata.SnapshotMetadataTestJSON.test_update_show_snapshot_metadata_item [0.618278s] ... ok
{8} tempest.api.volume.admin.test_volume_services.VolumesServicesTestJSON.test_get_service_by_volume_host_name [46.454876s] ... ok
{8} tempest.api.volume.admin.test_volume_services.VolumesServicesTestJSON.test_list_services [0.022954s] ... ok
{32} tempest.api.volume.admin.test_volume_snapshot_quotas_negative.VolumeSnapshotQuotasNegativeTestJSON.test_quota_volume_gigabytes_snapshots [0.942461s] ... ok
{32} tempest.api.volume.admin.test_volume_snapshot_quotas_negative.VolumeSnapshotQuotasNegativeTestJSON.test_quota_volume_snapshots [0.063740s] ... ok
{5} tempest.api.volume.admin.test_snapshots_actions.SnapshotsActionsTest.test_reset_snapshot_status [0.666917s] ... ok
{4} tempest.api.volume.admin.test_volume_quotas.VolumeQuotasAdminTestJSON.test_quota_usage [42.325026s] ... ok
{7} tempest.api.volume.test_volume_transfers.VolumesTransfersV357Test.test_create_get_list_accept_volume_transfer [50.830636s] ... ok
{1} tempest.api.volume.admin.test_volumes_actions.VolumesActionsTest.test_volume_force_delete_when_volume_is_attaching [31.627995s] ... ok
{6} tempest.api.volume.test_volume_transfers.VolumesTransfersTest.test_create_get_list_accept_volume_transfer [51.065536s] ... ok
{2} tempest.api.volume.test_volume_transfers.VolumesTransfersV355Test.test_create_get_list_accept_volume_transfer [53.332617s] ... ok
{36} tempest.api.volume.test_volumes_snapshots.VolumesSnapshotTestJSON.test_snapshot_create_get_list_update_delete [24.776705s] ... ok
{12} tempest.api.volume.test_volumes_negative.VolumesNegativeTest.test_attach_volumes_with_nonexistent_volume_id [29.550805s] ... ok
{20} tempest.api.volume.test_volumes_list.VolumesListTestJSON.test_volume_list [0.063318s] ... ok
{20} tempest.api.volume.test_volumes_list.VolumesListTestJSON.test_volume_list_by_name [0.072621s] ... ok
{20} tempest.api.volume.test_volumes_list.VolumesListTestJSON.test_volume_list_details_by_name [0.085934s] ... ok
{20} tempest.api.volume.test_volumes_list.VolumesListTestJSON.test_volume_list_details_pagination [0.313259s] ... ok
{20} tempest.api.volume.test_volumes_list.VolumesListTestJSON.test_volume_list_details_with_multiple_params [0.148395s] ... ok
{20} tempest.api.volume.test_volumes_list.VolumesListTestJSON.test_volume_list_pagination [0.246937s] ... ok
{20} tempest.api.volume.test_volumes_list.VolumesListTestJSON.test_volume_list_param_display_name_and_status [0.072283s] ... ok
{20} tempest.api.volume.test_volumes_list.VolumesListTestJSON.test_volume_list_with_detail_param_display_name_and_status [0.095764s] ... ok
{20} tempest.api.volume.test_volumes_list.VolumesListTestJSON.test_volume_list_with_detail_param_marker [0.094274s] ... ok
{20} tempest.api.volume.test_volumes_list.VolumesListTestJSON.test_volume_list_with_detail_param_metadata [0.111863s] ... ok
{20} tempest.api.volume.test_volumes_list.VolumesListTestJSON.test_volume_list_with_details [0.096899s] ... ok
{20} tempest.api.volume.test_volumes_list.VolumesListTestJSON.test_volume_list_with_param_metadata [0.100051s] ... ok
{12} tempest.api.volume.test_volumes_negative.VolumesNegativeTest.test_create_volume_from_deactivated_image [2.915183s] ... ok
{20} tempest.api.volume.test_volumes_list.VolumesListTestJSON.test_volumes_list_by_availability_zone [0.134525s] ... ok
{20} tempest.api.volume.test_volumes_list.VolumesListTestJSON.test_volumes_list_by_bootable [0.124189s] ... ok
{20} tempest.api.volume.test_volumes_list.VolumesListTestJSON.test_volumes_list_by_status [0.088976s] ... ok
{20} tempest.api.volume.test_volumes_list.VolumesListTestJSON.test_volumes_list_details_by_availability_zone [0.109129s] ... ok
{20} tempest.api.volume.test_volumes_list.VolumesListTestJSON.test_volumes_list_details_by_bootable [0.090479s] ... ok
{20} tempest.api.volume.test_volumes_list.VolumesListTestJSON.test_volumes_list_details_by_status [0.055291s] ... ok
{31} tempest.api.volume.test_volumes_actions.VolumesActionsTest.test_get_volume_attachment [29.732416s] ... ok
{37} tempest.api.volume.admin.test_volumes_list.VolumesListAdminTestJSON.test_volume_list_param_tenant [6.840287s] ... ok
{31} tempest.api.volume.test_volumes_actions.VolumesActionsTest.test_reserve_unreserve_volume [0.401766s] ... ok
{31} tempest.api.volume.test_volumes_actions.VolumesActionsTest.test_volume_bootable [0.715703s] ... ok
{0} tempest.api.volume.test_volumes_get.VolumesGetTest.test_volume_create_get_update_delete [71.935088s] ... ok
{31} tempest.api.volume.test_volumes_actions.VolumesActionsTest.test_volume_readonly_update [0.411910s] ... ok
{12} tempest.api.volume.test_volumes_negative.VolumesNegativeTest.test_create_volume_from_image_with_decreasing_size [2.554790s] ... ok
{12} tempest.api.volume.test_volumes_negative.VolumesNegativeTest.test_create_volume_with_invalid_size [0.012600s] ... ok
{12} tempest.api.volume.test_volumes_negative.VolumesNegativeTest.test_create_volume_with_nonexistent_snapshot_id [0.019013s] ... ok
{12} tempest.api.volume.test_volumes_negative.VolumesNegativeTest.test_create_volume_with_nonexistent_source_volid [0.044423s] ... ok
{12} tempest.api.volume.test_volumes_negative.VolumesNegativeTest.test_create_volume_with_nonexistent_volume_type [0.025970s] ... ok
{12} tempest.api.volume.test_volumes_negative.VolumesNegativeTest.test_create_volume_with_size_negative [0.020425s] ... ok
{12} tempest.api.volume.test_volumes_negative.VolumesNegativeTest.test_create_volume_with_size_zero [0.035215s] ... ok
{12} tempest.api.volume.test_volumes_negative.VolumesNegativeTest.test_create_volume_without_passing_size [0.025554s] ... ok
{12} tempest.api.volume.test_volumes_negative.VolumesNegativeTest.test_delete_invalid_volume_id [0.016212s] ... ok
{12} tempest.api.volume.test_volumes_negative.VolumesNegativeTest.test_delete_volume_without_passing_volume_id [0.010219s] ... ok
{12} tempest.api.volume.test_volumes_negative.VolumesNegativeTest.test_detach_volumes_with_invalid_volume_id [0.019015s] ... ok
{12} tempest.api.volume.test_volumes_negative.VolumesNegativeTest.test_get_invalid_volume_id [0.022617s] ... ok
{12} tempest.api.volume.test_volumes_negative.VolumesNegativeTest.test_get_volume_without_passing_volume_id [0.008912s] ... ok
{12} tempest.api.volume.test_volumes_negative.VolumesNegativeTest.test_list_volumes_detail_with_invalid_status [0.083688s] ... ok
{12} tempest.api.volume.test_volumes_negative.VolumesNegativeTest.test_list_volumes_detail_with_nonexistent_name [0.087152s] ... ok
{12} tempest.api.volume.test_volumes_negative.VolumesNegativeTest.test_list_volumes_with_invalid_status [0.045638s] ... ok
{12} tempest.api.volume.test_volumes_negative.VolumesNegativeTest.test_list_volumes_with_nonexistent_name [0.069856s] ... ok
{5} tempest.api.volume.admin.test_snapshots_actions.SnapshotsActionsTest.test_snapshot_force_delete_when_snapshot_is_creating [23.056618s] ... ok
{12} tempest.api.volume.test_volumes_negative.VolumesNegativeTest.test_reserve_volume_with_negative_volume_status [1.258465s] ... ok
{12} tempest.api.volume.test_volumes_negative.VolumesNegativeTest.test_reserve_volume_with_nonexistent_volume_id [0.023662s] ... ok
{12} tempest.api.volume.test_volumes_negative.VolumesNegativeTest.test_unreserve_volume_with_nonexistent_volume_id [0.021488s] ... ok
{12} tempest.api.volume.test_volumes_negative.VolumesNegativeTest.test_update_volume_with_empty_volume_id [0.007220s] ... ok
{12} tempest.api.volume.test_volumes_negative.VolumesNegativeTest.test_update_volume_with_invalid_volume_id [0.015724s] ... ok
{12} tempest.api.volume.test_volumes_negative.VolumesNegativeTest.test_update_volume_with_nonexistent_volume_id [0.016971s] ... ok
{12} tempest.api.volume.test_volumes_negative.VolumesNegativeTest.test_volume_delete_nonexistent_volume_id [0.020395s] ... ok
{7} tempest.api.volume.test_volume_transfers.VolumesTransfersV357Test.test_create_list_delete_volume_transfer [18.871784s] ... ok
{12} tempest.api.volume.test_volumes_negative.VolumesNegativeTest.test_volume_get_nonexistent_volume_id [0.022981s] ... ok
{34} tempest.api.volume.test_volumes_snapshots_list.VolumesSnapshotListTestJSON.test_snapshot_list_param_limit [0.043858s] ... ok
{34} tempest.api.volume.test_volumes_snapshots_list.VolumesSnapshotListTestJSON.test_snapshot_list_param_limit_equals_infinite [0.076831s] ... ok
{34} tempest.api.volume.test_volumes_snapshots_list.VolumesSnapshotListTestJSON.test_snapshot_list_param_limit_equals_zero [0.030502s] ... ok
{34} tempest.api.volume.test_volumes_snapshots_list.VolumesSnapshotListTestJSON.test_snapshot_list_param_marker [0.074281s] ... ok
{34} tempest.api.volume.test_volumes_snapshots_list.VolumesSnapshotListTestJSON.test_snapshot_list_param_offset [0.046280s] ... ok
{34} tempest.api.volume.test_volumes_snapshots_list.VolumesSnapshotListTestJSON.test_snapshot_list_param_sort_created_at_asc [0.036316s] ... ok
{34} tempest.api.volume.test_volumes_snapshots_list.VolumesSnapshotListTestJSON.test_snapshot_list_param_sort_created_at_desc [0.032085s] ... ok
{34} tempest.api.volume.test_volumes_snapshots_list.VolumesSnapshotListTestJSON.test_snapshot_list_param_sort_id_asc [0.032500s] ... ok
{34} tempest.api.volume.test_volumes_snapshots_list.VolumesSnapshotListTestJSON.test_snapshot_list_param_sort_id_desc [0.040727s] ... ok
{34} tempest.api.volume.test_volumes_snapshots_list.VolumesSnapshotListTestJSON.test_snapshot_list_param_sort_name_asc [0.046697s] ... ok
{34} tempest.api.volume.test_volumes_snapshots_list.VolumesSnapshotListTestJSON.test_snapshot_list_param_sort_name_desc [0.041309s] ... ok
{34} tempest.api.volume.test_volumes_snapshots_list.VolumesSnapshotListTestJSON.test_snapshots_list_details_with_params [0.135729s] ... ok
{4} tempest.api.volume.admin.test_volume_quotas.VolumeQuotasAdminTestJSON.test_quota_usage_after_volume_transfer [21.397272s] ... ok
{34} tempest.api.volume.test_volumes_snapshots_list.VolumesSnapshotListTestJSON.test_snapshots_list_with_params [0.120427s] ... ok
{4} tempest.api.volume.admin.test_volume_quotas.VolumeQuotasAdminTestJSON.test_show_quota_usage [0.101755s] ... ok
{1} tempest.api.volume.admin.test_volumes_actions.VolumesActionsTest.test_volume_force_delete_when_volume_is_creating [19.587819s] ... ok
{2} tempest.api.volume.test_volume_transfers.VolumesTransfersV355Test.test_create_list_delete_volume_transfer [17.811766s] ... ok
{4} tempest.api.volume.admin.test_volume_quotas.VolumeQuotasAdminTestJSON.test_update_all_quota_resources_for_tenant [0.697715s] ... ok
{6} tempest.api.volume.test_volume_transfers.VolumesTransfersTest.test_create_list_delete_volume_transfer [20.869607s] ... ok
{4} setUpClass (tempest.api.volume.admin.test_volumes_backup.VolumesBackupsAdminTest) ... SKIPPED: Cinder backup feature disabled
{2} setUpClass (tempest.api.volume.test_volumes_backup.VolumesBackupsTest) ... SKIPPED: Cinder backup feature disabled
{5} tempest.api.volume.admin.test_snapshots_actions.SnapshotsActionsTest.test_snapshot_force_delete_when_snapshot_is_deleting [13.271881s] ... ok
{38} tempest.api.volume.test_volume_delete_cascade.VolumesDeleteCascade.test_volume_delete_cascade [85.268666s] ... ok
{39} tempest.api.volume.test_volumes_clone.VolumesCloneTest.test_create_from_volume [87.038457s] ... ok
{1} tempest.api.volume.admin.test_volumes_actions.VolumesActionsTest.test_volume_force_delete_when_volume_is_error [13.451072s] ... ok
{5} tempest.api.volume.admin.test_snapshots_actions.SnapshotsActionsTest.test_snapshot_force_delete_when_snapshot_is_error [6.120883s] ... ok
{1} tempest.api.volume.admin.test_volumes_actions.VolumesActionsTest.test_volume_force_delete_when_volume_is_maintenance [7.371399s] ... ok
{5} tempest.api.volume.admin.test_snapshots_actions.SnapshotsActionsTest.test_snapshot_force_delete_when_snapshot_is_error_deleting [7.084949s] ... ok
{5} tempest.api.volume.admin.test_snapshots_actions.SnapshotsActionsTest.test_update_snapshot_status [0.331819s] ... ok
{0} tempest.api.volume.test_volumes_get.VolumesGetTest.test_volume_create_get_update_delete_as_clone [31.105929s] ... ok
{1} tempest.api.volume.admin.test_volumes_actions.VolumesActionsTest.test_volume_reset_status [7.737595s] ... ok
{5} setUpClass (tempest.api.volume.admin.test_volume_retype.VolumeRetypeMultiattachTest) ... SKIPPED: Volume multi-attach is not available.

======
Totals
======
Ran: 175 tests in 110.4251 sec.
 - Passed: 167
 - Skipped: 8
 - Expected Fail: 0
 - Unexpected Success: 0
 - Failed: 0
Sum of execute time for each test: 987.4273 sec.

==============
Worker Balance
==============
 - Worker 0 (3 tests) => 0:01:44.895293
 - Worker 1 (6 tests) => 0:01:45.647946
 - Worker 2 (3 tests) => 0:01:21.350360
 - Worker 3 (2 tests) => 0:00:51.370272
 - Worker 4 (8 tests) => 0:01:20.420537
 - Worker 5 (7 tests) => 0:00:58.294929
 - Worker 6 (3 tests) => 0:01:18.382474
 - Worker 7 (2 tests) => 0:01:09.711519
 - Worker 8 (5 tests) => 0:00:46.629256
 - Worker 9 (1 tests) => 0:00:09.247504
 - Worker 10 (2 tests) => 0:00:09.978549
 - Worker 11 (2 tests) => 0:00:09.388702
 - Worker 12 (27 tests) => 0:00:36.981856
 - Worker 13 (2 tests) => 0:00:06.732533
 - Worker 14 (7 tests) => 0:00:07.149837
 - Worker 15 (4 tests) => 0:00:06.798257
 - Worker 16 (6 tests) => 0:00:02.720285
 - Worker 17 (2 tests) => 0:00:00.975356
 - Worker 18 (3 tests) => 0:00:02.519070
 - Worker 19 (2 tests) => 0:00:01.255692
 - Worker 20 (18 tests) => 0:00:02.121769
 - Worker 21 (5 tests) => 0:00:01.830083
 - Worker 22 (1 tests) => 0:00:01.019584
 - Worker 23 (2 tests) => 0:00:27.286360
 - Worker 24 (2 tests) => 0:00:01.338008
 - Worker 25 (2 tests) => 0:00:01.787216
 - Worker 26 (12 tests) => 0:00:01.771454
 - Worker 27 (1 tests) => 0:00:01.221553
 - Worker 28 (2 tests) => 0:00:01.903846
 - Worker 29 (5 tests) => 0:00:01.573830
 - Worker 30 (2 tests) => 0:00:00.749324
 - Worker 31 (4 tests) => 0:00:31.274508
 - Worker 32 (2 tests) => 0:00:01.009483
 - Worker 33 (1 tests) => 0:00:01.030208
 - Worker 34 (13 tests) => 0:00:00.771056
 - Worker 35 (1 tests) => 0:00:00.087976
 - Worker 36 (2 tests) => 0:00:24.780894
 - Worker 37 (1 tests) => 0:00:06.840287
 - Worker 38 (1 tests) => 0:01:25.268666
 - Worker 39 (1 tests) => 0:01:27.038457
